title,article,url,company,category,reporter,space_index,datetime,year,month,day,hour,minute
火化之亂 殯葬業促中央明訂時間,"新冠疫情延燒至今2年多,死亡確診個案先前皆在24小時內火化,家屬往往無法見到最後一面。不過,指揮官陳時中日前卻指,未要求24小時內火化遺體,引發譁然,新北市府及殯葬業者都盼中央能說清楚火化時間,地方才能有所依循。殯葬業者更痛批「對民眾的質疑與批評,政府只會甩鍋」,衛福部不要將問題丟給家屬及殯葬業者。殯葬業者表示,許多家屬近期紛紛來電稱,「部長不是說24小時不用火化,為什麼之前還那麼快燒掉?」、「現在遺體可不可以晚一點燒掉,完整處理後事」、「那麼快燒掉感覺會對不起家人」,導致業者要頻頻解釋。業者指出,陳時中說,未規定確診者過世須在24小時內火化,衛福部根本是在玩文字遊戲。去年1月衛福部修訂的「醫療機構因應COVID-19感染管制措施指引」中,對「屍體處理」一項表示,遺體裝入屍袋後,就不可再打開,且應依《傳染病防治法》規定盡速火化或報請地方主管機關核准深埋。為減少風險,建議在醫院或接體車上入殮封棺後逕送火化場火化。業者說,疫情爆發以來,他們一直得面對家屬無法見親人最後一面的遺憾與痛苦,但他們也無能為力。就算不急著24小時內火化,但仍不得申請遺體寄存,且在屍袋不能打開下,也不能申請遺體洗身、著裝、化妝、大殮等服務,民眾希望能好好送家人最後一程的願望還是一場空。中華民國葬儀商業同業公會全國聯合會去年6月就認為,依衛福部的指導建議,將遺體於接體車上實施入殮,實有不妥,處理遺體已完全忽略傳統喪儀善終的做法,要求同業盡可能彌補不盡人情盡速處理遺體的遺憾。業者不滿表示,對民眾的質疑與批評,政府只會甩鍋,現在又改口不必在24小時內火化,但殯儀館的遺體暫存室的空調、冰櫃系統都互通,在擔心疫情擴散下,從以前到現在都不允許確診遺體暫冰存,也只能盡速火化。雖然有同業說要快準備冰櫃,但可行性不大,「這些活動式冰櫃要放哪?能放在民眾家中嗎?況且屍袋也不能打開,意義不大」,痛批衛福部不要只會將問題丟給家屬及殯葬業者。新北市葬儀商業同業公會理事長吳孟宗說,家屬因一句話產生誤解,導致殯葬業者要頻頻解釋,造成業者負擔,希望部長可以說明清楚,避免產生誤會。新北市衛生局表示,部分衛生所確曾接獲這2天往生確診者的家屬反映,「既然不用24小時內火化,那可挑選適合火化的好日子嗎?」但因中央目前仍未說清明確時間,他們也只能回答「仍須盡快。」新北市衛生局長陳潤秋說,新冠肺炎被列入法定傳染病第五類,跟伊波拉病毒屬同類,均須在24小時內通報,遺體24小時內盡速入殮火化,新冠肺炎則是火化或報請地方主管機關報准後深埋,因未訂出明確時間,卻又列在第五類,兩年來各地方主管機關都一直問中央時間點,但中央的回覆都是「盡速」,因未講清楚明確時間,所以大家都比照第五類傳染病在24小時內火化。",https://www.chinatimes.com/newspapers/20220605000282-260118,中時,中國時報,林郁平,"[150, 247, 411, 535, 630, 727, 806, 873, 962]",,,,,,
善終遭剝奪 醫嘆徒留一輩子遺憾,"新冠肺炎遺體處置風波延燒,不少個案都在死亡後24小時內火化,家屬無法見死者最後一面,中央流行疫情指揮中心雖表示,未規定醫院要在24小時內處置屍體,但醫界人士、殯葬業者不清楚相關規範,引發軒然大波,北市聯醫胸腔內科主治醫師蘇一峰昨發文感嘆,法規如剝奪死後弔念的過程,只是徒增一輩子的傷痛遺憾。蘇一峰日前發文指,染疫不幸死亡者強制短時間火化已不必要,台灣社區遍地都是病毒,何必強制遺體快速火化,造成家屬一輩子無法原諒自己的傷痛。貼文公布後,引發外界對24小時內火化的討論,醫界人士、殯葬業者透露不清楚規範,呼籲政府說明白。昨蘇一峰再度發文感嘆,老與病的過程讓人能接受死亡的來到,也來得及對親人道別、道歉、道謝,但感染症把過程縮短成幾天,讓家屬與死者措手不及地離別,心中留下無限遺憾。依《傳染病防治法》第50條規定,染患第5類傳染病之屍體,應於中央主管機關公告之期限內入殮並火化。疾管署官員表示,在2020年1月發出的公文指出,第5類法定傳染病除裂谷熱、黃熱病、MERS等6種傳染病外,都未有24小時內火化的時限,包括新型A型流感、新冠肺炎,遺體都為火化或報請地方主管機關後深埋,沒有時間上的限制。2021年5月,衛福部雖再發出公文,但僅修正新冠肺炎病人處置措施,將隔離治療地點新增「指定處所」,遺體處置維持不變,亦即也沒有規定須在24小時內火化。不過衛福部這項說法,從醫院、檢警到殯葬業者,沒有人清楚。",https://www.chinatimes.com/newspapers/20220605000290-260118,中時,中國時報,林周義,"[145, 259, 339]",,,,,,
藍委嗆 遺體燒了2年半 為何不早澄清,"新冠疫情肆虐2年多,確診死亡個案多在24小時內火化,但日前中央流行疫情中心指揮官陳時中卻說從未要求24小時內火化,引發爭議。藍委質疑,所以法務部、各地方官員、醫院及殯葬業者集體搞錯?彰化縣醫師公會前理事長蔡明忠則怒批,疫情2年多來有2600多名民眾死亡,受限24小時遺體須火化的防疫規定,多少家屬心痛只能淚眼隔著視訊,或僅有送行者代送最後一程,悲傷故事不斷上演,指揮中心都視而不見,或是冷血的認為這件事不重要?從醫院、衛生局到殯葬業都集體「誤解」,陳時中難辭其咎。國民黨立委洪孟楷也表示,2012年衛生署公告第五類法定傳染病明訂「24小時內入殮或火化」;去年中央流行疫情指揮中心副指揮官陳宗彥也曾公開表示,「地方政府實務上都會在24小時內火化」,代表指揮中心早知道相關標準作業流程。痛批陳的說法就是不想承擔責任。國民黨立委李貴敏也質疑,已執行2年餘的措施,現在陳時中卻說過去從沒要求,,但若政府沒有規定,各地官員、醫院及殯葬業者會一起搞錯?陳時中現在一副「誤會一場」否認,在開人民玩笑?國民黨立委溫玉霞舉例,疫情爆發初期,法務部長蔡清祥就曾表示法醫採取檢體後,若確認有傳染病,就應立即通知衛生機關,依法採最快速度處理、24小時內火化,陳時中現在的說法是指法務部長理解法令錯誤?陳的話聽在那些無法為親人送終的家屬耳裏情何以堪,疫情爆發2年半了,為何不早「澄清」?",https://www.chinatimes.com/newspapers/20220605000286-260118,中時,中國時報,周志豪,"[91, 232, 356, 443]",,,,,,
黃珊珊不披白袍 民眾黨轟取巧,"年底台北市長選舉,民眾黨傾向支持台北市副市長黃珊珊參選,不過,黃珊珊日前鬆口,自己重感情、喜歡親民黨;民眾黨主席柯文哲也說,黃珊珊不會代表民眾黨。相關說法,已在民眾黨內炸鍋,認為黃珊珊能有現在的民意支持,是靠柯文哲做機會表現,如今要獲得民眾黨的資源與支持,卻又不加入民眾黨,質疑黃珊珊是在取巧。黃珊珊近期因為負責台北市政府防疫相關工作,屢屢為了防疫政策炮轟民進黨政府,民調支持度扶搖直上。民眾黨內部民調顯示,黃珊珊若以民眾黨籍參選台北市長,支持度高於以無黨籍參選。民眾黨選戰小組召集人日前透露,近期有跟黃珊珊見面聊到選戰議題,針對黨籍問題,黃珊珊表態不排斥加入民眾黨;不過,事隔幾日,黃珊珊面對媒體詢問黨籍問題,表明自己喜歡親民黨,黨籍不是參選的重點,甚至連柯文哲都稱,黃珊珊不會代表民眾黨參選台北市長,令民眾黨人士感到錯愕。黨內人士指出,柯文哲指定黃珊珊是台北市長的接班人,也公開說唯一支持黃珊珊,黃珊珊能有現在的民意支持度,是靠柯文哲做機會給她表現,結果黃珊珊卻說跟親民黨有感情,表明不會退出親民黨,卻又要靠民眾黨的資源,有取巧的嫌疑。該名人士質疑,黃珊珊如果是重感情的人,當初為什麼會離開新黨加入親民黨,顯然就是為了政治利益做出的選擇,呼籲黃珊珊若要參選台北市長必須做出選擇,看是要加入民眾黨,但可以保有親民黨籍;或是不加入民眾黨,退出親民黨,以無黨籍參選,否則支持者難以接受。也有黨內人士分析,柯文哲表態黃珊珊不會代表民眾黨參選台北市長,一方面想要複製當年的選戰模式,訴求不分黨派,一來爭取討厭民進黨的民眾支持,也能吸納對國民黨表現失望的民眾認同;即便黃珊珊不掛民眾黨籍,外界也知道黃珊珊是柯文哲栽培及支持的對象,替柯文哲參選2024總統之路鋪路。面對恐無民眾黨籍的母雞協同作戰,有民眾黨市議員參選人擔憂,如果黃珊珊以無黨籍或親民黨籍參選,屆時是否也可以替其他黨派議員站台輔選?恐不利民眾黨市議員的選情,呼籲黨中央要把態度跟黃珊珊說清楚,避免造成支持者混亂。",https://www.chinatimes.com/newspapers/20220605000305-260118,中時,中國時報,林縉明,"[147, 232, 363, 470, 592, 728]",,,,,,
上山下海卻成年金孤兒 勞團籲納保,"九合一大選將屆,全台將有逾萬名候選人參與,競選團隊人數更會達上萬人,但這些人除了不是勞工保險的強制納保對象外,恐怕也不適用勞基法及勞工退休金條例,勞團表示,由於其退休生活保障也很重要,呼籲所有有獲得報酬的工作者,都應納保。「所有勞工應該都要納保」,全國產業總工會祕書長戴國榮說,現行職災保險雖然已保障所有登記有案的事業單位,但部分行業的勞工保險普通事故仍未強制納保,這些勞工退休後恐成「年金孤兒」,但工作者就是勞工,勞工納進勞工保險中,合情合理,政府也要保障其退休的經濟生活。新北市產業總工會理事長洪清福認為,「應該是有獲得報酬的工作就要加保」,而不是因為工作行業不同就不是加保對象,雖然職業災害保險納保範圍已擴大,但勞工保險普通事故保險範圍仍侷限,勞工除了職業災害需要幫助外,退休後的生活經濟保障也很重要,呼籲均應加保勞工保險。全國議會民代助理產業工會理事長吳香君認為,站在保障勞工權益立場,當然希望能不分規模、行業都能強制納保。",https://www.chinatimes.com/newspapers/20220605000315-260118,中時,中國時報,林良齊,"[111, 238, 365]",,,,,,
賴峰偉連任告急 藍民調定勝負,"國民黨年底縣市長選舉布局倒數,但離島澎湖縣與連江縣提名都陷內戰。其中,澎湖縣由副議長陳雙全挑戰爭取連任的縣長賴峰偉,傳近日將會展開協調式民調。連江縣則有副縣長王銘忠與地政局長曹爾元兩強相爭,黨部已擬定將開放參選。澎湖縣黨部主委許國政證實,國民黨年底澎湖縣長提名已由黨中央介入處理,目前正協調中,民調確實是最後可能的一種整合方式。許推估,最後提名人選應會在主席朱立倫回國後明朗。至於已退黨出國民黨的馬公市長葉竹林,國民黨黨務人士評估,葉參選年底澎湖縣長意志強烈,應已無整合空間,所以不會納入黨協調、整合對象。連江縣黨部主委陳雪生則表示,經與有意參選者協調,黨確定將開放參選,不會提名特定人選,相關規劃已向黨主席報告。至於提名時程,陳雪生指出,原則上會在國民黨全國各縣市提名近尾聲時再處理。黨務人士直言,連江縣的選情與選民支持結構與全國其他各縣市都大不相同,若由中常會提早通過開放,恐對其他黨內有競爭縣市錯誤引用,不宜過早處理。國民黨澎湖縣長提名陷內戰,陳雙全強勢挑戰賴峰偉。熟悉澎湖縣選舉的地方人士透露,近日就會展開協調式民調決勝負,其中對比式民調對象也確定鎖定民進黨澎湖縣議員陳慧玲,相關民調作業已獲黨中央核可。該地方人士表示,其實澎湖縣藍營內已做過兩次民調,最近一次民調,陳雙全贏賴峰偉約9.3%,大勝約陳慧玲13%。該人士說,賴峰偉政治資歷具一定高度,但已3任澎湖縣長,再加上2018年回鍋參選時也曾公開表示不會競選連任,是爭取連任硬傷;陳雙全雖長期在基層,但相對也對地方關係熟稔,還具整合葉竹林實力,是相對優勢。",https://www.chinatimes.com/newspapers/20220605000311-260118,中時,中國時報,周志豪,"[106, 188, 253, 307, 412, 506, 560]",,,,,,
2018是谷底 綠營:今年成長空間很大,"年底九合一大選,傳出民眾黨主席柯文哲向中間偏綠選民招手,盼吸納不滿民進黨執政及防疫表現的選民。對於柯文哲為了大選改變策略,是否將衝擊民進黨選情?民進黨內人士認為,2018年大選是民進黨的谷底,這次選舉不論縣市議員及縣市長,成長空間很大,無論是人民的感覺或大環境,都對民進黨有利,等疫情緩和時,民進黨就會變得更好。民進黨目前剩下尚未提名的縣市長選區,只剩徵召區,黨內人士看好,這波疫情6月下旬應該就會趨於穩定後下降,因此6月下旬再由身兼黨主席的蔡英文總統召集選對會,都還來得及討論;派系要角評估,接下來這一波提名,應該會落在新竹市、彰化縣等。對於台北市長人選,民進黨目前浮上檯面就是無任所大使林佳龍與衛福部長陳時中,但隨著初選徵召程序過渡期間,黨內競爭引爆的耳語,確實也動搖黨內團結。有黨內人士自嘲說,台北市長變成一個是「一人卡三都」的林佳龍,對上「全黨等一人」的陳時中。林前天已開始陸續提出台北市政策白皮書,但陳時中似乎還「坐困愁城」,對於英系不斷釋放,「陳時中是防疫象徵,不選台北市長會是大傷,不選就是證明防疫失敗」,並指台北市長人選7到8月都還可以提名。不難看出,英系力拱陳時中「鐵的決心」。黨內人士分析,參選機率頗高的台北市副市長黃珊珊表現好,確實對民進黨有利,預估黃應該有2成支持者,黃拉越高,民進黨當選機率越大。對於年底這一局,黨內人士認為,2018是民進黨較弱的時候,無論如何,這次都會比上次好,即便現在疫情那麼嚴重,但民眾對政府大多還是肯定,若疫情穩定,民進黨就可以回到高峰。",https://www.chinatimes.com/newspapers/20220605000307-260118,中時,中國時報,曾薏蘋,"[156, 270, 385, 498, 561]",,,,,,
競選團隊勞保 候選人說了算,"九合一大選將在年底登場,預估全台會有逾萬名參選人參與,競選團隊聘用的人數恐怕會更多,依勞工保險條例規定,政黨、擬參選人或候選人聘僱的競選團隊,不是勞工保險條例的強制納保對象,僅為自願加保對象,意謂若候選人未申報、助理恐怕只能是國民年金的納保對象,影響退休權益甚巨。某競選人聘用助理,僅幫其投保就業保險、職業災害保險,助理只能加保國民年金,如果助理非因公確診新冠肺炎居家照護7天,就無法申請勞保普通傷病給付、普通失能給付等。根據統計,截至去年年底為止,勞保老年年金給付平均年資為29.22年、平均每名勞工領取老年年金給付1萬7860元,若以相同條件試算,繳納國民年金無論採取A式或B式,最高只能請領約7200餘元。除了政黨、擬參選人或候選人等為非勞保的強制納保單位外,部分如診所、補教業、公寓大廈及社區管理委員會等,並未向經濟部登立公司、行號也不是強制納保單位。勞動部勞動保險司司長陳美女坦言,終極目標希望所有勞動者都要納入強制納保對象,但由於勞工保險普通事故保費較職災保險較高,若要比照職災保險納入各行業仍待各界討論,此外,勞保條例也允許非強制投保單位的事業單位,可以自願參加勞工保險。不過,勞保局提醒,5月1日職業災害勞工保險及保護法上路後,政黨、擬參選人或候選人就為職災保險的強制納保單位,此外如果符合就業保險法或勞工退休金條例也應依法納保或提繳,不會因為不是勞工保險強制納保對象就不用納保或提繳,若未幫勞工投保職災保險,可處2萬元至10萬元罰鍰,還會被公布名稱、負責人姓名等相關資訊。",https://www.chinatimes.com/newspapers/20220605000313-260118,中時,中國時報,林良齊,"[132, 306, 493]",,,,,,
團結之夜獨缺張善政 邱奕勝:純吃飯無關選舉,"國民黨桃園市長提名爭議愈演愈烈,中央盼加速整合之際,前台北市議員羅智強昨晚與桃園市議長邱奕勝、立委呂玉玲與魯明哲,以及多位國民黨籍市議員聚餐,現場卻沒有桃園市長參選人張善政的身影。羅智強昨炮轟,對黨主席朱立倫已不抱期望,諫言也聽不進,已是失格、失信又失能的領導者,成為年底國民黨選舉最大破口。國民黨桃園市長提名爭議迄今未落幕,昨晚的「餐敘」,出席的桃園市議員涂權吉證實,該場合是介紹中壢名產後順便聚餐,同場還有市議員梁為超和朱珍瑤,以及桃園市議會國民黨團總召徐其萬。至於為何沒邀請張善政,是因為臨時邀約。邱奕勝則表示,原本好幾天前就約好,端午節大家有時間吃個飯,也幫中壢50年老店新珍香酥糖推銷花生糖。他說,吃飯跟選舉沒有關係,只是很單純的餐會。對於黨主席朱立倫訪美自嘲「沒被提名的都來罵我,因主席就是要挨罵」,羅智強說,已沒把期望放在朱身上,他的諫言對方也聽不進,接下來對話對象並非黨中央或朱,而是同黨桃園市長參選人張善政,因他對張仍存有期待。到了晚間,羅智強更在臉書痛批朱立倫沒收桃園初選,霸道式的徵召張善政參選,苗栗已開第一槍,地方團結整合要求用初選民調決定縣長參選人。他說,欺騙社會大眾的朱立倫是沒有誠信、失格、失信也失能的領導者,所以今起連3天,會分別對張善政提出公正、自信與無私共3項建議,其中最核心的是「公正」,要張看看苗栗的東南自保運動,別成為朱立倫的共犯,相信也期待張能有「以大局為重」的智慧與風骨。同日在龍潭進行感恩里長之旅的呂玉玲則說,國民黨是全部人一體,主席的決定須經大家認同,黨的推進才會順利。",https://www.chinatimes.com/newspapers/20220605000309-260118,中時,中國時報,蔡明亘、桃園,"[146, 252, 323, 423, 609]",,,,,,
2022誰來做老大》彰化縣長 蔡英文視察彰化防疫 王惠美緊追請命3件事,"蔡英文總統4日訪彰化,彰化縣長王惠美頻頻利用機會與蔡總統咬耳朵,為彰化請命3件事,包括田中基督教醫院、綠線捷運及二林精密園區等3案,王惠美表示,請總統、中央政府看到彰化人的需要,希望能重視彰化,讓彰化可以穩健進步。蔡英文昨訪彰化基督教醫院,王惠美全程陪同,從大門口迎接後,一路跟隨,還視察兒童醫院,過程中不斷與總統咬耳朵,看得出來王惠美相當心急,不管是座談中、行進間,或蔡英文要上車前,都不斷地為彰化請命。王惠美受訪時表示,感謝總統關心彰化防疫,也利用機會向總統請命,共有3項建議,田中基督教醫院2018年衛福部就核准150床病床,後續也完成動土,但如今4年過去,遲遲沒有動作,所以利用總統到訪彰基,特別拜託總統支持田基。王惠美還拜託總統支持綠線捷運,她說,希望總統多多關心,讓台中銜接到彰化的綠線捷運能早日定案。另外就是二林精密園區,縣府2020年3月送件到現在,一直沒有做大會環評,因此再次拜託總統促成,希望總統看到彰化人的需要,讓彰化也能持續穩健地進步。翻開過去中央行政官員到訪彰化,王惠美從2018年開始,蔡英文總統、前副總統陳建仁、副總統賴清德、行政院長蘇貞昌、前交通部長林佳龍、交通部長王國材等到訪彰化時,都親自陪同並利用機會請命,儘管最後都被已讀不回,但仍堅持到底。不禁讓很多彰化人大嘆是不是被當成次等公民,不要選舉到了才關心彰化,不要再卡彰化了。",https://www.chinatimes.com/newspapers/20220605000354-260118,中時,中國時報,吳建輝,"[107, 203, 311, 430]",,,,,,
2022誰來做老大》苗栗縣長 苗栗鍾東錦圖挽狂瀾 謝福弘低調以對,"國民黨苗栗縣長參選人因立委徐志榮再度推辭繼續懸宕,苗栗縣議長鍾東錦展開18鄉鎮市祈福傾聽之旅,企圖力挽狂瀾,鍾東錦自認身為黨部主委,得全力輔選黨內其他參選同志。至於向來以黨內和諧為前提的謝福弘,依舊保持不忮不求,如黨中央提名他人,他願全力支持,如自己獲得提名,則全力以赴。這一個月來鍾東錦的心境可謂歷經冰火九重天,爭取縣長參選資格提名之路,處處艱難,但令他最為氣餒的事情,是他在拚盡全力,配合黨中央辦了百場四大公投宣講會,苗栗公投結果也是各縣市中成績最好的前2名,黨中央卻以粗暴的方式對他,似乎無視他還是國民黨苗栗縣黨部主委。鍾東錦認為黨中央來勸退他的言語和行動非常粗暴,但越是如此,卻更激發他奮戰鬥志,從上個月29日起鍾東錦展開18鄉鎮市的祈福傾聽之旅。傾聽之旅的第7站,鍾東錦來到苗栗市玉清宮,選區中藍營縣議員全員到齊,苗栗市長邱鎮軍與多數的市代表、里長、民間組織重要幹部近3百人出席聲援鍾東錦。面對眾多鄉親,鍾東錦忍不住傾訴這些時間以來,遭受黨中央粗暴對待的委曲,首度吐露祕書長黃健庭來苗栗找他,一見面說話就非常粗暴,當場被他趕出門外。但他明白自己身為黨部主委所須負的責任,就是要替所有參加這次選舉的藍軍同志,全力輔選順利勝選。另個飽受黨中央冷落的謝福弘,一度爭取獲得10人小組中7名大老支持連署,卻被黨中央潑了一盆冷水,直接表明黨中央就是要徐志榮,謝福弘低調自行北上,將這分包括有現任縣長徐耀昌、老縣長傅學鵬、徐志榮及陳超明2名立委等在內的7人連署書,親送至國民黨中央,由祕書長黃健庭親自收下,只是這份集合苗栗多數重要藍營大老的連署書,似乎仍不值得黨中央一瞥。以鴨子划水之姿投入縣長參選布局的謝福弘,依舊保持低調,不願咄咄逼人表達爭取出線,他最大的期望就是維持國民黨在苗栗的勝選,「雖然是成功不必在我,可如果是我,必定是全力以赴。」",https://www.chinatimes.com/newspapers/20220605000352-260118,中時,中國時報,謝明俊,"[136, 263, 400, 517, 684]",,,,,,
羅智強期盼他大局為重 張善政這樣說,"前台北市議員羅智強4日晚間在臉書點名,期盼桃園市長參選人張善政「大局為重」,張善政稍早在臉書發文,對造成紛擾致歉,指溝通不夠周延。張善政也說,年底的選舉必是硬仗,團結都不一定能贏,期盼立委呂玉玲、羅智強貢獻卓越智慧,扮演建設新桃園過程不可或缺的關鍵要角。國民黨在桃園市長提名引起爭議,黨主席朱立倫突然提名前行政院長張善政,第一時間讓已表態參選的呂玉玲、羅智強感到錯愕。羅智強4日晚間在臉書抨擊朱立倫,指他是選戰最大破口,也期盼張善政大局為重。張善政在臉書發文,指接受國民黨徵召,是經過一番深思熟慮後做出的決定。一旦承諾,自應全力以赴。但在徵召過程中,因溝通不夠周延,引發不小的爭議,深感抱歉。他也對呂玉玲、羅智強,議長邱奕勝表達抱歉。並提到邱已經諒解,羅也願意共同為桃園打拚。他提到,非常感謝2人不計個人得失的胸襟器度,呂玉玲進行感恩之旅,也沒有對他批評。又公開表示尊重黨中央的安排,並體諒我連日的忙碌,令我非常感心。張善政又說,桃園市長鄭文燦市政用力很深,年底選舉必然是硬仗,國民黨團結都不一定能贏,何況是不團结甚至分裂。他說,相信不久的將來「和邱議長、呂委員與充滿戰鬥力、創意的智強兄,一定會成為最堅强的團隊。再加上鲁明哲委員、萬美玲委員以及國民黨在地的議員、基層村里長。」一定能夠讓市民給他們改變桃園的機會。他最後說,盼望呂玉玲及羅智強能貢獻他們卓越的智慧,扮演建設新桃園過程中不可或缺的關鍵要角。",https://www.chinatimes.com/realtimenews/20220605000048-260407,中時,政治,賴佑維,"[127, 221, 338, 409, 557]",,,,,,
