title,article,url,company,category,reporter,space_index,datetime,year,month,day,hour,minute
北市府遭疑養網軍 蔡壁如:很多「網路義勇軍」幫柯文哲說明,"台北市政府近期被發現多個帳號上班時間在批踢踢發政治文,外界質疑養網軍,爭議持續延燒,台北市長柯文哲備詢時也被問到此事。民眾黨立委蔡壁如今,柯文哲話常被曲解,所以有很多「網路義勇軍」幫忙說明,並指出自己也深受網軍所害,強調民眾黨選舉經費是「0」,如何養網軍。蔡壁如透過臉書表示,柯文哲是個專業的醫師,在政治上因為「政治網紅」堀起,因為柯文通常用直白、一針見血的話,點出問題的核心,獲得人民的共鳴與好感,但也因過於直白,常常被有心人斷章取義,只截取其中的一、兩句,不管是做梗圖也好、做標題也好,惡意曲意解柯文哲的原意。蔡壁如說,所以後來很多人都看不下去,才會有很多「網路義勇軍」和「柯文哲逐字稿」的出現,在社群媒體上幫柯文哲解釋和說明。蔡壁如也表示,「網軍」是有人在背後指揮、有對價關係,針對特定的議題、同一個時間點,在網路上帶動風向、或刻意操作,但今年初她接下民眾黨選戰小組召集人的時候才知道,民眾黨關於選舉經費,根本是「0」,表示她們經費如此貧瘠,如何養網軍?針對「市府網軍」事件,蔡壁如提出2點聲明,表示「譴責」所有網軍行為,還說自己深受其害,但在我所知道的範圍內,譴責所有網軍的操作行為。蔡壁如說,保護台灣公共論壇空間自由、可信任的品質,台灣是民主國家,最可貴的就是言論的自由,但這個自由的空間,不應該成為任何政治角力或被政治力控制的地方,它的珍貴之處,就像藻礁一樣,消失了就再也回不來。蔡壁如表示,為什麼保護公共論壇空間的自由、及可信任的品質是那麼的重要,因為這是相信的力量,而重建信任,則是現在最重要的事,對於所有「有對價關係」的網軍行為,她期期以為不可,並且嚴厲譴責。",https://www.ftvnews.com.tw/news/detail/2022608W0076,民視,一般,,"[69, 128, 257, 316, 430, 496, 596]",2022-06-08 11:01,2022,6,8,11,1
新北消防局上演《楚門的世界》? 律師點出消防員恐觸犯「這些法」,"新北市2歲童「恩恩」染疫後不幸離世,而為了還原「消失的81分鐘」真相,恩恩爸6日前往新北消防局聽取報案錄音檔,結果被網友踢爆新北消防長官下令動員偽造報案,且有2件是演戲給恩恩爸聽的假案件,結果新北市消防局不滿決定提告。立委邱顯智今怒轟,宛如一場《楚門的世界》,只有恩恩爸不知道在演戲,而律師陳愷閎也點出,其涉案消防員可能觸犯《社會秩序維護法》、《消防法》及《刑法》,質疑新北市政府大費周章瞞天騙局,賠上公務員未來、淹蓋81分鐘真相,到底是為了什麼?一名自稱曾擔任新北市消防員的張姓網友,日前透過臉書直指恩恩爸到新北消防局聽取錄音檔時,消防局動員科室人員致電119「假報案」演給恩恩爸爸看,其中有2件還是演戲給恩恩爸聽的假案件。新北市消防局勤務中心主任李宇松今上午9時到地檢署按鈴申告,針對有心人士刻意操作輿論,訴請公正第三司法單位介入調查。李宇松表示,張姓網友提到「網內互打假報案、製造亂象、假裝有火警營造紛亂」、「2件演戲給恩恩爸聽的假案件」,這些都是張姓網友故意扭曲事實,當天是為了呈現災害出勤案件受理等模擬測試。他也強調,這已造成個人聲譽嚴重受損,他在這裡提出嚴重抗議。王薇君、立委邱顯智等人今天也召開記者會,將砲火瞄準怒轟「新北市政府」,特別是律師陳愷閎也指出,「謊報案件」事涉「法律責任」,可能違反《社會秩序維護法》第85條、《消防法》36條,可以處以1萬5千元以下罰金。另外,涉及「誣告」事項之刑事責任,以放火罪為例,最重可處一年以下有期徒刑。陳愷閎也提到,新北市政府對外稱是「模擬」,也就是以「假報案」經由公務員受理得知,所以可能觸犯《刑法》第213條登載不實、第214條使公務員登載於職務上不實等,刑度也在1至7年有期徒刑。特別是公務員在上班時間「假報案」,陳愷閎也拿出《刑法》第134條,公務員假借職務上之權力、機會或方法,以故意犯本章以外各罪者,加重其刑至二分之一。他解釋,新北市政府大費周章瞞天騙局,賠上公務員未來、淹蓋81分鐘真相,到底是為了什麼?這個自導自演瞞天騙局,請問市長侯友宜怎麼處理?",https://www.ftvnews.com.tw/news/detail/2022608W0085,民視,一般,,"[224, 370, 488, 628, 720]",2022-06-08 11:01,2022,6,8,11,1
蔡英文9日接見法國參議院訪團 親頒友台小組副主席「大綬卿雲勳章」,"法國參議院外交暨國防委員會副主席、友台小組副主席葛里歐(JoëlGuerriau)跨黨派國會議員訪團於今(8)日上午抵達台灣,展開至6月13日訪問行程。總統府發言人張惇涵表示,總統府除表達誠摯歡迎之意,總統蔡英文並將在6月9日上午於總統府接見訪團,頒贈葛里歐副主席「大綬卿雲勳章」,表彰及感謝其對於台法國會交流之卓著貢獻。張惇涵表示,此行是繼去年10月法國參議院友台小組主席李察(AlainRichard)訪團,及去年12月法國國民議會前議長戴扈傑(FrançoisdeRugy)訪團後,在短短一年內法國國會第三度組團訪台,再次印證台法關係日益緊密友好。張惇涵說明,此行也是葛里歐副主席繼2018年之後,第二度訪問台灣。本次訪團成員另包括:法國參議院財政委員會副主席艾伯雷議員(VincentEblé)、高夏帆議員(SylvieGoy-Chavent)、瓦特博磊議員(DanyWattebled),以及海路鐸議員(LudovicHaye)共5位跨黨派國會議員。張惇涵說明,葛里歐副主席是長年力挺台灣的國際重要友人。歷年來,為支持台灣參與「世界衛生大會」(WHA)及「國際刑警組織」(INTERPOL),多次向法國政府提出書面及口頭質詢。去年5月,更與參議院友台小組主席李察(AlainRichard)共同領銜「支持台灣參與國際組織工作」決議案,獲得參議院高票一致決通過,並創下法國參議院通過友台決議案的首例。張惇涵表示,台灣與法國為理念相近的民主夥伴,共享自由、平等、博愛與人權等普世價值,訪問團此行將就全球及區域安全情勢、科技創新、產業供應鏈及其他台法共同關注議題,與台灣各界交換意見。期待透過此次交流,推進台法關係持續密切合作,共同為全球民主韌性及繁榮發展積極貢獻正面力量。",https://www.ftvnews.com.tw/news/detail/2022608W0072,民視,一般,,"[32, 161, 195, 233, 235, 277, 346, 364, 388, 414, 430, 542, 604]",2022-06-08 10:49,2022,6,8,10,49
網爆「演給恩恩爸看」新北消防局開告 時力拿出「黑色鍋子」暗酸,"新北市2歲童「恩恩」染疫後不幸離世,而為了還原「消失的81分鐘」真相,恩恩爸6日前往新北消防局聽取報案錄音檔,結果被網友踢爆新北消防長官下令動員偽造報案,且有2件是演戲給恩恩爸聽的假案件,結果新北市消防局不滿決定提告。兒權會理事長、行動時代副總召王薇君今天拿出一個黑色鍋子,直指「李主任背了這個鍋子...侯友宜出來把這事情說清楚。」一名自稱曾擔任新北市消防員的張姓網友,日前透過臉書直指恩恩爸到新北消防局聽取錄音檔時,消防局動員科室人員致電119「假報案」演給恩恩爸爸看,其中有2件還是演戲給恩恩爸聽的假案件。新北市消防局勤務中心主任李宇松今上午9時到地檢署按鈴申告,針對有心人士刻意操作輿論,訴請公正第三司法單位介入調查。李宇松表示,張姓網友提到「網內互打假報案、製造亂象、假裝有火警營造紛亂」、「2件演戲給恩恩爸聽的假案件」,這些都是張姓網友故意扭曲事實,當天是為了呈現災害出勤案件受理等模擬測試。他也強調,這已造成個人聲譽嚴重受損,他在這裡提出嚴重抗議。對於造假切割錄音的部分,張姓網友在貼文提到,「恩恩爸聽取中斷錄音檔,相信消防局是做好萬全準備才拿出錄音檔,當恩恩爸質疑中斷部分,又是在怕什麼要來假造並切割錄音檔?」李宇松表示,外界認為他為了圓謊協助變造錄音,他會要求鑑定本案所有通聯紀錄、錄音檔等電子紀錄,查明有無被變造,來還自己的清白。王薇君、立委邱顯智等人今天也召開記者會,將砲火瞄準怒轟「新北市政府」,特別是王薇君高舉一個「黑色平底鍋」,對著鏡頭說:「李主任背了這個鍋子,我要送你這個鍋子,因為你真的很了不起,新北市政府也真的了不起,要不要負責,順便報一下金鐘獎,可能還得大獎。」王薇君說,新北市消防局演了一齣大戲,影響全台民眾對消防人員信任,一夕之間讓消防員都沾上汙點,大家也疑惑消防員有這麼糟糕?她怒轟,侯友宜要怎麼處理?是否出面勇敢承擔負責,不是只說盡力配合,因為整件事情荒腔走板,李主任一個人能背得起這個黑鍋嗎?",https://www.ftvnews.com.tw/news/detail/2022608W0068,民視,一般,,"[166, 312, 430, 574, 698]",2022-06-08 10:40,2022,6,8,10,40
新北消防局遭控「演戲給恩恩爸看」 邱顯智砲轟:宛如《楚門的世界》,"新北市2歲童「恩恩」染疫後不幸離世,而為了還原「消失的81分鐘真相」,恩恩爸6日前往新北消防局聽取報案錄音檔,結果被網友踢爆新北消防長官下令動員偽造報案,且有2件是演戲給恩恩爸聽的假案件。立委邱顯智怒轟,宛如一場《楚門的世界》,只有恩恩爸不知道在演戲。他質疑,新北市消防局為了圓一個謊,結果演了這一齣戲,到底是誰下了指令?一名自稱曾擔任新北市消防員的張姓網友,日前透過臉書直指恩恩爸到新北消防局聽取錄音檔時,消防局動員科室人員致電119「假報案」演給恩恩爸爸看,其中有2件還是演戲給恩恩爸聽的假案件。新北市消防局勤務中心主任李宇松今上午9時到地檢署按鈴申告,針對有心人士刻意操作輿論,訴請公正第三司法單位介入調查。王薇君、立委邱顯智等人今天也召開記者會,將砲火瞄準怒轟「新北市政府」,邱顯智指出,新北市消防局事前都沒有告知恩恩爸,宛如一場「楚門的世界」,只有恩恩爸不知道在演戲。他質疑,新北市消防局為了圓一個謊,結果演了這一齣戲,到底是誰下了指令?「真相只有一個...面對81分鐘到底發生什麼事情?」邱顯智說,昨天張姓消防員揭發後,新北市消防局竟然對此提告轉移焦點,讓他覺得實在是「莫名其妙」,理應鼓勵說真話、願意出來揭露事實的人,不是消滅提出問題的人,這是非常離譜,他希望新北市長侯友宜出來面對、給社會一個交代。",https://www.ftvnews.com.tw/news/detail/2022608W0063,民視,一般,,"[161, 307, 424]",2022-06-08 10:32,2022,6,8,10,32
新北抽掉3通關鍵譯文? 消防局:有補寄給恩恩爸,"新北市2歲童恩恩染疫離世,6月6日恩恩爸親赴新北消防局聽取報案錄音檔,不過,有網友在臉書爆料指控,消防局偽造報案讓恩恩爸看了「一場表演」,還有2件是演戲的「假案件」。對於恩恩爸通聯紀錄應有8通譯文,但新北只給5通,外界質疑另外3通被抽掉,新北消防局勤務中心主任李宇松則解釋,消防局有補給恩恩爸,透過掛號寄送下去。張姓網友昨在臉書爆料直指,恩恩爸爸6日到新北消防局局本部六樓聽取錄音檔,被引導到四樓勤務指揮中心觀看了「一場表演」。消防長官下令動員偽造報案,將所有無線電音量開到最大聲,且要求執勤員都大聲問」,為了營造環境嘈雜、充滿個資的假象,由消防局其它科室人員「網內互打」至勤務指揮中心「假報案」製造亂象,並下令強迫南雅分隊「假裝有火警」大聲呼喊無線電營造紛亂。對此,新北消防局稍解釋,恩恩爸爸在前一天主動表示想到指揮中心瞭解119作業環境,為了重現Omicron疫情爆發時,119進線量爆增忙碌情況,故還原當時話務繁忙情況讓他了解,疫情嚴峻當下,119內部作業環境就是如此忙碌。而且119協助恩恩就醫期間,119進線量達190通,比當下呈現狀況更為忙碌。今新北消防局勤務中心主任李宇松前往地檢署按鈴申告,接受媒體聯訪。媒體提問,當下是否有告知恩恩爸是模擬情況,李宇松強調,他的想法很單純,恩恩爸想了解119環境,他認為可以讓恩恩爸知道疫情高壓環境下,大家都是兢兢業業處理每個案子,呈現第一線防疫人員忙碌狀況,不過對於「恩恩爸誤解」比較不好意思。媒體追問,恩恩爸通聯紀錄應該要有8通譯文,但是新北只給5通,外界質疑另外3通被抽掉,李宇松解釋,恩恩爸首次到市府領取就要求另外3通,消防局隔2天就有補給恩恩爸,透過掛號寄送下去。針對有心人士操作,消防局是否會追查內部消息來源,李宇松則說,今天主要就是對張姓網友提告,請檢察官還原事實真相。針對連日紛擾有心人士刻意操作輿論,嚴重影響防疫人員士氣,影響個人及本局聲譽,訴請公正第三司法單位介入調查,將以刑法第310條第2項加重誹謗罪,對張姓網友提出告訴。",https://www.ftvnews.com.tw/news/detail/2022608W0054,民視,一般,,"[156, 331, 478]",2022-06-08 10:25,2022,6,8,10,25
新北消防局演一齣戲給恩恩爸看? 時力怒轟:報金鐘獎還可能得獎,"新北市2歲童「恩恩」染疫後不幸離世,而為了還原「消失的81分鐘真相」,恩恩爸6日前往新北消防局聽取報案錄音檔,結果被網友踢爆新北消防長官下令動員偽造報案,且有2件是演戲給恩恩爸聽的假案件。兒權會理事長、行動時代副總召王薇君怒轟,新北市消防局演了一齣大戲,影響全台民眾對消防人員信任,一夕之間讓消防員都沾上汙點,她也拿出一個黑色鍋子,直指「李主任背了這個鍋子...新北市政府可以報金鐘獎,可能還得大獎...請侯友宜出來把這事情說清楚。」一名自稱曾擔任新北市消防員的張姓網友,日前透過臉書直指恩恩爸到新北消防局聽取錄音檔時,消防局動員科室人員致電119「假報案」演給恩恩爸爸看,其中有2件還是演戲給恩恩爸聽的假案件。新北市消防局勤務中心主任李宇松今上午9時到地檢署按鈴申告,針對有心人士刻意操作輿論,訴請公正第三司法單位介入調查。李宇松表示,張姓網友提到「網內互打假報案、製造亂象、假裝有火警營造紛亂」、「2件演戲給恩恩爸聽的假案件」,這些都是張姓網友故意扭曲事實,當天是為了呈現災害出勤案件受理等模擬測試。他也強調,這已造成個人聲譽嚴重受損,他在這裡提出嚴重抗議。王薇君、立委邱顯智等人今天也召開記者會,將砲火瞄準怒轟「新北市政府」,特別是王薇君高舉一個「黑色平底鍋」,對著鏡頭說:「李主任背了這個鍋子,我要送你這個鍋子,因為你真的很了不起,新北市政府也真的了不起,要不要負責,順便報一下金鐘獎,可能還得大獎。」王薇君說,新北市消防局演了一齣大戲,影響全台民眾對消防人員信任,一夕之間讓消防員都沾上汙點,大家也疑惑消防員有這麼糟糕?她怒轟,侯友宜要怎麼處理?是否出面勇敢承擔負責,不是只說盡力配合,因為整件事情荒腔走板,李主任一個人能背得起這個黑鍋嗎?王薇君強調,侯友宜應該出來把這事情說清楚、講明白,不能因新北市消防局演了一個大戲,而影響全台敬業的消防員,特別是網路上一片笑聲,尤其在疫情嚴峻下,新北市消防局演戲佔了救護線路、人力,基層無辜、高層應扛起責任來。",https://www.ftvnews.com.tw/news/detail/2022608W0052,民視,一般,,"[217, 363, 481, 605, 725]",2022-06-08 10:19,2022,6,8,10,19
羅智強送「這句話」給陳時中 籲成全台灣防疫、別選台北市長,"國民黨前台北市議員羅智強宣布退出桃園市長選舉,並以《成全》這首歌詞表達心境,「成全了你的瀟灑與冒險,成全了我的碧海藍天」、「一個人的成全好過一群人的糾結」。他今日繼續在桃園行腳祈福,喊話衛福部長、指揮官陳時中也「成全台灣的防疫」,應回歸專心對抗疫情,不要糾結於要不要選台北市長。國民黨突襲徵召前行政院長張善政參選桃園,羅智強轉而在桃園展開行腳祈福,並向張善政「獻策」,希望對方「補正程序正義」卻遭軟性拒絕,羅智強便停止獻策,宣布退出桃園市長選舉。羅智強今行腳,受訪時被問及是否加入張善政的團隊幫忙打選戰,他回應,自己對桃園祈福這件事有承諾,所以會繼續行腳、傾聽人民聲音,「我隨時都在街頭,歡迎任何人參加」。至於是否替黨籍市議員或其他在野黨輔選,他表示,政黨之間雖然有競爭,但更在乎民主制衡價值,如果幫的上忙對方也不嫌棄,在能力範圍內一定會試著協助。談及陳時中,羅智強直言,希望他也成全台灣的防疫,不要糾結要不要選台北市長,應回到防疫角色,告訴民進黨不接受提名徵召,相信如此才能贏得更多信任。他認為,「陳時中角色非常重要,他是當前台灣比總統蔡英文還重要的人,可以說台灣人的性命也掌握在他手中,最近他確實讓人感覺到有一點分心」。羅智強說,在疫情嚴峻之下,防疫陣前換將不是好事。他強調,自己不是從黨派角度來看,因為現在沒有要參選桃園或台北市長了,陳時中成不成為市長候選人跟他沒有政治利益關係,不過要給陳時中忠告,就像《插秧詩》中的詩句「原來退步是向前」,送給陳時中這句話,建議他專心防疫。另一方面,台北市長柯文哲昨表示,跟羅智強交情不錯,但不曉得羅智強現在怎麼辦,接下來會再找機會跟他談談看。羅智強也認同兩人私下交情佳,感謝柯文哲的關心,會在行腳告一段落後找時間拜訪。",https://www.ftvnews.com.tw/news/detail/2022608W0049,民視,一般,,"[139, 223, 374, 512, 641]",2022-06-08 10:09,2022,6,8,10,9
林志玲曬牽手照甜喊平安3Q! 陳柏惟腦補「1舉動」網笑翻:臉皮很厚喔,"台灣第一名模林志玲2019年與日本男團「放浪兄弟」成員AKIRA結婚,婚後定居日本享受甜蜜生活,今年1月31日,更宣布自己當媽媽的好消息。日前,林志玲發文慶祝結婚3週年,分享和老公、兒子的牽手照,寫下「一家3口牽手手,平平安安3Q,平淡就是福。」,結果竟意外釣出綽號3Q的陳柏惟。林志玲(6日)在社群平台罕PO全家福,可以看到兒子穿著印著3的綠色衣服,白嫩的小手抓著爸爸AKIRA、媽媽林志玲的大手,林志玲也在文中寫下,3週年,一家3口牽手手,平平安安3Q,平淡就是福,同時標註,剛剛好的幸福,剛剛好的優雅。婚後定居在日本的林志玲,重心逐漸轉往家庭,完全沉浸於當媽媽的喜悅與滿足之中。對此,陳柏惟(7日)轉發林志玲貼文,並針對文中的「平平安安3Q」回應「我會平平安安的,謝謝解接。」,貼文曝光後,陳柏惟的腦補行為笑翻眾人,馬上引來各方吐槽「是不是腦霧」、「頭真的傷的不輕」、「臉皮很厚內XD」、「是不是還沒吃藥」、「自肥!」、「時間到!別做夢了」、「好煩唷你哈哈哈」,陳柏惟也在留言區幽默回覆「概括承受喔,我知道你只是忌妒」、「沒關係喔,吃醋難免喔、體會喔」。",https://www.ftvnews.com.tw/news/detail/2022608W0041,民視,一般,張婷瑗,"[140, 292]",2022-06-08 09:54,2022,6,8,9,54
接受德國媒體專訪 謝志偉曝中國與俄國「極大共同點」:病態民族主義,"駐德代表謝志偉5月底接受德國媒體訪問談論俄羅斯入侵烏克蘭引發中國武力犯台的憂慮,謝志偉本月再度接受德國媒體專訪談論俄烏戰爭與兩岸情勢。謝志偉提到,俄羅斯總統普丁對烏克蘭的態度,與中國對台灣的認知之間有極大共同點,就是想要倒轉時間之輪,稱曾為一家人就要在一起,這兩者都是病態的民族主義。謝志偉說,台灣人是自由的燈塔,台灣的民主威脅到中國,如同烏克蘭對俄羅斯的威脅。駐德代表處在臉書貼出「德國第二電視台」(ZDF)專訪謝志偉的訪談內容,該報導在6月5日刊出。報導首先提到,中國與台灣之間的緊張關係升高,台灣駐德代表說,北京使盡全力恐嚇台灣;外交官謝志偉在德國代表台灣,他在專訪中談到對中國的不信任,俄羅斯在烏克蘭行徑的類比,以及他的國家對德國政府的期待。電視台提問,近來有數十架中國軍機侵入台灣防空識別區,這只是恫嚇的手段嗎?謝志偉回應,不僅於此,中國還甚至加劇武嚇、使盡全力恐嚇台灣,中國稱只要願意,隨時可以發動侵略戰爭,謝志偉認為「這不是新鮮事」,但近來中國更密集地推動這些做法。只要發生某件事,中國吞併台灣不用理由,只要藉口。謝志偉說,去年全世界下海啟用的戰艦有四成來自中國,中國有79艘潛艦,台灣只有老舊的4艘,只要中國願意,就有能力攻擊台灣。電視台追問,儘管目前的烏克蘭局勢?謝志偉回應,針對俄羅斯的侵烏戰爭有兩種看法。謝志偉指出,大部分的歐洲專家與戰略人士認為中國領導人習近平在俄羅斯挫敗後,暫時不會染指台灣,但也有可能是習近平說,將發動殘忍與有效率的閃電戰。在72小時內同時轟炸台灣五個重要的政治、經濟和文化中心,盟軍可能會來不及馳援。謝志偉還說,中國「可能昨天就攻擊我們了」,自從天安門大屠殺以來,台灣不再相信中共,歐洲人的邏輯不必然適用於中國。他說,當中國認為「我們辦得到」,那麼中國就必然會這麼做。電視台詢問,中國對台與俄羅斯對烏克蘭的侵略戰爭有類比之處嗎?謝志偉回應,如果讀了普丁關於俄羅斯與烏克蘭歷史的文章,會在普丁對烏克蘭的態度與中國對台灣的認知之間發現極大的共同點,「這兩者都是病態的民族主義」,普丁和習近平都想倒轉時間之輪。謝志偉表示,如果說曾為一家人,所以就必須在一起,「那這世界會發展成什麼模樣?」他強調,一個民主不能成為一個獨裁的一部分,台灣人是自由的燈塔,台灣的民主威脅到中國,如同烏克蘭對俄羅斯的威脅。對於德國對台灣是否表現出足夠的支持,謝志偉認為,這取決於觀看的角度。他說,原則上台灣很感謝德國,德國聯邦國會首度支持台灣參與WHO,德國衛生部長KarlLauterbach明確提及台灣,要求WHO納入台灣。當然還有不足之處需要改進,那麼情況就會變得更好。電視台提到,但如果中國攻擊台灣,德國並沒有答應軍事援助台灣。謝志偉則說「目前暫時沒有」,但台灣在許多方面是重要且不可或缺的,例如半導體生產。德國人、歐洲人和美國人肯定認知到這點,如果失去台灣,失去的不只是一個強勁的經濟夥伴。電視台詢問,若撇開軍事,德國還可以做什麼來支持台灣?謝志偉回應,最好當然是德國承認台灣為一個主權國家,但這還需要時間。他說,德國人現在必須思考所謂的一中政策是否合宜,自台灣民主化以來,該政策已變得多餘,台灣與中國不再競爭一中代表權,這裡是一個獨裁與一個民主在競爭,「我會建議德國放棄一中政策,而去推動一個較符合時代精神的對中政策」。",https://www.ftvnews.com.tw/news/detail/2022608W0034,民視,一般,,"[181, 325, 464, 563, 673, 757, 875, 969, 1045, 1096, 1208]",2022-06-08 09:52,2022,6,8,9,52
