title,article,url,company,category,reporter,space_index,datetime,year,month,day,hour,minute
柯文哲再嗆中央防疫「瞎指揮」 黃珊珊曝關鍵問題,"為了舒緩篩檢量能,指揮中心21日在松山機場新設一座大型篩檢站,卻遭到台北市長柯文哲批評戰術佈置錯誤,瞎指揮造成地方困擾,看似再次點燃於中央的戰火。副市長黃珊珊22日則進一步說明關於新設篩檢站台北市的立場,並強調藥品是否足夠才是問題的癥結。黃珊珊說,中央在松山機場新設篩檢站前,衛福部醫福會執行長王必勝有來詢問她是否要再設新的篩檢站,她當下就表示,台北市設置篩檢站的策略是,第一時間先請各大醫院成立急門診,紓解急診壓力,第二步設立三大車來速採檢急門診站,第三步設立台大醫院篩檢站,之後視各急門診篩檢站的預約狀況,參酌是否再開設新的篩檢站。黃珊珊認為,要增加採檢量能,其實是可以先在現有站點延長服務時間或增加採檢人力,更重要是採檢後的實驗室量能,應該是掌握好實驗室出報告的量能,再決定要不要新設採檢站,否則,設了採檢站,PCR結果不能即時出報告,也不見得是最好的選擇。黃珊珊表示,中央有廣設篩檢站的命令要求前,台北市就因應疫情設置大型車來速採檢站,現有站點量能還可擴充,不過目前其實採檢人數有些鈍化,急門診已經少見大量排隊人潮。保護醫院量能是台北市政府的最高指導原則,打仗需要各方的力量,但絕對不能讓醫護人員疲於奔命、消耗戰力,所以,新設採檢站,應以醫院方便最重要,同樣的,設置篩檢站需要醫院人力及實驗室的量能,台北多開設篩檢站當然是好事,但現在的重點工作不是增加PCR,反而應該是以照顧有症狀的確診者為主。黃珊珊說,如果要再設採檢站,她會設置車來速的急門診,地點也都已經想好,以急門診為主,看診拿藥免下車,PCR留給需要保險或請假的人,以後的車來速就是所謂的「院外門診」,取代醫院急診室大排長龍的快篩陽急門診,也可以用接駁車把醫院門口的排隊人潮已防疫巴士送到車來速快速通關,現在萬芳醫院已使用接駁車讓一般沒有車輛的民眾到車來速採檢取藥,解決急診室外的人擠人問題。黃珊珊指出,施政有輕重緩急,每天八九萬確診案例,PCR採檢量能與實際狀況會越差越大,大量黑數讓PCR採檢已無實質意義,快篩陽性民眾先停下來休養比較重要,有症狀加快篩陽,醫生臨床判斷認定為確診後給予藥物治療,是現在65歲以上民眾的認定方式,我也不明白,65歲以下為何就一定要用PCR才能認定為確診,其實,就是藥品不足,如果藥品足夠,至少可以讓高風險因子的民眾優先使用藥品,因為藥品不足,所以一再糾結在PCR檢測,就像疫苗不足的時候一樣,只好用年齡去區分。",https://www.ettoday.net/news/20220522/2256325.htm,東森,政治,皮心瑀,"[119, 268, 382, 602, 780, 807]",2022-05-22 10:37,2022,5,22,10,37
「國民黨應學學AV女優怎麼團結」 藍營副發言人看完也留言了,"國民黨突徵召前行政院長張善政參選桃園市長,引發地方不滿。面對藍營桃園之亂,媒體人朱凱翔臉書發文酸,看到彩美旬果、小島南,與天使萌,都連名送花祝賀上原亞衣演出順利,「國民黨應該好好學學人家怎麼團結。」看到貼文的國民黨副發言人、台北市議員擬參選人楊植斗則留言回覆,「好人一生平安」。對於桃園市長人選爭議,國民黨21日晚間發出聲明,黨主席朱立倫與秘書長黃健庭及黨務幹部開會,討論桃園市長提名後地方選情、各界意見及支持者心聲。朱立倫強調,對提名紛擾致歉,所有的責難,他都會一肩扛起,但桃園一定要贏,盼黨內團結迎向勝利。目前,為了爭取桃園市長提名不惜在桃園置產、辭掉台北市議員的羅智強已經宣布下一步,將走遍桃園13區,共516里,傾聽市民在疫情下的痛苦,反映給在地的民意代表,希望能夠解決問題;而同樣表態投入大選的立委呂玉玲表示「不排除任何動作」,而議長邱奕勝則陸續退出黨內群組。",https://www.ettoday.net/news/20220522/2256323.htm,東森,政治,,"[99, 139, 255]",2022-05-22 10:16,2022,5,22,10,16
為爭選桃園市長失業 羅智強被「突襲」後宣布下一步,"國民黨桃園市長人選終於確定,由前行政院長張善政參選,但突襲式的徵召卻引爆地方不滿情緒。為了爭取提名不惜在桃園置產、辭掉台北市議員的羅智強宣布下一步,將走遍桃園13區,共516里,傾聽市民在疫情下的痛苦,反映給在地的民意代表,希望能夠解決問題。羅智強說,這一陣子,很多人為他不捨,但個人的委屈不足掛齒,真正讓他難過的是,疫情蔓延下,許多人民的痛苦,自己想要為這群深受疫情之苦的民眾貢獻棉薄之力,但已無公職的他,沒有行政官員的公權力,也沒有民意代表的監督權,能做的有限,只能用腳祈福桃園,用耳傾聽民苦,為民喉舌,所以他決定展開「祈福走桃園,傾聽人民苦」。羅智強指出,他會結合「桃園千里行」,和他新成立的「桃園疫情關懷中心」,把桃園走透透,幫助人民,23日早上八點,就會從中壢火車站出發,一步一腳印,為桃園祈福。對於桃園市長人選爭議,國民黨21日晚間發出聲明,黨主席朱立倫與秘書長黃健庭及黨務幹部開會,討論桃園市長提名後地方選情、各界意見及支持者心聲。朱立倫強調,對提名紛擾致歉,所有的責難,他都會一肩扛起,但桃園一定要贏,盼黨內團結迎向勝利。",https://www.ettoday.net/news/20220522/2256324.htm,東森,政治,皮心瑀,"[121, 275, 353]",2022-05-22 10:00,2022,5,22,10,0
「馬英九自我矮化、配合中共一中框架」 民進黨:國際笑柄,"針對台灣參與世界衛生大會(WHA)的議題,前總統馬英九宣稱,「因為支持『一中各表的九二共識』,所以8年我國年年收到WHO邀請」,民進黨表示不以為然,馬英九竟以矮化自己、配合中共的一中框架,來加入世界衛生大會為榮。民進黨表示,台灣完整參與「世界衛生組織」(WHO),是基於全球公衛及防疫體系不容有漏洞及破口,台灣的防疫經驗也有助於貢獻國際醫衛及全球防疫合作,完全符合全人類衛生的共同利益,也是舉世認同的合理訴求。民進黨指出,不僅美國政府強烈主張世界衛生組織(WHO)以觀察員身分邀請台灣參與,包含歐洲議會在內,共有34國,1504位國會議員也致函世界衛生組織,強力聲援台灣出席WHA。不過,民進黨表示,當世界諸多國家紛紛為台灣發聲、幫助台灣參與世界衛生大會,台灣卻出了一個前總統不顧公平正義與國家尊嚴,自以為驕傲地以受到中共幫助才能加入WHA為榮。民進黨指出,在全球疫情嚴峻的當下,馬英九至今仍然持續配合中共的兩岸論述主旋律,倡議毫無共識、不合時宜的「九二共識」,不僅無法解決當前兩岸問題,在全球民主國家聲援台灣參加WHA之際,馬英九此舉簡直是徹底自我矮化並徒留國際笑柄。",https://www.ettoday.net/news/20220522/2256335.htm,東森,政治,陶本和,"[106, 205, 245, 291, 373]",2022-05-22 09:42,2022,5,22,9,42
馬英九執政每年參與WHA 戴湘儀 :蔡英文推給中國無法解決問題,"第75屆世界衛生大會(WHA)22日在瑞士日內瓦召開,我國未收到出席邀請函,前總統馬英九8年任內則是每年獲邀參加WHA。新北市府前副發言人、新莊區市議員參選人戴湘儀認為,蔡政府再推給兩岸關係、中國大陸的打壓,無法解決根本問題。戴湘儀表示,WHA是世界衛生組織(WHO)重要的決策機構,參與的會員國將討論許多重要議題,尤其是現在不分國界都面臨疫情的肆虐,延伸出許多民生問題,在這樣的關鍵時刻,我們的政府還要再讓台灣孤軍奮戰嗎?我們的政府還要看著百姓受苦嗎?戴湘儀指出,這次我國又沒有被受邀,蔡政府再推給兩岸關係、中國大陸的打壓,其實根本的問題,是現在的中央政府,處理不了兩岸問題、解決不了台灣在國際組織中碰上的困難。戴湘儀說,宣示主權固然重要,但顯然政府在對外關係上,出了很大的問題,才會讓台灣再度被排擠在世界衛生大會之外。問題的核心在於「兩岸之間無法互信」,戴湘儀表示,馬英九執政的8年中,雙方有互信基礎,有順暢的溝通管道,因此在敏感的情況下,我們還是可以參與國際組織。從2009年台灣開始參與WHA,在馬前總統任內的連續幾年,都參加了世衛大會,直到2016年之後,世界衛生組織就再也沒向台灣發函了。戴湘儀表示,看著確診數不斷上升的疫情,排隊成群的民眾為了快篩、為了看診PCR而焦頭爛額,我想,政府能做的可以更多,不是只有什麼都是中國大陸打壓,把錯推給別人,讓自己好過,人民並沒有更好過。",https://www.ettoday.net/news/20220522/2256306.htm,東森,政治,徐政璿,"[113, 227, 307, 361, 500]",2022-05-22 09:19,2022,5,22,9,19
民眾黨諷指揮中心決策「抄令夕改」:何不一開始就傾聽民意?,"針對指揮中心近來的決策,民眾黨在臉書發文表示,「終究要接受的,為何不一開始就傾聽民意」,謙虛與包容才是為政的正途,感謝指揮中心願意採納意見,接受快篩陽及給藥全民適用。放下有色眼鏡與言論審查,廣納所有好的建議,才能及早遏止悲劇發生。民眾黨指出,「抄令夕改」堪稱民進黨政府防疫的永動機,抗疫2年多來,地方政府向陳時中提出許多諫言,卻因為政治立場不同,建議屢被視為挑釁,種種負面臆測與較勁,反而抹煞了朝野攜手防疫的機會。民眾黨表示,疫情期間常有一種既視感,每當疫情急轉直下,地方政府先喊先做,隨即遭到中央強硬駁斥,接著特定媒體、側翼唱衰謾罵,直到錯失圍堵疫情的黃金時間,民怨蔓延全台,中央才匆匆跟上地方的腳步。無論是居家照護、以篩代隔、快篩陽即確診、快篩陽給藥或開闢孩童就醫的綠色通道,台北市發起無數措施,如今逐一在全台灣推行落實,為第一線醫護、受苦民眾減輕壓力。「不管書唸的多寡、誰比較懂、會不會被笑死,人命都不該被政治鬥爭所犧牲。」民眾黨呼籲,必須放下有色眼鏡與言論審查,廣納所有好的建議,才能及早遏止悲劇發生。民眾黨表示,疫情當前,台灣沒有分裂的本錢,更不該為了政治算計,拖垮防疫的腳步。我們期盼,民進黨政府能簡化這座永動機,停止無謂的口水戰,不再讓側翼網軍左右決策,虛心做到苦民所苦,中央攜手地方「戰疫」而非「戰人」,才能真正度過這場艱苦戰役。",https://www.ettoday.net/news/20220522/2256233.htm,東森,政治,,"[115, 207, 302, 379, 455]",2022-05-22 06:00,2022,5,22,6,0
柯文哲嫌棄「瞎指揮」 王必勝曝「松山機場」篩檢站必設理由,"中央21日在松山機場新設一座大型篩檢站,台北市長柯文哲對此相當不滿表示,根本戰術佈置錯誤,「不要瞎指揮、亂指揮,造成地方的困擾」。負責大型篩檢站業務的衛福部「醫福會」執行長王必勝,則是在21日晚間說明,松山機場設立篩檢站的理由。王必勝在臉書上發文表示,台北市民需要的PCR量能仍高,平時準備的PCR量能應該充分發揮出來,「此時不用更待何時?」王必勝還指出,台北市的PCR篩檢站大都設在醫院場域內,醫院內比較不容易有充足的空間,也多少會妨礙醫療作業運行。王必勝提到,「台北市一向有自己的戰略思考,未必會認同我們的看法,但盡力服務人民、滿足人民需求的想法相信是一致的,中央地方合作,防疫才能成功」。王必勝特別感謝,三軍總醫院的優秀團隊,在不到2天內設置完成「松山機場PCR、看診、開藥(含抗病毒藥)三合一站」並開始服務,簡單幾句溝通任務,從軍醫局陳局長和三總王院長的話語和表情上,沒有任何的猶豫和為難,不約而同說,「會在時限內圓滿達成任務」,這是軍人本色。王必勝強調,「我和軍醫體系的夥伴很少有機會吃飯喝酒,但『勇於任事,使命必達』的相同信念讓我們互相欣賞和信任」。",https://www.ettoday.net/news/20220522/2256268.htm,東森,政治,林彥臣,"[114, 171, 226, 297, 426]",2022-05-22 01:39,2022,5,22,1,39
