title,article,url,company,category,reporter,space_index,datetime,year,month,day,hour,minute
蔡英文打電話給醫師公會 新北傻眼:刻意割稻尾?,"總統府發言人張惇涵今(22日)揭露,總統蔡英文已在19日親自致電協調新北醫師公會投入防疫工作。不過,新北市府新聞局長張愛晶今下午在疫情記者會上表示,新北市府早於4月28日啟動與基層、工會合作的居家照護計畫,「這究竟是行動慢半拍,還是刻意要割稻尾呢?」民進黨今舉辦全國黨員代表與地方黨部主委選舉,身為民進黨主席的蔡英文上午10時至新北市永和區孫家祠堂投票,現場記者提問「總統,會考慮到新北市視察疫情嗎?侯友宜一直在喊話」,蔡英文並未正面回應,僅回答「發言人回答」。發言人張惇涵則表示,蔡英文已在19日親自致電協調新北醫師公會投入防疫工作。對此,張愛晶表示,新北市府早在4月28日就獲得基層醫師大力支持,全面啟動第三階段居家照護計畫,已經上路都快1個月,現在才說要來打電話拜託基層,這究竟是行動慢半拍,還是刻意要割稻尾呢?相信民眾心中都有一把尺,呼籲苦民所苦,不要劃錯重點。侯友宜4月27日特地邀請耕莘醫院林恆毅院長、汐止國泰醫院李興中院長、恩主公醫院陳昌明副院長及新北市醫師公會理事長顏鴻順、名譽理事長周慶明、副理事長張甫軒、秘書長陳偉鵬等一同開會。侯友宜並於4月28日在記者會上宣布,轄區內800多家社區醫療診所將陸續加入居家照護計畫,提供輕症患者更好的照護。侯友宜表示,新北「居家照護計畫」由7家責任醫院(亞東醫院、淡水馬偕、台北慈濟、雙和醫院、新北聯醫、土城醫院、輔大醫院)做為29個行政區居家照護的責任醫院,讓輕症、無症狀者在宅照護,把醫療量能保留給中、重症患者。",https://www.ettoday.net/news/20220522/2256573.htm,東森,政治,徐政璿,"[125, 268, 385, 474, 530]",2022-05-22 15:52,2022,5,22,15,52
超前部署!侯友宜列5大防疫政策 「這些都是新北首創」,"中央流行疫情指揮中心22日公布國內新增79441例本土個案,以新北20698最多,對於防疫政策,新北市長侯友宜也列出由新北市府首創的五大倡議,包含:居家照護、居隔轉型、快篩陽視同確診、PCR陽及早收案、分群照顧等,侯友宜表示,這些都是新北首創,最重要是保存醫療量能。對於Omicrin,侯友宜表示,新北市看到問題後馬上提出解決方案,從一開始就提出五大倡議,都是首創,讓新北市先行,各地有需要再跟進,包含4月11日為了輕重分流的居家照護,當時中央堅持要1500例才能開始,14號才同意辦理,一週後全國跟進。侯友宜指出,新北市府4月22日推動居隔轉型、釋出公衛、行政能力,5月1日快篩陽視同確診、照顧好脆弱族群,5月11日PCR陽及早收案、5月22日分群照顧、以固守中重症,這些都是新北首創,最重要是保存醫療量能。",https://www.ettoday.net/news/20220522/2256524.htm,東森,政治,杜冠霖,"[133, 252]",2022-05-22 15:26,2022,5,22,15,26
柯文哲快篩陽 侯友宜暖喊:一起並肩作戰,"台北市長柯文哲今(22)日透過臉書表示,因早上咳嗽、喉嚨不適,主動快篩後呈陽性,上午已至仁愛醫院完成PCR採檢,正等待結果中。新北市長侯友宜下午在記者會上表示,柯文哲為了防疫盡心盡力,真的非常辛苦,希望早日康復,再一起並肩作戰,他也用台語喊話:「柯市長加油!你絕對沒問題!」台北市長柯文哲22日證實自己快篩陽性,使用鴻海創辦人郭台銘借給北市的「口水機」檢驗後也是陽性,因此預約前往醫院採檢PCR;他表示,除了咳嗽以外一且都還好;醫院採檢流程也很順暢,只花了5分鐘。",https://www.ettoday.net/news/20220522/2256519.htm,東森,政治,徐政璿,[137],2022-05-22 15:24,2022,5,22,15,24
快篩陽=確診下週全面開放 侯友宜最新說明,"中央流行疫情指揮中心今(22)日公布國內新增79441例本土個案,以新北20698最多,其次依序為桃園市11168例、台北市9645例、台中市7250例、高雄市7135例和台南市4678例等。新北市長侯友宜將於15時召開記者會,說明防疫最新進度。指揮中心今公布新增7萬9441例本土個案,另增46例境外移入、確診個案中有53例死亡。今另新增256例中重症個案再創新高,其中中症佔198例、重症58例。指揮官陳時中表示,下週起將開放「快篩陽性視同確診」全民適用,新增的9大篩檢站不會停止運作,而是轉換為診斷與開藥站,讓確診者不用進到醫院,減少感染風險。而新制等細節定案後就會上路,屆時不符合6類條件者,免做PCR就可直接給藥。",https://www.ettoday.net/news/20220522/2256408.htm,東森,政治,徐政璿,"[123, 200]",2022-05-22 14:50,2022,5,22,14,50
跟柯文哲同天快篩陽!高嘉瑜喊「兇手不是我」:立院恐已病毒散布,"台北市長柯文哲22日透露快篩陽性,目前正在等待PCR結果,而民進黨立委高嘉瑜隨後也表示自己快篩結果兩條線,引來外界好奇兩人是否有接觸,對此,高嘉瑜回應,自己與柯文哲已經好幾個月沒見,並懷疑病毒在20日已於立法院散布。高嘉瑜說,與柯文哲兩人很久沒有碰到面了,「人不是我殺的,兇手不是我」,另外,由於20日立法院開會時,坐在她旁邊的立委邱志偉快篩陽,而隔了一條走道的立委林昶佐也確診,「代表可能會場裡面病毒已經散播了」。高嘉瑜表示,20日當天立委們都有短暫脫下口罩喝咖啡,會不會在這過程中染疫了也不一定,希望大家要小心,把口罩戴好,染疫機會就會小很多。多名立委相繼染疫,根據PCR確診結果,目前國民黨的廖國棟、蔣萬安、陳雪生、費鴻泰、陳超明,民進黨籍的蔡適應、林靜儀、李昆澤、鍾佳濱、沈發惠、趙天麟、邱議瑩、邱泰源(無PCR,因適用新規定65歲以上族群只要快篩陽性,經與醫師視訊看診後可判定確診),另有民眾黨的蔡壁如,無黨籍的林昶佐,共計15名立委,而無黨籍的黃國書也出現症狀,快篩陽性,「應該是確診了」,但未有PCR檢測報告。",https://www.ettoday.net/news/20220522/2256508.htm,東森,政治,皮心瑀,"[108, 208, 274]",2022-05-22 14:49,2022,5,22,14,49
使用郭台銘「唾液機」快篩陽 柯文哲:去仁愛醫院PCR「僅花5分鐘」,"台北市長柯文哲22日上午快篩陽性,因此緊急到聯合醫院仁愛院區PCR採檢,引發外界熱議。柯文哲下午表示,自己使用快篩後呈現陽性,後來又用鴻海集團創辦人郭台銘的口水機快篩,結果也呈現陽性,所以由先前確診隔離結束的隨扈載去仁愛醫院PCR,「5分鐘全部做完。」柯文哲22日下午在家自拍影片,提及早上起床時發現「喉嚨怪怪的」,「也不是很痛,就是卡卡的,然後會咳嗽、流鼻水。」因此自行快篩後呈現陽性,後來想到郭台銘曾借給台北市政府一台口水機,乾脆就拿出來做,「結果竟然也是陽性。」柯文哲說,因為自己的隨扈於上週確診,目前已經隔離出來,所以由確診過的隨扈載他到仁愛醫院PCR,「今天去的時候,很驚訝居然沒什麼人。」自己透過網路預約,並直接帶健保卡到現場,全程花了約5分鐘,目前正在等PCR結果,「不過還好,除了會咳嗽以外,其他還沒什麼太明顯症狀。」",https://www.ettoday.net/news/20220522/2256528.htm,東森,政治,袁茵,"[126, 234]",2022-05-22 14:48,2022,5,22,14,48
李彥秀確診! 曝身體狀況嘆「疫情中最不需要相互指責」,"疫情邁入洪峰階段,確診人數不斷上升,其中包含不少政治人物,22日除台北市長柯文哲、南港立委高嘉瑜外,前議員李彥秀也傳出確診,李22日在臉書發文表示自己確診了,她指出,今天,自己接獲醫院通知PCR陽性通知,即刻開始居家隔離七天,「疫病是中性的,在疫情嚴峻的當下,最不需要的就相互指責,更要團結抗疫。」李彥秀指出,今天接獲醫院通知PCR陽性通知,即刻開始居家隔離七天。自己身體狀況尚佳,沒有太多不適的症狀。也在家中準備好相關的物資跟常備的藥品,「我會觀察留意自己身體狀況,希望可以用最不佔用醫療資源,降低醫護人員負擔的方式,完成七天的隔離期。期望可以,盡快恢復健康,繼續為內湖、南港打拚!」李彥秀表示,在確診前,自己經常呼籲:疫病是中性的,在疫情嚴峻的當下,最不需要的就相互指責,更要團結抗疫。然而,得知自己確診的當下,仍然深感不安,「我只能提醒自己,這樣直接反應的心情,或許就是我們繼續把防疫工作好的動力。面對疫情變化,我們沒有悲觀的權利,更要謹慎因應,努力在防疫與生活中得到平衡。期望大家平安、健康度過疫情。」",https://www.ettoday.net/news/20220522/2256491.htm,東森,政治,杜冠霖,"[149, 293]",2022-05-22 14:12,2022,5,22,14,12
民進黨不只高嘉瑜! 邱志偉出現症狀連篩三次才陽性,"本土疫情燒進立法院,22日民進黨立委高嘉瑜透露自己快篩陽性,同黨的邱志偉也在同天發現結果是兩條線。邱志偉表示,自己21日早上起床喉嚨就不舒服,立刻快篩,但結果是陰性,中午不放心又再快篩一次,結果還是陰性,但喉嚨痛是明顯的徵兆,所以他立刻停止昨天行程居家隔離,到了晚上喉嚨依然卡卡,今天早上起床快篩才呈現陽性。邱志偉說,接下來就要等PCR的結果,但確診的可能性相當大,未來七天的地方行程只能由祕書代替參加,國會辦公室,岡山服務處會進行全面清消,並且照常上班,服務不中斷,工作不打折,立法院的會議及質詢我也會用視訊來進行。邱志偉指出,現在身體沒有不舒服,精神還不錯,只是喉嚨卡卡聲音有點沙啞,這幾天有跟他接觸的同仁或朋友,如果有造成大家的困擾或不便,還請多見諒包涵,利用七天隔離期,希望能好好看書,好好鍛練體能,也祝福所有好朋友在當前嚴峻的疫情之下,都能夠健康、平安、喜樂。多名立委相繼染疫,根據PCR確診結果,目前國民黨的廖國棟、蔣萬安、陳雪生、費鴻泰、陳超明,民進黨籍的蔡適應、林靜儀、李昆澤、鍾佳濱、沈發惠、趙天麟、邱議瑩、邱泰源(無PCR,因適用新規定65歲以上族群只要快篩陽性,經與醫師視訊看診後可判定確診),另有民眾黨的蔡壁如,無黨籍的林昶佐,共計15名立委,而無黨籍的黃國書也出現症狀,快篩陽性,「應該是確診了」,但未有PCR檢測報告。",https://www.ettoday.net/news/20220522/2256432.htm,東森,政治,皮心瑀,"[154, 259, 385]",2022-05-22 13:34,2022,5,22,13,34
柯文哲快篩陽 黃珊珊稱「確診俱樂部」:了解確診者感受更深刻,"台北市副市長黃珊珊先前快篩陽性、PCR確診,因此進行7+7居家隔離;當時台北市長柯文哲因快篩陰性,所以仍維持市政工作。但柯文哲22日上午爆出快篩陽性,使已經解隔、正在執行7天自我健康管理的黃珊珊表示,市府仍會正常運作,並寫下「#確診俱樂部」、「#了解確診者感受更深刻」。黃珊珊22日中午於臉書提及,柯文哲快篩陽性,正在等PCR,但市府仍會正常運作,遠距辦公已是常態,最重要的決策與執行,都不會有任何影響,「守護市民、平安健康!市長好好保重!」並且在文末Hashtag「#確診俱樂部」、「#了解確診者感受更深刻」。據了解,柯文哲22日上午身體有不舒服狀況,因此做了唾液快篩、鼻腔快篩,目前都呈現陽性反應,因此緊急到聯合醫院仁愛院區PCR。而柯文哲隨後也於臉書證實,自己的狀況還好、市政工作不會收到影響,一切如常,只是要小心不能傳染給陳佩琪,因為還有很多醫療與防疫的工作需要對方,「我們會萬事小心,也請大家不用擔心!」",https://www.ettoday.net/news/20220522/2256457.htm,東森,政治,袁茵,"[135, 256]",2022-05-22 13:14,2022,5,22,13,14
高嘉瑜快篩陽 曝症狀「咳嗽半夜咳醒」,"民進黨立委高嘉瑜表示,自己前天開始有點喉嚨癢癢不舒服當下快篩陰性,21日開始咳嗽半夜咳醒幾次,22日早上昏昏沉沉,有點喉嚨痛、頭痛、咳嗽,快篩後為陽性。本土疫情延燒,多名立委相繼染疫,根據PCR確診結果,目前國民黨的廖國棟、蔣萬安、陳雪生、費鴻泰、陳超明,民進黨籍的蔡適應、林靜儀、李昆澤、鍾佳濱、沈發惠、趙天麟、邱議瑩、邱泰源(無PCR,因適用新規定65歲以上族群只要快篩陽性,經與醫師視訊看診後可判定確診),另有民眾黨的蔡壁如,無黨籍的林昶佐,共計15名立委,而無黨籍的黃國書也出現症狀,快篩陽性,「應該是確診了」,但未有PCR檢測報告。今除了高嘉瑜外,同屬民進黨的立委邱志偉也因為出現症狀,快篩結果為陽性。",https://www.ettoday.net/news/20220522/2256451.htm,東森,政治,皮心瑀,"[76, 271]",2022-05-22 12:53,2022,5,22,12,53
柯文哲快篩陽自曝症狀 「要小心不能傳染給陳佩琪」,"台北市長柯文哲22日因身體不舒服,早上8點進行唾液快篩,結果為陽性,目前正在等待PCR結果。柯文哲表示,自己目前身體狀況還好,市政工作不會受到影響,「只是我要小心不能傳染給陳佩琪,因為還有很多醫療與防疫的工作需要她」。柯文哲先前屢次與確診者接觸,因為事後快篩都呈現陰性,被台北市議員們稱為「九命怪貓」,曾自曝自己的防疫關鍵就是戴好口罩,22日因早上咳嗽,喉嚨有些不適,主動做了快篩,最新結果呈現陽性。柯文哲強調市政一切如常,上午已經透過掛號系統,預約仁愛醫院的防疫急門診,採檢完畢,目前正在等待PCR結果,只是擔心傳染給陳佩琪,「我們會萬事小心,也請大家不用擔心!」",https://www.ettoday.net/news/20220522/2256431.htm,東森,政治,皮心瑀,"[109, 200]",2022-05-22 12:45,2022,5,22,12,45
柯文哲快篩陽! 緊急到聯醫仁愛醫院PCR,"台北市長柯文哲先前屢次與確診者接觸,因為事後快篩都呈現陰性,被台北市議員們稱為「九命怪貓」。但據了解,柯文哲22日上午身體有不舒服狀況,因此做了唾液快篩、鼻腔快篩,目前都呈現陽性反應,因此緊急到聯合醫院仁愛院區PCR當中。而柯文哲22日中午也於臉書證實,早上因為咳嗽、喉嚨有些不適,主動做了快篩,結果是陽性,上午已經透過掛號系統預約仁愛醫院的防疫急門診,採檢完畢,目前正在等待PCR結果。柯文哲提及,自己的狀況還好、市政工作不會收到影響,一切如常,只是要小心不能傳染給陳佩琪,因為還有很多醫療與防疫的工作需要對方,「我們會萬事小心,也請大家不用擔心!」",https://www.ettoday.net/news/20220522/2256437.htm,東森,政治,"袁茵,陳家祥","[111, 194]",2022-05-22 12:31,2022,5,22,12,31
民進黨職選舉今登場!立委紛勸快投票 有人喊「擠不進去」,"民進黨黨職選舉22日登記,將選出新任全國黨代表、市黨員代表,以及各縣市黨部主委,時間將至下午4點,黨主席蔡英文已至新北市中和孫氏宗祠完成投票,不少綠營官員也在臉書貼出照片,呼籲黨員踴躍投票,其中,立委蔡易餘還因身形壯碩,直言「快擠不進去圈票處了」。立委趙天麟說,自己一早便出發為兩年一次的黨職選舉投票,這一次各個投開票所都按照生日月份分流投票,也遵守量測體溫、手部消毒及全程配戴口罩等防疫規定,希望黨員放心,出門投票,共同延續民主的價值。立委郭國文也提醒,今日投票時間到下午4點為止。希望還沒投票的朋友,趕緊把握時間到投票所去投票。蔡易餘則笑喊他快擠不進去圈票處,網友則紛紛留言,「圈票處應該表示只給幾公斤以下入內」、「需要友善空間」、「看就知道是圈票處設計不良!」民進黨今選出的新任全國黨代表、市黨員代表,以及各縣市黨部主委後,7月份就會召開全國黨代表大會,針對中執委、中常委與中評委進行改選,這意味著5月的結果,牽動7月份權力核心的改選,更意味黨內各派系勢力勢必有所變動,備受關注。",https://www.ettoday.net/news/20220522/2256322.htm,東森,政治,皮心瑀,"[124, 191, 219, 239, 266, 333]",2022-05-22 12:14,2022,5,22,12,14
孩子確診怎辦?如何跟病毒共存? 陳建仁5支短片一次說清楚,"針對當前本土疫情,民進黨22日再次推出「大仁哥親解2.0」,前副總統陳建仁從「正確與病毒共存」、「該如何就診服藥」、「解封前的準備」、「孩子染疫怎麼辦」以及「台灣防疫成績」等五面向,向國人一一說明。陳建仁表示,Omicron感染率高但無症狀者多,故無法再以清零方式面對,而是要與病毒共存。他認為,台灣防疫目標已走到第三階段「提升自主防疫力」,所以「防疫三寶」相當重要,包括疫苗追加劑、快篩試劑與抗病毒藥物,他再度呼籲國人打好三劑疫苗,積極配合指揮中心,落實日常防疫才是關鍵。同時,陳建仁也以「健康光譜」與「疾病金字塔」,向國人具體建議相關病症及其相對應的處置方式,提醒抗病毒藥物仍必須循醫囑服用。對於家中有孩子的家長,陳建仁除鼓勵接種疫苗以達基本保護外,也舉自己孫女發燒為例,提醒父母與學校教師,隨時注意小朋友的健康狀況,一旦有「咳嗽、喉嚨痛、發燒」等症狀,利用快篩做初步判定,再由臨床醫師好好診斷、好好觀察,就會獲得控制。陳建仁回憶,Omicron去年11月大舉蔓延後,世界各國病例數大幅增加,很多國家一天暴增20到30萬,如果單以百分比推估,「台灣的感染還沒有開始,但實際上可能性也不會太高,因為我們疫苗涵蓋很高,且每個人勤洗手、戴口罩、避免群聚」。他同時認為,台灣疫苗追加劑的覆蓋率若能再提高,解封就能往「逐步下樓梯」的方向邁進,做好相關部署才能不慌亂。最後,陳建仁再度向國人提醒,盼大家在防疫的第三階段,發揮「我為人人、人人為我」的彼此共好,他理解民眾對這波疫情的恐慌與害怕,但也提醒,Omicron致死率相對低,「只要我們互相合作、彼此包容,稍微抱著是危機也是轉機的態度面對,即能很快脫離COVID-19陰影」,那麼在不久將來,台灣就能恢復正常生活。",https://www.ettoday.net/news/20220522/2256420.htm,東森,政治,陶本和,"[99, 237, 298, 412, 527, 580]",2022-05-22 12:07,2022,5,22,12,7
不是視察疫情!蔡英文到新北投票 他貼14秒影片:再度寒心,"新北市長侯友宜多次呼籲總統蔡英文到疫情嚴重的雙北第一線去看看,就能了解民眾的需求與痛苦,蔡英文今(22)日終於前往新北,但不是去看疫情,而是前往民進黨的黨職選舉。對此,國民黨前青年部主任陳冠安透過臉書貼出一段受訪影片,他表示,短短14秒影片,讓人再度對蔡英文的防疫指揮再度寒心。民進黨今舉辦全國黨員代表與地方黨部主委選舉,身為民進黨主席的蔡英文今上午10時至新北市永和區孫家祠堂投票。根據影片內容,記者提問「總統,會考慮到新北市視察疫情嗎?侯友宜一直在喊話」,蔡英文並未正面回應,僅回答:「發言人回答。」陳冠安表示,現在新北染疫超過44萬人,面對嚴峻疫情,侯友宜不斷為民請命,強化防疫與照護等行政措施,也希望中央能給予更多援助,或因應疫情變化,儘速調整,但蔡英文被記者問要不要到新北視察疫情,看看基層需要什麼,都無法正面允諾。陳冠安抨擊蔡英文,是覺得44萬人染疫不重要,無須由自己回答,發言人回答就好嗎?這並不是多難、多複雜的問題吧,一句會安排,找適當時機去,就這麼難嗎?陳冠安回顧,就在4月初,蔡英文可以在官邸,只找同黨的陳其邁和鄭文燦來開防疫會議,忽略柯文哲和侯友宜,現在5月中旬,侯友宜並不是要蔡來私下見面,而是一起到基層走訪,請別連防疫都在分顏色。陳冠安感嘆,蔡英文自己也是新北市民,然而現在新北市有需要,蔡總統一句「發言人回答」,真的會讓現在水深火熱的人民感到心寒。",https://www.ettoday.net/news/20220522/2256410.htm,東森,政治,徐政璿,"[139, 252, 278, 363, 436, 528]",2022-05-22 12:01,2022,5,22,12,1
蔡英文請託新北基層醫生投入防疫 5項工作進度曝光,"總統府發言人張惇涵22日揭露,總統蔡英文已在19日親自致電協調新北醫師公會投入防疫工作。據了解,新北醫師公會20日即刻投入防疫,並已有5大進度,包括參與疫苗注射、新北居家照護、1000家診所投入遠距看診、投入PCR採檢、基層診所分流採檢工作等。對於蔡英文還未安排視察新北市防疫工作,上午在公開行程中面對媒體喊話追問,她則因為行程並未安排受訪,她則交辦發言人負責回應。對此,張惇涵表示,全國防疫工作蔡英文都非常關心,尤其北北基桃比較嚴峻,她也有很多親自協助的部份,中央、地方互相合作補位,讓防疫工作更好是總統期待的方向。張惇涵舉例,這禮拜四蔡英文已經打給台大院長,希望在兒童醫療部分擴大量能,同一天也打給新北市醫師公會,一方面感謝新北醫療,也拜託在新北基層醫生多協調一些力量投入居家照顧、遠距問診、第一線篩檢站服務工作。據了解,蔡英文是在19日親自致電給新北醫師公會,而新北醫師公會在20日就投入基層服務,截至目前已有5大進度,包括:參與疫苗注射、新北居家照護、1000家診所投入遠距看診、投入PCR採檢、基層診所分流採檢工作等。首先,在提供疫苗注射方面,新北的疫苗注射,第1、2劑有40%,第3劑有60%是在診所施打,而65歳以上第四劑疫苗也已開打。第二是參與確診者居家照護計劃,新北到22日已有427家診所報名,八成已開始接受派案,上週派案數5800件,達全市31%。第三部分是提供確診者遠距視訊診療及開藥,新北有超過1000家診所加入;第四是提供居家快篩陽性者,遠距視訊判定,以疏解PCR壓力,動員診所醫護,投入協助舊有及新設社篩站的PCR採檢作業。第五部分,是基層診所就地分艙分流作PCR採檢,目前有32家診所在做,一天提供1000個PCR量能。",https://www.ettoday.net/news/20220522/2256381.htm,東森,政治,陶本和,"[122, 259, 359, 464, 489, 494, 501, 525, 585, 677, 720]",2022-05-22 11:02,2022,5,22,11,2
蔡英文助拳侯友宜! 張惇涵:總統親自協調新北基層醫師投入防疫,"總統蔡英文22日上午面對媒體喊話追問,是否規劃視察新北疫情,她則因行程未規劃受訪,則交辦發言人負責回應。對此,總統府發言人張惇涵表示,全國防疫工作蔡英文都非常關心,尤其是北北基桃,也有很多親自協助,好比週四她就打電話給台大院長,擴大兒童醫院量能,也打給新北醫師公會,拜託多協調基層醫師投入居家照顧、遠距問診等工作。對於蔡英文還未安排視察新北市防疫工作,上午在公開行程中面對媒體喊話追問,她則因為行程並未安排受訪,她則交辦發言人負責回應。對此,張惇涵表示,全國防疫工作蔡英文都非常關心,尤其北北基桃比較嚴峻,她也有很多親自協助的部份,中央、地方互相合作補位,讓防疫工作更好是總統期待的方向。張惇涵舉例,這禮拜四蔡英文已經打給台大院長,希望在兒童醫療部分擴大量能,同一天也打給新北市醫師公會,一方面感謝新北醫療,也拜託在新北基層醫生多協調一些力量投入居家照顧、遠距問診、第一線篩檢站服務工作。張惇涵說,蔡英文親自拜託醫師公會幹部,醫師公會也跟指揮中心、新北市政府協調討論,中央、地方互相合作,攜手協力互相補位,大家把工作做好才是人民關心的。至於未來會不會安排相關視察行程?張惇涵說,相關防疫工作跟整備都很關心,只要在不影響第一線防疫工作人員狀況下,蔡英文後續都會規劃相關行程,而幕僚也會來討論。張惇涵強調,這時候的防疫工作,最重要的是無論如何,中央、地方要攜手合作同心協力,一方面讓篩檢、照護上讓人民越來越便利,增加民眾便利性,同時把醫療資源集中在中重症,或高風險患者才是目前第一要務。對於蔡英文是否有打電話給新北市長侯友宜?張惇涵表示,蔡英文過去就曾打給侯市長,好比去年就有,蔡英文關心各地方的防疫並不會減少。",https://www.ettoday.net/news/20220522/2256378.htm,東森,政治,陶本和,"[157, 294, 394, 468, 545, 641]",2022-05-22 10:52,2022,5,22,10,52
