timestamp,title,article,url,company,category,reporter
1653951720.0,徐志榮拒選苗栗縣長 他批國民黨中央:苗栗這麼穩可以搞成劇場,"國民黨中央選戰策略會報昨(30)日徵召現任立法委員徐志榮參選苗栗縣長,不過,徐志榮31日受訪表示「有點錯愕」,並堅持兩個原則,第一就是不會參選,第二就是全力支持黨的候選人,對此,媒體人黃揚明批評,國民黨中央、選策會根本是自殺突擊隊,連苗栗這麼穩的地盤都可以搞成劇場。 國民黨徵召徐志榮參選苗栗縣長,徐31日受訪表示「有點錯愕」,他強調目前先把立委工作做好;至於週三常會若通過徵召案是否會接受提名?他則說,「黨會尊重我的意見吧!」 徐志榮表示,他堅持兩個原則,第一就是不會參選,第二就是全力支持黨的候選人,他從頭到尾跟黨、鄉親和支持者從未表示過參選苗栗縣長,對於辜負黨的抬愛,以及支持者的厚愛,還有他老婆的期望,讓大家失望,他深深一鞠躬。 對於國民黨苗栗縣長提名風波,黃揚明批評,國民黨中央、選策會根本是自殺突擊隊,連苗栗這麼穩的地盤都可以搞成劇場,「從議長的只是通姦傷人到劉政鴻鳳還巢再到徐志榮堅拒徵召,這樣下去苗栗國會不會也翻盤?」 黃揚明也透露,傳出明天國民黨中常會就會通過高雄市長人選,「會不會連高雄這種艱困選區都再一次上演類似桃園、苗栗的劇碼呢?各位客官繼續看下去......」 而國民黨高雄市長人選至今尚未出爐,高雄市黨部主委許福明29日證實,將提報孫文學校總校長張亞中、高雄市議員陳麗娜與市黨部副主委曹桓榮等人給黨中央決定。 對於苗栗縣長提名風波,國民黨秘書長黃健庭則表示,選策會在地方上溝通協調1、2個月,經過這麼長時間各種考量,認為徐志榮的民意支持度最高,且是各方都比較能接受、比較能支持的人選,選策會才會做這樣的決議。 黃健庭指出,有意參選的議長鍾東錦一直以來都有表達如果是徐志榮選,他可接受,也會支持,而另一位有意參選的前農委會農田水利署苗栗管理處退休處長謝福弘,也有說不會去爭,黨提名誰都全力支持。",https://www.ettoday.net/news/20220531/2262829.htm,東森,政治,杜冠霖
1653951240.0,視察桃機邊境防疫 蘇貞昌證實將與美參議員達克沃絲會面,"行政院蘇貞昌今(31)日視察桃園國際機場邊境防疫時表示,從明(1)日開始,只要入境旅客做唾液篩檢,就可以離開機場,不用再等待PCR結果,感謝所有國人同胞在指揮中心規範與全體防疫工作人員努力下,一階段、一階段到這個進入正常生活最後關鍵階段;至於台北市長柯文哲批評中央設大型疫苗接種站是白癡命令?蘇貞昌認為在中正紀念堂所設的疫苗施打站是在室內,篩檢站是在隔500、600公尺的室外,動線完全不同,有隔離,請放心。 閣揆今天視察桃園機場,媒體詢問有關旅遊鬆綁及3+4大概會什麼時候解禁?中央邊境放寬,現在醫療量能充足嗎? 蘇貞昌指出,從1月11號到今天,我們機場防疫人員分3班,夜以繼日,已經篩檢了14萬人,非常地辛苦、非常地不簡單,明天要開始新的階段,今天特別來對機場防疫人員、所有的工作人員表示肯定與感謝,同時來看新階段要開始,準備好了沒有。 蘇貞昌強調,從明天開始,只要入境旅客做唾液篩檢,就可以離開機場,不用再有等待PCR結果的時間,感謝所有國人同胞在指揮中心規範和全體防疫工作人員的努力下,一階段、一階段到這個進入正常生活最後關鍵階段,希望大家繼續一起努力。 此外,媒體也關心美國參議員達克沃絲時隔一年再訪台,上次來送疫苗,這次訪台的目的為何?蘇貞昌認為,美國達克沃絲參議員去年這個時間就與另外兩位參議員來台灣,宣布美國要送台灣疫苗,及時雨提供台灣最最需要的幫助,美國這位參議員一直都是非常力挺台灣,包括台灣相關防疫以及經貿各方面,我們都看到達克沃絲參議員一直表示最大的關注與支持,下午我會和她會面,就各方面大家深入來交談,更進一步來促進台美雙方的合作。 媒體也針對台北市長柯文哲批評中央在六都設置大型接種站是白癡命令,院長怎麼看? 蘇貞昌表示,我們打疫苗是最最重要,小小朋友要打疫苗,家長都因有些學校停止上課而心急,我們看到地方有很大的負擔,所以指揮中心應各地要求,在各地加設大型的疫苗注射站,就是要來滿足家長的期待,幫忙地方減少他們的負擔。此外,中正紀念堂所設疫苗施打站是在室內,篩檢站是隔500、600公尺的室外,動線完全不同,有隔離,請放心。我們希望對抗病毒要地方、中央合作,大家一起努力,讓我們的防疫能做到最好。",https://www.ettoday.net/news/20220531/2262869.htm,東森,政治,沈繼昌
1653951240.0,跟進英德 外交部:中國勿阻礙聯合國調查新疆人權,"聯合國人權事務高級專員巴舍萊(Michelle Bachelet)赴中國調查新疆人權事件行程受阻,德國、英國外交部批評中方企圖掩蓋真相。外交部發言人歐江安31日在例行記者會答覆媒體提問表示,台灣加入民主陣營夥伴,與英、德立場一致,呼籲中國讓聯合國針對新疆人權事件進行獨立調查並做出完整報告。 歐江安表示,巴舍萊23日起訪問中國6天,因受中國限制無法在新疆完成獨立調查,英國外交部特別強調,此事凸顯中國要掩藏真相的決心,英方希望與國際社會合作加大對中國施壓力道,呼籲中國立刻釋放在新疆不法拘禁的人士。德國外交部對於此事表達失望,德國外長上周跟中國外長王毅通話時,也特別希望中國用明確態度澄清新疆人權遭侵犯的指控。 歐江安說,台灣加入民主陣營夥伴,跟英國德國立場一致,呼籲讓聯合國高專到新疆的查訪能獨立自由、不受限制,讓聯合國高專自由訪談人民、視察設施,希望中國官方切勿加以阻擾,並盼聯合國能公布客觀獨立完整的新疆人權報告。",https://www.ettoday.net/news/20220531/2262884.htm,東森,政治,呂晏慈
1653950100.0,黃珊珊可能不代表民眾黨參選 蔣萬安:不會背棄一路栽培我的政黨,"親民黨背景的黃珊珊以無黨籍身分擔任台北市副市長,由於被視為市長柯文哲接班人,外界好奇她是否披白袍角逐首都市長,只是柯昨透露黃不會代表民眾黨參選。對此,國民黨台北市長參選人、立委蔣萬安說,不管黃珊珊用什麼黨籍參選,他的價值理念,是不會背棄一路栽培他的政黨。 蔣萬安31日被問到黃珊珊掛哪個黨籍,是否影響自己的選情?他回應,不管黃珊珊接下來用什麼黨籍參選,「我的價值理念,是不會背棄一路栽培我的政黨」,不論這政黨現在有多艱困,聲勢高或低。 對於黃珊珊陣營評估蔣萬安的民調有往下趨勢,下一階段將拚黃金交叉,蔣萬安說,民調就是起起伏伏,最重要是怎樣為台北擘劃更好的願景,「相信我的能力」,能夠帶領各種優秀人才組成台北隊,將台北重新站上世界頂尖城市行列。 至於民進黨分析若穩住基本盤40%,就可以拿下首都,會不會覺得三角督會讓自己被邊緣化,蔣萬安表示,選舉是爭取最多市民支持,以及為台北擘畫未來最好的願景,大家期待的是,台北不要被國際邊緣化,而不是誰被邊緣化。",https://www.ettoday.net/news/20220531/2262861.htm,東森,政治,蘇晏男
1653949500.0,70.3%要嚴守國門「入境7+7」 56.6%不滿陳時中防疫表現,"新冠肺炎防疫工作有新的階段,行政院長蘇貞昌31日宣布境防疫管制將放寬,6月1日起機場入境將取消落地鼻咽採檢,僅維持唾液採篩。不過,根據《東森新媒體ETtoday》最新調查發現,國人對於邊境控管的意向仍趨向嚴格管制,數據指出,70.3%民眾認為國外入境檢疫政策應維持7+7或更嚴格。相較於鄰近國家南韓陸續解除保持社交距離措施與戶外口罩令,調查結果則顯示,有50.0%民眾支持台灣比照南韓逐步解除防疫禁令的做法,46.6%民眾不支持,反應兩極。 為了解民眾對於此波疫情與政府防疫政策及措施的滿意度為,《東森新媒體ETtoday》民調中心於2022年5月23日至5月25日,以「手機簡訊」方式通知,進行網路問卷調查,回收有效樣本數為1,223份,抽樣誤差在95%信心水準下,為正負2.8%。 《東森新媒體ETtoday》民調中心表示,有高達81.2%民眾表示擔憂自己或家人感染新冠肺炎。與《ETtoday新聞雲》歷次調查結果相比,民眾擔憂程度雖因疫苗接種率提高而較去年台灣三級警戒期間低,但Omicron病毒的高傳染力,仍使民眾擔憂程度高於台灣本土疫情尚未爆發前。 根據調查結果,對於指揮官陳時中在此波疫情中的防疫指揮表現,有56.6%民眾感到不滿意,41.3%民眾感到滿意。在防疫政策滾動式調整方面,調查結果也顯示,民眾對於政府兒童疫苗、快篩試劑、確診者就醫安排與照護、抗病毒藥物此四項防疫政策與準備的不滿意程度均達六成以上。不過,有77.9%民眾支持政府全面開放快篩陽性即視同確診。 在檢疫隔離方面,有63.2%民眾支持原本的3+4方案,26.0%民眾表示支持0+7方案;至於邊境控管,有70.3%民眾認為國外入境檢疫政策應維持7+7或更嚴格,僅23.9%民眾認為可放寬。 對於疫情進入「後新冠時期」,南韓宣稱已做了與病毒共存的準備,陸續解除保持社交距離措施與戶外口罩令,持續朝恢復正常生活邁進,調查結果也顯示,50.0%民眾支持台灣比照南韓逐步解除防疫禁令的做法,46.6%民眾不支持,反應兩極。 談到全台「防疫保單之亂」,對於有些保險公司將民眾投保多張防疫險保單視為重複投保而拒絕履約,有71.6%民眾認為保險公司此做法不合理。 以下為《東森新媒體ETtoday》民調中心此次的調查內容與結果: 56.6%民眾不滿意陳時中在此波Omicron疫情中的防疫指揮表現 根據調查結果顯示,41.3%民眾對於指揮官陳時中在此波疫情中的防疫指揮表現感到滿意(非常滿意13.2%、還算滿意28.1%);56.6%民眾感到不滿意(非常不滿意34.7%、不太滿意21.9%);另有2.0%民眾表示不知道/沒意見。 81.2%民眾擔憂自己或家人感染新冠肺炎 台灣本土疫情大爆發,確診總人數已破百萬人,有81.2%民眾表示擔心自己或家人感染新冠肺炎(非常擔憂49.0%、有點擔憂32.2%)。與《ETtoday新聞雲》歷次調查結果相比,民眾擔憂程度雖因疫苗接種率的提高而較去(2021)年6月台灣三級警戒期間低,但Omicron病毒的高傳染力,使民眾擔憂程度高於台灣本土疫情尚未爆發前。 根據調查顯示,69.9%民眾認為目前政府的防疫政策混亂(非常混亂41.6%、有點混亂28.3%);28.5%的民眾認為政策明確(非常明確10.0%、還算明確18.5%);另有1.7%民眾表示不知道/沒意見。 根據調查顯示,有60.8%民眾對於政府「兒童疫苗政策與準備」的表現感到不滿意(非常不滿意30.8%、不太滿意30.0%);33.2%的民眾感到滿意(非常滿意7.7%、還算滿意25.5%);另有6.1%民眾表示不知道/沒意見。 根據調查顯示,有66.0%民眾對於政府「快篩試劑政策與準備」的表現感到不滿意(非常不滿意41.3%、不太滿意24.7%);31.6%的民眾感到滿意(非常滿意7.4%、還算滿意24.2%);另有2.4%民眾表示不知道/沒意見。 根據調查顯示,有66.7%民眾對於政府「確診者就醫安排與照護」的表現感到不滿意(非常不滿意35.9%、不太滿意30.8%);29.4%的民眾感到滿意(非常滿意6.8%、還算滿意22.6%);另有4.0%民眾表示不知道/沒意見。 根據調查顯示,有64.6%民眾對於政府「確診者就醫安排與照護」的表現感到不滿意(非常不滿意36.8%、不太滿意27.8%);31.5%的民眾感到滿意(非常滿意7.2%、還算滿意24.3%);另有3.8%民眾表示不知道/沒意見。 根據調查顯示,有77.9%的民眾支持政府全面開放快篩陽性即視同確診(非常支持29.6%、還算支持48.3%);僅18.2%的民眾不支持(非常不支持4.4%、不太支持13.8%);另有3.9%民眾表示不知道/沒意見。 指揮中心宣布,5月17日起放寬確診者同住家人打滿3劑疫苗快篩陰可0+7免隔離,但民眾仍可選擇3+4隔離。根據調查顯示,仍有63.2%民眾較支持3+4(3天居家隔離與4天自主防疫)的檢疫方式;支持0+7(得免居隔, +7天自主防疫)的民眾則有26.0%;另有10.8%民眾表示不知道/沒意見。 國外入境居家檢疫目前為7+7政策(入境居家檢疫7天,第8天起接續自主健康管理7天),根據調查顯示,70.3%民眾認為國外入境檢疫政策應維持7+7或更嚴格(「維持目前入境檢疫7+7政策」32.6%、「應嚴格控管邊境,入境者進行10+7檢疫隔離」18.1%、「應嚴格控管邊境,入境者進行14+7檢疫隔離」19.6%);僅23.9%民眾認為可放寬(「可放寬入境檢疫為0+7」9.1%、「可放寬入境檢疫為3+4」14.8%)。 有鑑於病毒威脅減弱,進入「後新冠時期」,南韓宣稱已做了與病毒共存的準備,陸續解除保持社交距離措施與戶外口罩令,持續朝恢復正常生活邁進。根據調查顯示,有50.0%的民眾支持支持台灣比照南韓逐步解除防疫禁令(非常支持15.4%、還算支持34.6%),而不支持的民眾則有46.6%(非常不支持17.1%、不太支持29.5%),反應兩極。 根據調查顯示,對於有些保險公司將民眾投保多張防疫險保單視為重複投保而拒絕履約,有71.6%民眾認為不合理(非常不合理42.5%、不太合理29.1%); 認為合理的民眾則有21.8%(非常合理5.1%、還算合理16.7%);另有6.6%民眾表示不知道/沒意見。 本次調查中,表示自己或同住家人在最近三個月內曾經確診的比例為19.5%,其對政府在確診者的處理與照顧過程滿意度為39.6%(非常滿意7.2%、還算滿意32.4%),不滿意度為58.5%(非常不滿意24.8%、不太滿意33.7%)。其中,最不滿意的三個項目為1922/衛生局電話無法接通(47.5%)、公費快篩試劑數量太少(41.6%)與等待PCR檢驗的時間(36.4%);最滿意的三個項目為領藥過程(27.9%)、就醫/視訊診療過程(25.4%)、等待PCR檢驗的時間(25.4%),然而表示「沒有滿意的地方」占比為33.5%。",https://www.ettoday.net/news/20220531/2262799.htm,東森,政治,
1653949320.0,郭彥均「指揮中心宣導片」被翻出! 他嘆:竟被打成中共同路人,"藝人郭彥均日前在臉書分享與醫護朋友對話,指醫院情況很慘,「看到這(麼)多孩子,就這樣走了」引發許多網友出征,郭隨即刪文道歉;行政院長蘇貞昌更進一步稱將究責、查辦。對此,資深媒體人黃揚明翻出2年前一段畫面,直批部分綠營網軍側翼「這樣真的好嗎?」 黃揚明在個人臉書發文表示,藝人郭彥均2年前曾幫指揮中心拍過防疫宣導影片,甚至在自己的臉書也用「武漢肺炎」來稱Covid-19。 黃揚明表示,綠營網軍側翼還是要把他(郭彥均)打成中共同路人,「這樣真的好嗎?請各位認知作戰專家,快點找出郭彥均截圖來自對岸中國的證據好嗎?」 針對調查局與刑事局介入,要追查郭彥均消息的來源推特帳號「徐芳麗」。黃揚明也打臉調查局的說法,他指出郭彥均在25日凌晨2時34分發文,「徐芳麗」則在25日下午1時02分推文,明顯不是「源頭」。 黃揚明痛批,「製圖的側翼網軍連基本的查證都不懂,就想帶風向說是中共網軍先發文,郭彥均跟著造謠。」",https://www.ettoday.net/news/20220531/2262844.htm,東森,生活,邱晟軒
1653948840.0,不願收回「白痴命令」這句話 柯文哲再罵中央:就真的很笨啊⋯,"中央將於6月1日在自由廣場加開兒童疫苗接種站,使台北市長柯文哲30日認為,「這是很白痴的命令。」引發外界熱議。民進黨籍台北市議員洪健益31日追問,應不應該收回「白痴政策」這句話?但柯文哲秒答「不應該」,事後還小聲加碼一句「就真的很笨啊!」 柯文哲31日下午赴市議會備詢,洪健益先是詢問,是誰說中央在自由廣場設兒童疫苗接種站是「白痴命令」?柯文哲馬上回應,「我。」因為沒有必要設置,「我們學校打完了,我有(規劃)3道防線,學校打一線,還有醫院、診所,不需要設一個大的(接種站)。」 被問到目前台北市學生在校接種率,柯文哲提及,不會超過70%,兒童BNT疫苗大約50幾%,而前面莫德納疫苗也打了約10幾%;不過台北市教育局曾燦金補充,目前有意願接種兒童疫苗的學生佔50%。 洪健益認為,中央事實上也是在幫助台北市,就算真的沒有必要,也可以謝謝中央,或是看到施打率低時看笑話即可。柯文哲則說,「沒有啦!醫護人力要節省使用,真的。」 而洪健益追問,節省醫護人力是對的,但針對「白痴命令」這句話應不應該收回?只見柯文哲秒答,「不應該。」因為會累死醫療人員,「這浪費醫療人力。」 最後,洪健益批評,既然柯文哲已承認「白痴命令」是自己講的,且也不願意公然收回這句話,那就是凸顯出心態傲慢。不過柯文哲仍小聲地說,「就真的很笨啊⋯」讓洪健益再批「造口業」。",https://www.ettoday.net/news/20220531/2262842.htm,東森,政治,袁茵
1653946200.0,高嘉瑜揭台北市長勝選關鍵 黃珊珊民調「這數字」民進黨要贏不難,"台北市長選舉將在年底登場,民進黨立委高嘉瑜31日受訪說,國民黨立委蔣萬安聲勢下滑,若是代表台灣民眾黨參選的台北市副市長黃珊珊民調超過15%,民進黨只要鞏固4成基本盤,加上中間選票,「要勝選也不困難」,並直言衛福部長陳時中卸下職務後可順利銜接參選。 高嘉瑜今天中午受訪說,年底台北市長選舉看起來會是「三腳督」,以現在蔣萬安參選的聲勢一路下滑,黃珊珊則狹著台北市副市長的行政資源,加上疫情間的表現,其實民調還在一路往上,看起來蔣及黃的競爭比較激烈,而且會互相拉扯。 高嘉瑜說,未來台北市長選舉可能變成「正三角」的選舉,民進黨只要鞏固40%的基本盤,再加上一些中間選票,看起來要勝選也不困難;一般預料說,只要黃珊珊民調超過15%,蔣萬安要勝選的機率就會很低。 高嘉瑜直言,如果疫情趨緩,相信陳時中卸下指揮官的職務,就可以順利的來銜接參選台北市長,就算不是陳時中,民進黨也有很多優秀的人才,包括交通部前部長林佳龍也已經在做準備,對民進黨來說,年底的台北市長選舉其實是非常有機會勝選的。",https://www.ettoday.net/news/20220531/2262800.htm,東森,政治,呂晏慈
1653944460.0,立法院昨天打完架 今天3名立委快篩陽,"有關國務機要費除罪化的《會計法》條文修正草案30日再度進入立法院闖關,國民黨團強力杯葛,與綠營爆發肢體衝突,最終該案仍三讀通過,而在這一番近距離接觸後,民進黨立委陳歐珀、吳玉琴、張廖萬堅31日快篩陽性,累計共有22名立委染疫。 張廖萬堅表示,今天北上出席院會前,覺得人有點疲倦,同時有流鼻涕的感冒症狀,馬上回家快篩,結果呈現陽性。 稍早陳歐珀透露,他昨天晚上回到家,覺得喉嚨有點不舒服,快篩後是陰性,以為只是最近太過操勞,沒有放在心上;不過,今天早上又預防性做了快篩,呈現淡淡的陽性反應。 吳玉琴則表示,今天早上有點發燒,快篩結果呈現陽性,稍晚會依規定填寫確診個案自主回報疫調系統,取消一周的行程,會議改為線上。 根據統計,目前宣布確診的有國民黨的廖國棟、蔣萬安、陳雪生、費鴻泰、陳超明、葉毓蘭,民進黨籍的蔡適應、林靜儀、李昆澤、鍾佳濱、沈發惠、趙天麟、邱議瑩、邱泰源、高嘉瑜、邱志偉,加上今天快篩陽的陳歐珀、吳玉琴、張廖萬堅,另有民眾黨的蔡壁如,無黨籍的林昶佐、黃國書。",https://www.ettoday.net/news/20220531/2262669.htm,東森,政治,皮心瑀
1653943860.0,陸威脅以色列媒體下架吳釗燮專訪 外交部斥:貽笑國際,"以色列「耶路撒冷郵報」5月30日刊登外交部長吳釗燮專訪,卻遭中國大使館打壓,威脅如果不撤下該篇報導,將斷絕與媒體往來,降低與以色列的關係。對此,外交部發言人歐江安痛斥,中方威脅打壓只是降低自己的國格,更凸顯中國共產黨專制極權政體內心不安及惶恐,霸道行徑有損國格、貽笑國際。 「耶路撒冷郵報」30日刊登吳釗燮專訪,吳釗燮表達對中國威權主義擴張、可能進犯台灣的擔憂,並示警以色列避免過度依賴中國。報導刊出不久,「耶路撒冷郵報」主編雅科夫‧卡茨(Yaakov Katz)推文透露,他接到中國大使館電話,要求撤下該篇報導,否則將與該媒體斷絕往來並降級與以色列的關係。 對此,歐江安今天在例行記者會表示,這只是凸顯中國共產黨政權不懂民主政體運轉,更不尊重民主國家媒體是獨立運作、有充分採訪自由,記者及人民言論自由都受到憲法保障,在民主國家沒有人會因為思想與執政當局不一致而入獄。 歐江安說,民主國家的記者可以自由撰寫有興趣議題,探索國際議題,採訪其他國家領導人、外交部長及其他決策官員,「把真相公諸於世」是媒體採訪權利。中國外交官員企圖打壓其他國家媒體,凸顯中國共產黨專制極權政體內心不安及惶恐,威脅其他國家也印證中國政府霸道及橫蠻,不尊重以色列自由民主媒體,更不尊重以色列政府。 歐江安批評,中國打壓威脅只會得到反效果,引起人民更大反感及厭惡,也會更加強化民住鬥士、捍衛自由民主人員堅決的決心,中方威脅只是降低自己的國格,堂堂大國威脅另一個國家媒體,只是因為其他國家媒體想要有不同立場採訪自由,中方霸道行徑有損國格、貽笑國際。",https://www.ettoday.net/news/20220531/2262731.htm,東森,政治,呂晏慈
1653943680.0,張善政拜會楊梅黨籍民代 盼累積地方能量「團結支持者力量」,"國民黨徵召桃園市長參選人張善政今(31日)到國民黨楊梅區黨部拜會時表示,他對桃園有12年的感情,雖然後來因念書工作等原因離開,但台灣是他的家,桃園也是他的家。「桃園很大,我們一步一腳印請益,希望將地方朋友能量累積起來,把支持我的朋友團結起來」;至於是否與呂玉玲委員聯繫上?張強調,她後面支持的鄉親力量非常龐大,日後當然需要呂玉玲委員支持。 張善政今年上午拜會楊梅區黨部,由黨部主委市議員周玉琴出面接待,國民黨不分區立委張育美、市議員涂權吉、李家興與前立委廖正井,以及多名里長也到場聲援,展現國民黨團結一致力挺張善政決心。 張善政指出,外界質疑他2016年卸任後不是半退休,怎麼又跑出來?當中有兩個理由。第一是忘不了在桃園12年的感情,雖然已離開桃園10年,但感情是不會淡的。當年在美國唸書,在美國待了好多年,但還是毅然決然回到台灣來,「台灣是我的家,桃園也是我的家」。 他強調:「第二是郭彥均事件,我覺得民進黨這幾年實在太囂張,郭彥均就是一個指標,今年選舉桃園是一個指標性的六都,如果我在桃園選舉打拼,有機會選上的話,希望能讓民進黨體認到,大家對你很不爽,你要注意,要收斂一點。」 張善政認為,今年的選舉除了選張善政以外,希望民眾也不要再去投民眾黨的票了,把我的票數拉高,不是贏一票就好,雖然贏一票也可以上,但我希望將票數領先拉高,讓我的票數很漂亮,讓民進黨知道桃園鄉親對你這麼跋扈很不爽。懇請大家支持我,為了桃園我會奉獻給桃園,第二就是讓民進黨知道要收斂一點,要尊重民眾意見。 此外,媒體詢問今天來楊梅有的目的與用意?張善政強調「桃園很大,我們一步一腳印請益,希望將地方朋友的能量累積起來,把支持我的朋友團結起來」。 至於郭彥均事件,張善政以一部電影名為「一個孩子都不能少」,以這部電影的名稱來表達最貼切。 媒體最後詢問,是否有與呂玉玲委員連絡上?張善政說,現階段都還在努力中,至於呂委員對媒體說「她只有一票,要我多多努力。」張則認為她太客氣了,她後面支持的鄉親力量非常龐大,日後當然要呂玉玲委員的支持,會持續努力聯繫。",https://www.ettoday.net/news/20220531/2262727.htm,東森,政治,沈繼昌
