timestamp,title,article,url,company,category,reporter
1653941032.0,中國昨出動30架軍機擾台 國防部:與徐大鈞AT-3失事無關聯,"空軍1架AT-3教練機今上午於高雄岡山基地起飛,飛官徐大鈞少尉執行單飛任務,卻在起飛3分鐘後光點消失,被發現墜機殉職。另一方面,中國持續加大對台灣的武力施壓,昨囂張派30架次軍機闖我西南空域,由於兩起事件時間點相近引發外界聯想,國防部空軍司令部召開記者會,空軍參謀長黃志偉回應,無特別關係。 空軍5架雷虎小組今在台南西港附近進行訓練,1架AT-3教練機失蹤墜毀高雄市岡山區,消防隊通報抵達岡山區發現機體殘骸、飛官徐大鈞不幸殉職。徐大鈞現年23歲未婚,設籍新北,空軍官校110年畢業(少尉學員),總計飛行總時數達116.20小時,其中AT-3飛行時數也有24小時。 空軍參謀長黃志偉說明,徐大鈞今進行單飛訓練,早上8時03分岡山起飛,短短3分鐘後在機場東北5海哩處失聯。徐大鈞在5月18日完成首次單飛,期間有5次訓練,今執行第二次單飛前,先由教官帶飛一次,確定正常後教官才下飛機,他隨後單飛欲加入航線,就在這時發生意外。 黃志偉說,徐大鈞起飛後,曾用無線電通報飛機情況正常,但在他光點消失前,國防部沒接收到任何其無線電呼叫不正常、飛機故障;事故現場看到人員在飛機殘骸附近,至於有無跳傘還是隨機墜落還要分析殘骸確認。他強調,基地每天飛行前會有驅鳥作業,確定對航線沒影響、低風險才會起飛,而今日岡山地區的天氣也是適宜的。 另一方密,中國解放軍昨出動空警-500機2架次、殲-16機6架次、殲-11機8架次等戰機,侵犯台灣西南空域防空識別區(ADIZ),空軍派遣空中巡邏及緊急起飛等兵力應對,並以防空飛彈追監。黃志偉對此強調,國軍都有透過聯合情監偵系統掌握中國軍方行動,並按照戰備規定派遣飛機或飛彈部隊以及相關監測單位應處,「對方的意圖或造成的影響都納入台海安全情勢評估裡,但跟今天事故沒特別關係」。",https://www.ftvnews.com.tw/news/detail/2022531W0133,民視,一般,
1653940930.0,接受德國媒體訪問 謝志偉指普丁在學習近平:中國犯台危機真實存在,"俄羅斯入侵烏克蘭引發中國武力犯台的憂慮,駐德代表謝志偉接受德國媒體訪問時表示,台灣被中國入侵的危險是當下且真實的存在的,中國國家主席習近平說不定也會效法俄國總統普丁的作為攻打台灣,「也可能是普丁根本在學習近平」。 謝志偉今日在臉書表示,接受德國受民眾青睞的全國性新聞台NTV訪問,記者首先詢問,台灣被中國入侵的危險有多高,謝志偉回應,中國侵略台灣的威脅本來一向就很高,尤其是俄國入侵烏克蘭之後,當然會思考中國會不會有樣學樣而侵略台灣。 謝志偉認為,過去這些年來,中國對台灣的威脅一直沒中斷,「他們不只是動刀動槍作勢威脅而已,而是真的以軍艦、潛艦、軍機繞台等動作武嚇台灣。因此,台灣被中國入侵的危險不只是很高,而是當下且真實的存在。」 接著對於美國總統拜登在東京表態,若中國犯台美國將軍事介入,謝志偉表示,拜登當時的用詞「deal」聽起來有點交易的意思,拜登和他的官員更常講的是「這是美國對台灣負責任的承諾」(It's a commitment we made),也就是如果中國攻擊台灣,美國會一起「抵抗」,不是「幫忙」或「支援」。 謝志偉分析,因為台灣是印太戰略聯盟的一環,如果讓中國控制台灣,那日本、南韓、東協十國,澳洲、美國的利益和安全就受到危害,連歐洲人,如德國法國英國等貿易大國必將全受到波及。 接著記者提問,俄羅斯侵略烏克蘭後,台灣人對習近平的想法有些什麼變化?謝志偉回應,當然會擔心習近平說不定也會效法普丁的作為而攻打台灣,不過台灣人還有另一個倒過來的想法,「也可能是普丁根本在學習近平」。 謝志偉指出,過去這麼長的時間,台灣一直被中國騷擾、威脅,然後習近平在南海、對日本等軍事擴張的行徑都沒受到懲罰,反正都沒事,普丁就會想那就依樣畫葫蘆去攻打烏克蘭。謝志偉說,他要強調的是這兩位獨裁者各自囂張,但互通聲氣。 至於德國或政府還應不應該繼續和中國作生意、會不會因為繼續作生意而犯了如面對俄國時同樣的錯誤,謝志偉認為,德國當然可以繼續和中國作生意,只是作生意的雙方應該就是「夥伴」。但謝志偉點出,中國有和德國或自由世界當「夥伴」嗎?應該是「沒有」,因為中國會勒索這些生意夥伴,只要情況是如此,就不認為這是作生意的夥伴關係。 最後謝志偉提到,德國媒體記者從頭到尾都是用「台灣大使」來稱呼他,重點在「台灣/Taiwan」。",https://www.ftvnews.com.tw/news/detail/2022531W0128,民視,一般,
1653940831.0,中方威脅以色列媒體下架吳釗燮專訪 外交部痛斥:降低國格、貽笑國際,"以色列「耶路撒冷郵報」5月30日刊登外交部長吳釗燮專訪,卻遭中國大使館打壓,威脅如果不撤下該篇報導,將斷絕與媒體往來,降低與以色列的關係。對此,外交部發言人歐江安痛斥,中方威脅打壓只是降低自己的國格,更凸顯中國共產黨專制極權政體內心不安及惶恐,霸道行徑有損國格、貽笑國際。 外交部長吳釗燮接受「耶路撒冷郵報」專訪,對於台海及國際情勢等深入全面闡述,報導刊出後,「耶路撒冷郵報」主筆卡茨(Yaakov Katz)推文透露,接到中國大使館電話,要求撤下該篇報導,否則將斷絕與媒體往來,降低與以色列的關係,不過,卡茨表示,該篇報導還是會繼續刊登。 對此,歐江安表示,非常遺憾,這只是凸顯中國共產黨政權不懂民主政體運轉,更不尊重民主國家媒體是獨立運作、有充分採訪自由,記者及人民言論自由都受到憲法保障,在民主國家沒有人會因為思想與執政當局不一致而入獄。 歐江安說,民主國家的記者可以自由撰寫有興趣議題,探索國際議題,採訪其他國家領導人、外交部長及其他決策官員,「把真相公諸於世」是媒體採訪權利。 歐江安痛斥,中國外交官員企圖打壓其他國家媒體,凸顯中國共產黨專制極權政體內心不安及惶恐,威脅其他國家也印證中國政府霸道及橫蠻,不尊重以色列自由民主媒體,更不尊重以色列政府。 歐江安批評,中國打壓威脅只會得到反效果,引起人民更大反感及厭惡,也會更加強化民住鬥士、捍衛自由民主人員堅決的決心,「中方威脅只是降低自己的國格,堂堂大國威脅另一個國家媒體,只是因為其他國家媒體想要有不同立場採訪自由,中方霸道行徑有損國格、貽笑國際。」 對於中國認為「一言堂」行徑適用其他過家,甚至延伸到世界各地,歐江安表達遺憾,並且重申捍衛自由民主立場。",https://www.ftvnews.com.tw/news/detail/2022531W0129,民視,一般,
1653940740.0,很多孩子都走了?前台大醫1句曝實際情況:有更多孩子「出院了」,"藝人郭彥均先前在社群上指出因為疫情「有很多孩子都走了」,引發各界議論,甚至一度上升至藍綠議題攻防。國民黨主席朱立倫要求全黨聲援郭,行政院長蘇貞昌則說,針對有特定團體「操作不實議題」,會查辦假訊息。不過,前台大感染科醫師林氏璧在社群上指出,郭彥均事件提到很多孩子都走了,但另一方面,未被注意到的是實為台灣兒童腦炎14例當中,「有8例改善或出院」。 林氏璧在臉書粉專《日本自助旅遊中毒者》寫下「台灣兒童腦炎14例有8例改善或出院」,表示會從醫學角度來介入,幫大家分析這個兒童腦炎重症目前的狀況。他指出「截至5月30日前資料,國內累計兒童重症25案例,14案例是腦炎、6名肺炎、2名敗血症、1例哮吼,1例共病(腦腫瘤),及1例家中死亡,經法醫認定與COVID-19有關;上述個案已有10人死亡,5名合併腦炎、2人肺炎、1例敗血症、1例共病(腦腫瘤)及1例家中死亡」關於腦炎,林氏璧指出在分子方面「羅一鈞說明,目前共有14例兒童腦炎、有5位不幸過世、9位小朋友有8位已經病況改善、拔管或是出院。1位還在加護病房,雖還插管中,肝腎功能已有改善。羅一鈞表示,雖然過去一週陸續出現兒童腦炎的個案,但在全國小兒重症,小兒急診等醫療團隊齊心合作下,依照指引給予治療方針後,目前腦炎轉送治療的情況有明顯改進」,分母部分「九歲以下,在5月27日之前至少17萬人確診。這應該還是低估的數字」。林氏璧也做出總結,分析目前數字大約是14/17萬,強調接近台大張鑾英老師的論點,在台灣新冠發生兒童腦炎發生率大約萬分之1。這個數字是警訊,要繼續監測。希望如同羅一鈞所說,接下來再有發生案例都能即時處理,提早給藥讓預後改善。他說明,附圖為高雄市所做的台灣各縣市流行曲線五日均線圖。看來北北基桃花高鋒似乎已過,從這兩天公布的急診來診量,專責病房住院床數似乎也有此跡象。他也舉出數據,指出目前台灣Omicron在兒童的致死率,9歲以下兒童:10/17萬=十萬分之5.9。和美國差不多,比日本韓國高,比香港低。不過各自國家分子分母都可能有問題,僅供參考。不少網友表示「理性探討很重要,疫情嚴重當下散播恐懼及不實言論都無助於防疫」、「我是生了小孩才知道病毒有這麼多的種類。每種病毒包括腸病毒都有重症的機率、死亡率也都不會是0」、「孩子走大家是很悲傷的,但是添油加醋的確不好」。",https://www.ftvnews.com.tw/news/detail/2022531W0130,民視,一般,徐詩詠
1653940450.0,飛官徐大鈞殉職 賴清德哀悼:謝謝守護台灣的天空,"高雄空軍官校1架AT-3教練機今早墜毀於高雄市岡山區,機上少尉飛官徐大鈞不幸殉職。副總統賴清德表達深痛哀悼,也謝謝徐少尉堅守崗位,「守護台灣的天空」。 對於AT-3教練機墜機,少尉飛官徐大鈞殉職,賴清德表示深感哀痛,稍早總統蔡英文也在第一時間指示國防部,儘速釐清事故原因,並全力協助家屬處理後續事宜,他也謝謝徐少尉堅守崗位,守護台灣的天空,願亡者安息,生者節哀。 AT-3教練機上午墜毀在高雄市岡山區田厝一路附近,現場沒有撞擊其他民宅及建物。空軍指出,徐大鈞現年23歲、空軍官校110年畢業(少尉學員),總計飛行總時數達116.20小時,其中AT-3飛行時數也有24小時。 空軍參謀長黃志偉表示,目前失事小組已經進行現場調查、蒐證,而空軍司令部、空軍官校也成立緊急應變中心,目前空軍也下令空軍官校暫停所有訓練任務。",https://www.ftvnews.com.tw/news/detail/2022531W0125,民視,一般,
1653940271.0,徐大鈞起飛後「回報飛機正常」 3分鐘後消失未呼叫故障,"空軍1架AT-3教練機今上午於高雄岡山基地起飛,執行訓練任務時發生事故,飛官徐大鈞少尉殉職。國防部空軍司令部隨後召開記者會說明,空軍參謀長黃志偉指出,徐大鈞今進行第二次航線單飛,起飛後曾透過無線電通報飛機情況正常,接著光點消失,國防部沒接收到任何其無線電呼叫不正常、飛機故障。 空軍5架雷虎小組今在台南西港附近進行訓練,1架AT-3教練機失蹤墜毀高雄市岡山區,相關單位獲報後進行搜救,隨後消防隊通報抵達岡山區發現機體殘骸、飛官不幸殉職。徐大鈞現年23歲未婚,設籍新北,空軍官校110年畢業(少尉學員),總計飛行總時數達116.20小時,其中AT-3飛行時數也有24小時。 空軍參謀長黃志偉說明,徐大鈞今進行單飛訓練,早上8時03分岡山起飛,短短3分鐘後在機場東北5海哩處失聯。他強調,少尉生理航空訓練等都是合格,而今日岡山地區的天氣也是適宜的,現場也有其他教練機進行訓練。 黃志偉證實,徐大鈞今日是單飛任務,為第二次航線單飛。一般而言,學員在第一階段鑑定合格後會有首次單飛,中間會再經訓練後進行第二次單飛;徐大鈞在5月18日完成首次單飛,期間有5次訓練,今執行第二次單飛前,先由教官帶飛一次,確定正常後教官才下飛機,他隨後單飛欲加入航線,就在這時發生意外。 黃志偉說,徐大鈞起飛後,曾用無線電通報飛機情況正常,但在他光點消失前,國防部沒接收到任何其無線電呼叫不正常、飛機故障;事故現場看到人員在飛機殘骸附近,至於有無跳傘還是隨機墜落還要分析殘骸確認。他強調,基地每天飛行前會有驅鳥作業,確定對航線沒影響、低風險才會起飛,今天的驅鳥報告正在詳細彙整中。 黃志偉表示,目前停止飛訓任務,包括基本組、戰鬥組、空運組,以及空軍官校飛行訓練指揮部所屬的全部學員飛行訓練都停止。",https://www.ftvnews.com.tw/news/detail/2022531W0123,民視,一般,
1653939360.0,立法院三讀 高等行政法院增設「地方行政訴訟庭」,"立法院會今天三讀修正通過行政法院組織法、行政訴訟法部分條文,高等行政法院分設高等行政訴訟庭、地方行政訴訟庭,並增訂遠距審理、巡迴法庭等條文,讓民眾訴訟便利性不打折。 對於濫訴的防杜機制,三讀條文規定,如果起訴是基於惡意、不當或其他濫用訴訟程序的目的或有重大過失,且事實上或法律上的主張欠缺合理依據,遭行政法院駁回原告之訴者,行政法院得對實質上進行濫訴行為的原告、代表人或管理人、代理人,各處以新台幣12萬元以下罰鍰。 立法院司法及法制委員會25日併案審查司法院及朝野立委所提行政訴訟法、行政法院組織法部分條文修正草案等案,司法院秘書長林輝煌等人列席報告,並備質詢。 司法院書面報告指出,行政法院的審級分工宜將事件分流,形塑堅實的第一審行政法院,與發揮法律審功能的最高行政法院為目標,讓原分散於各地方法院的行政訴訟庭,改於高等行政法院增設地方行政訴訟庭。在訴訟法上,地方行政訴訟庭相當於「地方行政法院」的審級。 經在場立委及官員討論後,大致上按照司法院提案通過,未有條文保留,初審通過,不須交由黨團協商。全案今天在立法院會處理,在場立委並未提出異議,因此三讀修正通過。 在行政法院組織法部分,三讀條文規定,高等行政法院除別有規定外,指的是高等行政法院高等行政訴訟庭與地方行政訴訟庭。地方行政訴訟庭管轄事件,包括通常訴訟程序事件、簡易訴訟程序事件、交通裁決事件、收容聲請事件及其他法律規定等行政訴訟事件。 然而,外界質疑修法通過後,恐造成民眾訴訟上的不便及增加訴訟成本。 在行政訴訟法修法上,三讀通過條文規定,簡易訴訟程序的審理,當事人一造的住居所、公務所、機關、主事務所等所在地,位於與法院相距過遠的地區者,行政法院應徵詢其意見,以遠距審理、巡迴法庭或其他便利的方式行之。相關認定標準及巡迴法庭的開庭辦法等,由司法院定之。 三讀條文也明定,行政訴訟法所稱高等行政法院,指的是高等行政法院高等行政訴訟庭;所稱地方行政法院,指的是高等行政法院地方行政訴訟庭。 為堅實第一審行政法院,並審酌地方行政法院軟硬體建置、人力逐步到位及案件負荷量情形,三讀條文規範,適用通常訴訟程序的事件,以高等行政法院為第一審管轄法院。 不過,訴訟標的金額或價額在150萬元以下的稅捐、罰鍰或附帶的其他裁罰性、管制性不利處分、其他公法上財產關係訴訟,以地方行政法院為第一審管轄法院。 這次修法也強化高等行政法院移送最高行政法院大法庭統一裁判見解的機制,及保障原住民族、弱勢兒少及身心障礙者近用司法權益,並增訂行政訴訟調解制度等。",https://www.ftvnews.com.tw/news/detail/2022531W0114,民視,一般,
1653939202.0,AT-3起飛3分鐘失聯! 空軍還原經過下令官校暫停訓練任務,"空軍5架雷虎小組今在台南西港附近進行訓練,1架AT-3教練機失蹤墜毀高雄市岡山區,機上飛官徐大鈞不幸殉職。空軍參謀長黃志偉還原案發當時,指出徐大鈞今進行單飛訓練,早上8時03分岡山起飛,短短三分鐘後在機場東北5海哩處失聯,而空軍司令部、空軍官校也成立緊急應變中心,並下令空軍官校暫停所有訓練任務。 AT-3教練機上午墜毀在高雄市岡山區田厝一路附近,現場發現沒有撞擊其他民宅及建物,經軍方初判失事原因是機械故障,空軍司令部稍晚將統一說明。據了解,徐大鈞飛行總時數126.20小時,AT-3飛行時數24小時,而家屬得知消息後已趕往高雄。 空軍參謀長黃志偉中將今天還原事發當時,指出空軍官校少尉徐大鈞今天進行單飛訓練,早上8時03分岡山起飛,8時06分機場東北5海哩處失聯,相關單位獲報後進行搜救,隨後消防隊通報抵達岡山區發現機體殘骸、飛官不幸殉職。 黃志偉透露,徐大鈞現年23歲、空軍官校110年畢業(少尉學員),總計飛行總時數達116.20小時,其中AT-3飛行時數也有24小時。他強調,少尉生理航空訓練等都是合格,家庭狀況設籍新北、未婚。 「今天岡山天氣達單飛標準...這架飛機機身時間6068小時又50分鐘,110年2月17日大檢,近一年無重大修復事件...。」黃志偉補充說到。 黃志偉強調,目前失事小組已經進行現場調查、蒐證,而空軍司令部、空軍官校也成立緊急應變中心,目前空軍也下令空軍官校暫停所有訓練任務。",https://www.ftvnews.com.tw/news/detail/2022531W0112,民視,一般,
1653938769.0,"陳水扁快篩陽確診:不小心染疫,對不起啦!","前總統陳水扁的兒子、高雄市議員陳致中今天透露父親確診,目前沒有發燒,但有咳嗽及喉嚨痛,已開始服藥。陳水扁稍早也在臉書證實自己確診,呼籲大家多注意自己與家人的身體健康。 陳致中在臉書表示,爸爸早上打給他說他確診,「昨篩陰今篩陽」,沒發燒,有咳嗽及喉嚨痛,已開始服藥!他祝爸爸早日康復,也感謝各位朋友的關心,互相加油一起度過疫情的挑戰。 陳水扁則透過臉書說,昨天晚間突感不適,快篩陰性,但今天早上快篩陽性,經醫師判定確診,要居家隔離。「不小心染疫,對不起啦!」他也呼籲大家多注意自己與家人的身體健康,天佑台灣。",https://www.ftvnews.com.tw/news/detail/2022531W0108,民視,一般,
1653937534.0,顏寬恒告「侵害名譽」敗訴! 周玉蔻高喊:正義伸張、天地司法有正氣,"資深媒體人周玉蔻在台中第二選區立委補選期間槓上顏寬恒一家,緊咬欠債不還、霸佔法拍屋,還痛批顏清標脫產給顏寬恒,父子「坑殺銀行」,遭顏寬恒提告並求償145萬元。周玉蔻今(31)日在臉書表示,法官剛剛宣判顏寬恒敗訴,「正義伸張、天地司法有正氣」。 周玉蔻在中二補選期間槓上顏寬恒,緊咬顏寬恒一家欠債不還、霸佔法拍屋、侵占國有地、招待所違建、菲傭命案等,並在政論節目上痛批顏清標脫產給兒子,和顏寬恒父子聯手「坑殺銀行」,因此遭到顏寬恒提告侵害名譽,求償145萬元。 周玉蔻今在臉書高喊,「正義伸張、天地司法有正氣」。她說,顏寬恒控告她中二補選期間評論侵害名譽的民事訴訟案,法官剛剛宣判顏寬恒敗訴!判決主文為,「原告之訴及假執行之聲請均駁回訴訟費用由原告負擔」。 新北市議員參選人卓冠廷也在留言處指出,「我前陣子被他告『侵犯智慧財產權』直接不起訴」。網友們則紛紛直呼,「恭喜正義蔻姐!也證實了邪不勝正」、「正義站在對的一方」、「正義女神」、「感謝蔻姐為了台灣的未來向邪惡宣戰」。",https://www.ftvnews.com.tw/news/detail/2022531W0097,民視,一般,
1653936646.0,美參議員達克沃絲再度訪台 蘇貞昌下午將會面:深入促進台美合作,"去年6月曾來台的美國聯邦參議員達克沃絲(Tammy Duckworth, D-IL)昨日晚間率訪團抵台,外交部表示,達克沃絲將晉見總統蔡英文、拜會行政院長蘇貞昌等人。蘇貞昌今日表示,達克沃絲一直非常力挺台灣,下午將和達克沃絲會面深入交談,促進台美雙方合作。 美國參議員達克沃絲昨日晚間抵台,外交部說明,這是達克沃絲繼於去年6月與聯邦參議員蘇利文(Dan Sullivan, R-AK)及昆斯(Chris Coons, D-DE)等三人搭乘軍機訪台後,時隔不到一年再度訪問台灣。 蘇貞昌今日上午視察桃園機場邊境防疫暨慰勉防疫工作人員前受訪時表示,美國參議員在去年這個時候和另外2位參議員到台灣,宣布美國要送台灣疫苗,提供台灣最需要的幫助,政府非常感謝。 蘇貞昌指出,達克沃絲一直非常力挺台灣,包含台灣防疫和經貿,達克沃絲一直表示最大的關注與支持。蘇貞昌表示,下午將和達克沃絲會面,就各方面深入交談,也更進一步促進台美雙方合作。 外交部說,訪團在台期間將晉見總統蔡英文,拜會行政院長蘇貞昌及經濟部長王美花,並接受外交部長吳釗燮款宴,雙方將就台美關係各項重要議題深入交換意見。",https://www.ftvnews.com.tw/news/detail/2022531W0089,民視,一般,
1653933978.0,不想三角督?國民黨高層拋「高虹安換蔣萬安」 她想選新竹市得先過3關,"年底將進行九合一大選,首都台北市的選情現階段呈現「三角督」,國民黨立委蔣萬安、台北市副市長黃珊珊與衛福部長陳時中,為各黨檯面上熱門人選。不過,身兼民眾黨主席的台北市長柯文哲,近期突喊黃珊珊不會代表民眾黨參選北市,表明對方至今仍是無黨籍,指出民眾黨年底「不一定」會派人出來選北市。有消息傳出,國民黨內高層過去曾拋出「虹安換萬安」的想法,用北市與民眾黨交換「新竹市」,由民眾黨立委高虹安出戰竹市,避免北市、竹市雙雙現三角督情況,最後藍白陷入「兩敗俱傷」的下場。 根據《鏡週刊》報導,針對藍白要如何利益極大化,民眾黨內高層評估,除了北市,唯一有機會挑戰的就是竹市,若不推強棒參選對柯文哲造成重傷。另外,國民黨高層也曾掏出「高虹安換蔣萬安」的想法,也認同認為高虹安是竹市民眾可能會買單的對象,認為國民黨竹市支持高虹安,和柯文哲交換在北市不提名人,支持蔣萬安,促成藍白和,但此構想因藍內部毫無共識,加上柯文哲先前公開表示,就算沒推人「自己也不會挺蔣萬安」的言論而破局。 有民眾黨內幕僚表示,高虹安若要參選竹市得先過三關,包括個人意願、郭台銘與民眾黨願意給多少資源。他強調,高虹安出身鴻海、有專業背景,不是非從政不可,若生涯規劃無意長期從政,可能沒必要玩這局。另外,鴻海創辦人郭台銘和藍、綠政治人物私下皆有交情,若子弟兵選竹市,恐得罪藍綠雙方。特別是藍營,若郭想挑戰2024總統大位,竹市佈局恐得「再想想」。最後是民眾黨有多少資源,民眾黨黨產並不充份的情況下,也會影響高的參選意願。",https://www.ftvnews.com.tw/news/detail/2022531W0064,民視,一般,徐詩詠
1653933457.0,AT-3飛官殉職 黃捷悼「謝謝徐少尉為台灣付出」網不捨:任務完成了,"空軍5架雷虎小組今日上午在台南西港附近進行訓練,上午8時03分起飛,8時08分只有4架平安返航,1架AT-3教練機失蹤墜毀於高雄市岡山區。軍方指出,飛官為空軍官校110年班徐大鈞少尉,消防人員在現場尋獲1遺體,高雄市議員黃捷也哀悼感謝徐大鈞少尉,並說「願亡者安息,生者堅強。」 國防部稍早證實,今日稍早,空軍1架AT-3教練機於高雄岡山基地起飛,執行訓練任務時發生事故,飛官徐大鈞少尉殉職。國防部對同袍傷損深感哀痛與不捨,將依總統指導,全力協助家屬處理後續事宜、徹底釐清肇因。 對此,黃捷透過臉書發文哀悼,五架雷虎小組在台南西港附近訓練,八點回航時,一架失蹤,只有四架平安返航,失蹤的教練機為編號0852,機上飛官是徐少尉,教練機掉落在岡山,飛官徐少尉沒有生命跡象。「謝謝徐少尉為台灣的付出,願亡者安息,生者堅強。」 網友也紛紛留言「任務結束了;一路好走..謝謝你為國家的付出」、「偉大的國軍,一路好走」、「為國捐軀,一路好走」、「任務結束了...願逝者安息,一路好走..」。",https://www.ftvnews.com.tw/news/detail/2022531W0055,民視,一般,
