timestamp,title,article,url,company,category,reporter
,松山機場新設篩檢站?黃珊珊:我早想好新地點,"台北市長柯文哲與指揮中心因中央在松山機場設立篩檢站一事槓上,台北市副市長黃珊珊表示,大量的黑數讓PCR採檢失去實質意義,接下來的重點工作應該以照顧有症狀的確診者為主。她認為,新設篩檢站應以醫院方便最重要,並加碼透露「如果我要再設採檢站,我會設置車來速的急門診,地點我都已經想好了!」 黃珊珊今(22)日在臉書表示,中央在松山機場設置篩檢站前,衛福部醫福會執行長王必勝曾詢問過她的意見,當時她就清楚表達北市的策略是先請各大醫院成立急門診,紓解急診壓力,接下來設立車來速採檢急門診站,最後設立台大醫院篩檢站,再視各急門診篩檢站的預約狀況,參酌是否再開設新的篩檢站。 黃珊珊說,北市的最高指導原則是「保護醫院量能」,絕對不能讓醫護人員疲於奔命,因此在台大醫學院體育館急門診開設前,她本考慮在台北田徑場開設,但因台大醫院認為就近設置較方便,北市也決定全力協助,「大家都在打這場仗,應該是互相火力支援,更不是比賽或互相拉扯,醫院很辛苦,我們必須要當他們的後盾,不能讓醫院累垮!」 黃珊珊指出,若要再設篩檢站,她會考慮設置車來速的急門診,讓民眾免下車就能看診拿藥,並將PCR留給需要保險或請假的人,「地點我都已經想好了!」黃珊珊說,施政有輕重緩急,大量黑數讓PCR採檢已無實質意義,呼籲指揮中心將有症狀加快篩陽,經醫師臨床判斷認定為確診後給予藥物治療的政策擴大開放至65歲以下民眾,儘快讓快篩陽性的民眾好好休養。",https://www.chinatimes.com/realtimenews/20220522001385-260407,中時,政治,黃朝郁
,前進新北疫情重災區 蔡英文3分鐘快閃完成黨職投票,"民進黨今(22)日舉行黨職人員改選,改選全國黨員代表、黨員代表、地方黨部主委等黨職,總統蔡英文上午也到永和孫氏宗祠投票,不過她投完票後簡單與在場的黨內議員、立委致意後隨即離去,對於外界批評她始終不願到新北視察疫情依然沒有回應。 新北市長侯友宜為了法傳系統的問題頻頻槓上中央,也不斷向總統蔡英文喊話,希望她能到全國疫情最嚴重的新北市看看,就能了解民眾的需求與痛苦,但蔡英文接連去了桃園、新竹,卻略過新北市,遭議員批評她真的有「聞聲救苦」? 然而,蔡總統終於在今天到了新北市,不過卻不是去視察疫情,而去參與民進黨黨職人員改選的投票,前後停留不到5分鐘,投完票後簡單與黨內立委、議員等民但簡單交流問候後,立即快閃離去,對於被批評對新北市冷漠,依然沒有回應。",https://www.chinatimes.com/realtimenews/20220522001345-260407,中時,政治,呂健豪
,蔣萬安將獲國民黨提名選北市長 郝龍斌、吳碧珠成選戰顧問,"國民黨周三中常會將正式提名青壯派立委蔣萬安參選年底台北市長,市黨部近日開始號召支持者當天前往中央黨部為蔣壯聲勢外,也啟動成立蔣12區選戰後援會,並規畫最快周二起,預計3周內逐一授證、掛牌,幫蔣全力爭取勝選。 此外,台北市前市長郝龍斌與前台北市議會議長吳碧珠也都將成為蔣萬安競選團隊外圍的選戰策略顧問,對蔣選戰布局與深耕提出建言,並對議題危機處理提出建議,但在競選總部成立前,不會進競選辦公室掛名任何職務。 而近日爭取國民黨提名參選桃園市長失利的黨前副祕書長羅智強,則獲蔣萬安邀請加入競選團隊,但尚未定案。 據指出,吳碧珠私下曾建議,組成類似顧問團組織,將自己、郝龍斌與黨內大老納入,提供蔣萬安選戰諮詢協助。而前郝龍斌市府團隊成員,與前馬政府官員3月間就已在幫蔣萬安上課,加速對市政問題了解,並參與撰寫競選白皮書。 而郝龍斌更已是蔣萬安不定期請益對象,只要市政議題或地方組織工作需幫忙,只要蔣開口,郝也義不容辭協助。而4月初蔣受訪倡議「中正紀念堂」轉型議題引發藍營反彈,郝也建議蔣,不應再碰類似議題,發言也應有防火牆機制。 至於之前傳出蔣萬安競選團隊排斥戰鬥藍傳言,蔣辦除立即對外澄清,知情人士也透露,新聞一出,蔣擔心郝龍斌誤會,立即連繫郝要登門道歉、說明,郝則回應,雙方原本就溝通無礙,並不在意有心人刻意放話分化,讓此流言迅速落幕。 對於周三中常會將提名蔣萬安,黨務人士表示,這對藍營台北市基層是大事,也因此區黨部才對黨務幹部發出通知,但並不是動員,至於有青工與婦女會、工會動員參與,市黨部尊重,但也提醒疫情當前,參與活動要保持適當安全距離。 至於「小雞」現任市議員與市議員參選新人部分,黨務人士說,會透過市議會黨團等系統通知周三常會提名蔣萬安的事情,但一樣不會動員參與。 據了解,蔣萬安本周獲中常會提名後,考慮本土疫情將邁入高峰,不會再辦記者會說明參選規畫,競選辦公室組織架構與市政白皮書也還不會出爐,但提名後會陸續掛出形象看板,並更加強地方連結與曝光,蔣的公開行程會更緊湊。",https://www.chinatimes.com/realtimenews/20220522001328-260407,中時,政治,周志豪
,林為洲勝出竹北黨內初選 林耕仁登門祝賀研商竹市、竹北合作,"國民黨竹北市長黨內初選,由立委林為洲勝出,黨部將送黨中央核備,由林為洲披掛代表參戰年底竹北市長選戰,國民黨新竹市議會黨團支持的新竹市長參選人林耕仁也在第一時間發文恭喜林為州,兩人隨後也相約見面來個「雙林會」,研商「兩市合作」,希望解決新竹市與竹北市之間的交通等問題。 林耕仁表示,恭喜林為洲出線,林是國民黨非常優秀的人才,也是代表參選竹北市長不二人選,希望年底選舉要團結努力,一起為竹市、竹北市的民眾共謀福利,發展城市之間合作。 林耕仁認為,因竹科園區發展,每日從竹北跨區的工作人口流動量大,從竹北市到竹科短短的路程,卻因車流龐大,每到尖峰時刻就出現大塞車,而成為竹北市、新竹市通勤族每日的夢魘。 對此,林耕仁昨天下午特別至林為洲位在竹北市的服處,就跨區交通問題交換意見,討論如何攜手合作改善,一起打造暢通的通勤方案。林耕仁強調,一定要導入科技治理的思維,把交通做改善,還給大新竹的民眾舒適且便利的上下班時間。 林為洲也進一步說明,竹北、竹市之間可謂是1日生活圈,互相的連動非常密切,因為竹科的工作機會,讓兩地的人口愈來愈多,交通的確是後續發展必須面對及解決的重要關鍵議題,未來必須要有更多的配合和協調,才能讓連結的兩地共同成長,繼續發展前進。 據了解,新竹市長人選至今尚未獲中央確定,但地方布局年底選舉並未因中央未有答案而停滯,已獲得新竹市議會正副議長、國民黨團支持的林耕仁,近期除了勤跑基層爭取支持外,也持續與各界洽談合作事宜,林耕仁與林為洲的「雙林會」所聚焦的交通,也是頭前溪兩岸民眾最關心也最希望改善的民生議題。",https://www.chinatimes.com/realtimenews/20220522001307-260407,中時,政治,陳育賢
,民進黨黨職選舉登場 綠委臉書呼籲踴躍投票,"民進黨兩年一度的黨職選舉今(22)日登場,派系間合縱連橫,結果攸關7月黨中央權力核心改選,民進黨立委郭國文、趙天麟等稍早紛紛在臉書發文,呼籲黨員們踴躍投票,投票時間到下午4時止,共同延續民主的價值。 郭國文投票後透過臉書表示,今天一早就來到投票所,投下民進黨「全國黨代表」以及「台南市黨代表」選舉投票;要提醒今日投票時間到下午4時為止,還沒投票的朋友,趕緊把握時間到投票所去投票,攜帶身分證及印章與投票通知單。 趙天麟投票後同樣在臉書呼籲,兩年一次的黨職選舉在今天登場,一早便來到位於苓雅區的極限運動場進行投票,接下來也會繼續到其他10個投開票所進行訪視。 趙天麟說,此次各個投開票所都按照生日月份分流投票,遵守量測體溫、手部消毒 及全程佩戴口罩等防疫規定,希望黨員放心踴躍投票,共同延續民主的價值。",https://www.chinatimes.com/realtimenews/20220522001303-260407,中時,政治,葉書宏
,桃園提名風波不斷 徐巧芯喊話:國民黨需要羅智強「這優點」!,"國民黨上周三(18日)閃電提名前行政院長張善政出戰桃園市長,引爆黨內茶壺風暴,而為參選桃園市長不惜辭職、將戶籍遷到桃園的國民黨前台北市議員羅智強,今(22日)則在臉書大器表示「個人的委曲不足掛齒」,同黨北市議員徐巧芯也直言:「國民黨需要羅智強越挫越勇的精神與正能量」。 徐巧芯今(22日)在臉書指出,國民黨需要羅智強的正能量,因在桃園的提名爭議,黨主席朱立倫、秘書長黃健庭都致歉了,而身為最大「苦主」的羅智強,回應最為大器,羅智強指出「他不需要任何人的道歉,個人的委屈與否並不重要,走出黨派,走進群眾,服務人民才是該走的路」。 徐巧芯坦言,可能黨中央先前很不了解,為什麼辦協調式徵召(依據民調徵召)是最好的方案,「根本不會殺的刀刀見骨,反而有利於整合?就是因為羅智強就是一個有氣度的人,那些無謂的臆測在他身上並不適用」,羅智強能夠不計較先前的紛擾,不意氣用事,真的很不簡單。這一點很多人都做不到,換作是我一定也做不到。 徐巧芯也直言,雖然很可惜,國民黨沒有提名羅智強參選桃園市長,但絕對不能缺少他,真誠建議應儘速且真心、毫無保留的啟動整合,因為「國民黨需要羅智強越挫越勇的精神與正能量,才能打贏選戰!羅智強加油!」。",https://www.chinatimes.com/realtimenews/20220522001270-260407,中時,政治,焦捷
,蔡英文:臺灣需要WHA WHA也需要臺灣,"蔡英文總統今(22)日凌晨(瑞士日內瓦時間21日晚間)以錄影方式為「海外僑界赴日內瓦聲援推動臺灣參與世界衛生大會(WHA)活動」致詞,感謝鄉親在第一線為臺灣發聲,並強調,積極貢獻國際醫療公衛的臺灣,不應該被排除在WHA外;臺灣先進的醫療衛生成就和能力,一定能為維護全球健康,帶來強勁的力量。「臺灣需要WHA,WHA也需要臺灣」。 根據總統府官網,蔡英文總統致詞內容全文如下: 過去兩年多來,全球面對疫情挑戰,更凸顯了健康防疫不該有國界。非常感謝各位鄉親,在今年WHA期間,特地從歐洲、美國、臺灣各地,到日內瓦舉辦活動,在第一線為臺灣發聲。 臺灣絕對有能力參與全球防疫體系,也願意做出貢獻。這兩年多來,臺灣透過公私協力,捐贈口罩給全球80多個國家。 各位鄉親也在各個國家,積極協助捐贈防疫物資,並且分享防疫經驗。這些作為都充分展現「Taiwan can help」、「Taiwan is helping」的精神。 積極貢獻國際醫療公衛的臺灣,不應該被排除在WHA外。全球防疫體系的完整,不應該因為單一國家的政治干預,造成破口。 去年,包括美國、日本,超過40個國家以及歐盟,以多元方式表達支持臺灣參與WHA。 這股來自國際社會的支持聲浪,應該被正視。臺灣先進的醫療衛生成就和能力,一定能為維護全球健康,帶來強勁的力量。尤其,現在是全球面對疫情發展的關鍵階段,我們相信,臺灣的參與是不可或缺。 我要再次感謝各位鄉親,為臺灣站出來,為臺灣努力爭取權利。我們會繼續讓全世界聽到臺灣的聲音。臺灣需要WHA,WHA也需要臺灣。我們一起努力,謝謝大家。",https://www.chinatimes.com/realtimenews/20220522001180-260407,中時,政治,丁世傑
,同婚合法將滿3周年7906對登記結婚 行政院民調認同支持度增加23.5%,"《司法院釋字第七四八號解釋施行法》通過後,於今年5月24日即將滿3周年,截至今年4月30日止,已有7906對同性伴侶登記結婚。行政院性別平等處今(22)日表示,依據民調結果顯示,有60.9%民眾認同同性伴侶應享有合法結婚權利,較同婚法案通過前(2018年調查)的37.4%,增加23.5%。 行政院性別平等處表示,為瞭解民眾對於性別平等觀念發展趨勢,行政院於今年5月4日至6日辦理性別平等觀念電話民意調查,包含民眾對於性別平等、婚姻、同性戀、跨性別者的態度及促進性別平等措施同意度。 調查結果顯示,民眾性別平等觀念持續提升,其中以對同性戀相關議題的看法同意度分數增加最多,有60.9%民眾認同同性伴侶應享有合法結婚權利,較同婚法案通過前(2018年調查)的37.4%,提升23.5%,亦較去年調查提升0.5%。更有高達84.7%民眾認同「助圓夢、安心生、國家跟你一起養」的友善生養環境政策。 此外,有71%民眾同意「同性配偶應該有領養小孩的權利」,71.8%民眾同意「同性配偶一樣能把孩子教養好」,民眾逐步認同同性伴侶除享有平等成家的權利外,亦應有領養及教養小孩相關權利。 行政院性平處指出,《司法院釋字第七四八號解釋施行法》通過後,於今年5月24日即將滿3周年,截至今年4月30日止,我國已有7906對同性伴侶登記結婚。 民眾對於跨性別者的瞭解及友善程度方面亦有逐步提升,調查顯示,已有 66.9%民眾同意「跨性別者包括男跨女或女跨男,裝扮常和自己的生理性別不同 」,較去年調查增加5個百分點進步最多,另有76.5%民眾同意「跨性別者可以選擇自己最舒服自在的打扮在學校讀書或在職場工作」,以及高達89.4%民眾認為「可以與跨性別者當同事」。 行政院性平處指出,在性別刻板印象方面,傳統性別角色定型觀念持續鬆動,有72.9%民眾不同意「男性的責任是賺錢,女性的責任是照顧家人」,有78.7%民眾不同意「太太應該比先生花更多時間在做家事」,有92.0%民眾不同意「女性不適合念理工科系」, 其中高達91.2%民眾同意「女性和男性一樣適合當高階主管」。 行政院性平處指出,行政院近年積極推動「助圓夢、安心生、國家跟你一起養」的友善生養環境政策,更自去年7月起推動「擴大不孕症補助」、「增加產檢補助次數及項目」與「育嬰留職停薪津貼從6成提高到8成」等措施,經統計去年7月至今年3月止,申請育嬰留職停薪整體人數較前2020年同期增加32%,其中男性申請比例增加更高達68%。 調查新增問項結果也顯示,有高達84.7%民眾認為「政府近年所推動的擴大不孕症補助、提高產檢補助及育嬰留職停薪津貼、育兒津貼等『國家跟你一起養』政策,有助國人安心生產、育兒」,顯示政府推動友善生養環境政策已具成效且獲得多數民眾認同,不僅有助於支持女性工作與生活衡平,並促進男性共同分擔育兒責任。 行政院性平處強調,行政院近年推動「消除性別刻板印象、偏見與歧視」重要性別議題,引導相關部會共同推動營造性別平等友善職場並改善職場性別隔離、消弭傳統性別角色觀念及去除刻板印象、促進民眾對多元性別的認識與接受度等,營造尊重包容、性別友善的幸福社會。 此次調查對象為年滿20歲以上的民眾,以電話訪問(CATI)方式進行隨機抽樣調查,共計完成有效樣本1076份,以95%信賴度估計,抽樣誤差約為±2.99%。",https://www.chinatimes.com/realtimenews/20220522001108-260407,中時,政治,葉書宏
,澳洲大選看台灣 精神科名醫:「這點」將成選戰關鍵,"據報導,澳洲聯邦大選結果底定,工黨領袖艾班尼斯將成為新任總理,這是工黨時隔9年再次執政。艾班尼斯在發表當選感言時表示,現任總理莫里森「非常親切地祝我好運」,「我因此感謝他,並祝他一切順利。」 對此時常評論時事的精神科名醫潘建志認為,莫里森政府是因防疫不利而丟失政權,他表示「關係到每個人每個家庭的防疫成效,才是選戰勝負最大因素」,更指出台灣的疫情政情走向「有點像澳洲」。 潘建志今(22日)在臉書發文,直言繼韓國變天後,澳洲總理莫里森大選也輸了,韓國差距很小,莫里森可是大敗,他指出自己分析過澳洲的防疫,莫里森民調狂跌,「是在Omicron海嘯來臨時,一反之前的嚴密防守,無視學者示警,轉性抓狂式的大喊共存開放,和韓國有像」。 潘建志指出,韓國澳洲兩個防疫資優生,Omicron 只一波,死亡人數就比之前兩年所有變種的總和還高,輕症比率低,但染疫人數高太多,結果還是重創,「如此簡單的數學就是教不懂」,而韓國和澳洲,疫苗覆蓋率都比台灣高,「兩國學歐美趕時髦急著共存放飛,經濟還沒起飛,政權先飛走了」。 潘建志表示,莫里森在選舉大打反中牌,宣傳投給工黨就是投給習近平,「但是沒用,民調下去後就拉不起來,我看台灣的疫情政情走向有點像澳洲,忠言逆耳啊」,他更直言,執政黨防疫政策大意不得,選舉造勢影響不大,抗中保台口號也不見得永遠有用,「關係到每個人每個家庭的防疫成效,才是決定選戰勝負的最大因素」。",https://www.chinatimes.com/realtimenews/20220522001069-260407,中時,政治,焦捷
,最新民調曝光 親綠學者:台灣民眾還是希望兩岸和平交流,"日前適逢蔡英文就職第二任總統2周年,根據一項民調顯示,有高達將近七成民眾支持疫情之後兩岸交流開放,台灣國際法學會副秘書長林廷輝解讀,就算中國大陸軍機擾台,民眾還是希望兩岸和平,顯出台灣民眾自信心, 根據《中評網》報導,親近蔡英文的中華亞太菁英交流協會20日舉行「蔡英文就職六週年與兩岸關係發展」民調座談會。 根據最近一項民調詢問,在兩岸疫情穩定的前提下,支持不支持兩岸逐步開放交流,放寬中國大陸人士來台,恢復兩岸人員往來?有68.5%支持,不支持有16.1%,拒答、不知道有15.4%。 台灣國際法學會副秘書長林廷輝解讀,就算中國大陸軍機擾台,還是有高達將近七成民眾支持疫情之後,兩岸交流開放,顯示出台灣民眾自信心。他說,在這個環境之下兩岸和平還是最重要,否則不會有高達七成的民意,還是希望疫情過後還要交流。 林廷輝補充,至於台灣民眾願意上戰場保衛國家有61.4%,這跟烏克蘭民眾是差不多的意志,確實能鼓舞士氣。",https://www.chinatimes.com/realtimenews/20220522001073-260407,中時,政治,丁世傑
,林為洲出線征戰竹北 林耕仁登門「雙林會」,"竹北市長初選,日前民調出爐確定由立委林為洲出線,披掛代表國民黨參戰年底竹北市長選戰,林為洲也在臉書上發文表示,感謝市民支持與肯定,將會當仁不讓,努力打造竹北變成一個更友善、更有溫度的城市。第一時間,國民黨新竹市長參選人林耕仁也在貼文留言:「恭喜為州委員,您絕對是竹北市民最好的選擇」,隨後兩人也聚首「雙林會」討論竹北與竹市之間交通問題,以及未來如何相互合作的共識。 林耕仁表示,恭喜林為洲委員出線,林委員是國民黨非常優秀的人才,也是代表參選竹北市長不二人選,希望年底選舉要團結努力,一起為竹市、竹北市的民眾共謀福利,發展城市之間合作。 林耕仁認為因竹科園區發展,每日從竹北跨區的工作人口流動量大,從竹北市到竹科短短的路程,卻因車流龐大,每到尖峰時刻就出現大塞車,而成為竹北市、新竹市通勤族每日沉痾。對此,林耕仁與林為洲就跨區交通問題交換意見,討論如何攜手合作改善,一起打造暢通的通勤方案。林耕仁強調一定要導入科技治理的思維,把交通做改善,還給新竹的民眾舒適且便利的上下班時間。 林為洲進一步說明,竹北、竹市之間可謂是一日生活圈,互相的連動非常密切,因為竹科的工作機會,讓兩地的人口增加的越來越多,交通的確是後續發展必須面對及解決的重要關鍵議題,未來必須要有更多的配合和協調,才能讓連結的兩地共同成長,繼續發展前進。 雖新竹市長人選中央尚未確定,但地方也並未在等待中央,獲得地方正副議長、國民黨團支持的林耕仁除勤跑基層爭取支持外,也持續與各界洽談合作事宜,林耕仁、林為洲「雙林會」所聚焦之交通,也是兩地民眾最關心也最希望能改善的民生議題。",https://www.chinatimes.com/realtimenews/20220522000997-260407,中時,政治,綜合報導
,羅智強將走透桃園13區 明中壢火車站出發,"國民黨日前提名前行政院長張善政參選桃園市長,引發地方討論,前台北市議員羅智強22日公布新計畫,將展開「祈福走桃園,傾聽人民苦」,走透透桃園13區、516里。23日早上8時從中壢火車站出發,傾聽桃園市民在疫情下的痛苦,幫助人民發聲,為桃園市民喉舌。 羅智強在臉書發文,他寫到,這一陣子,很多人為我不捨,個人的委曲不足掛齒。真正讓我感到不捨的是,疫情蔓延下,許多人民的痛苦。當疫情威脅到父母孩子的生命和健康、打擊了丈夫妻子的工作和經濟,恐懼、惶恐、無助、無奈,反覆的聽,聞之鼻酸,希望能為這群深受疫情之苦的民眾,貢獻棉薄之力。 羅又說,但已無公職的他,沒有行政官員的公權力,也沒有民意代表的監督權。我只能用腳祈福桃園,傾聽民苦、為民喉舌。所以決定展開「祈福走桃園,傾聽人民苦」結合「桃園千里行」,和他新成立的「桃園疫情關懷中心」要把桃園13區,516里走透透,傾聽桃園市民在疫情下的痛苦,而我也會努力的把大家的陳情反映給桃園在地的民意代表,請他們能夠幫助解決大家的問題、減輕大家的痛苦。 「明天早上八點,我會從中壢火車站出發」,羅智強也引用1名民眾的陳情,做為出發宣言。民眾說,1家3口確診,孩子氣管痙攣,引起血氧不足造成心臟酵素過高,引起心跳過快,有可能變心肌炎,所幸最後沒事,但不要再讓政府一直教育人民沒事了都輕症,反而害死很多孩子。",https://www.chinatimes.com/realtimenews/20220522000901-260407,中時,政治,賴佑維
,羅智強太可憐!「藍營小天王」終於不忍了 6字嗆爆朱立倫,"國民黨18日宣布徵召行政院前院長張善政參選桃園市長,引發輿論譁然。為展現參選決心而辭去台北市議員的羅智強,獲大批支持者與黨內青壯派支持、同情。2018年以第二高票(第一為羅)當選台北市大安、文山區市議員的李柏毅直言,張無疑是個人才,但黨中央「突襲式」手段,讓張的參選蒙上灰;李更痛批,黨主席朱立倫的處理手法「怎麼能夠服眾」。 李柏毅19日在臉書發文表示,張善政在學經歷方面,無疑是個人才,可惜的是,黨中央在沒有經過充分溝通協調的情況下,突襲式的通過徵召,讓原本也有意角逐桃園市長的黨內候選人及支持者震驚不已;眼下這種方式所造成的裂痕,遠比舉辦一場初選讓大家公平的去競爭,來得更難以修復。 李柏毅指出,年底桃園市這一局,若加上張善政,原本看似兵多將廣,羅智強展現決心,請辭台北市議員,奮力一搏;立委呂玉玲勤跑基層,地方實力雄厚;魯明哲、萬美玲兩位立委也都鬆口願意承擔。如今尚未開戰,卻因為派誰擔任先鋒大將一事,搞得全軍士氣低迷,令人遺憾。 對此,李柏毅強調,黨內所有有意參選桃園市長的同志,都是希望能幫國民黨贏回執政、桃園能有更好的發展,他們的努力,值得一個公平的機會,「否則又怎麼能夠服眾呢?」李呼籲黨中央,應提供黨員良性競爭、正向發展的機會,這樣國民黨才有未來。",https://www.chinatimes.com/realtimenews/20220522000899-260407,中時,政治,王子瑄
