timestamp,title,article,url,company,category,reporter
,朝野立委抵日內瓦 游錫堃:政治因素不該是參加WHA的唯一條件,"第75屆世界衛生大會(WHA)22日至28日將在瑞士日內瓦召開,跨黨派立委視導團於當地時間21日中午抵達日內瓦。對此,立法院長游錫堃今(22日)表示,世界衛生組織(WHO)沒有任何正當理由可以將台灣拒於門外;他強調,政治因素不該是台灣參加WHA的唯一條件!嚴正呼籲WHO正視國際社會支持台灣的強烈訊號,並邀請台灣參加今年的WHA,完整全球公衛拼圖。 游錫堃今(22日)透過臉書表示,第75屆WHA開議在即,台灣很遺憾地在中國打壓下仍無法參與會議。立法院作為全國民意最高機關,組成了跨黨派的視導團前往日內瓦,由立委王婉諭、國民黨立委李德維、陳玉珍及民進黨立委林靜儀與外交部和衛福部,共同為台灣全體國人發聲。 游錫堃說,台灣的醫療實力以及在疫情期間與各國互助所展現出的人道精神,國際社會都看見了,WHO沒有任何正當理由可以將台灣拒於門外。今年除了WHO中13個會員國提案力挺台灣參加WHA之外,還有歐洲地區34個國家的1504位國會議員連署表態,以及美國、加拿大、日本、澳洲、紐西蘭等71個國家超過3700位政要與國會議員聲援。謝謝民主同盟國家與台灣站在一起。 游錫堃強調,政治因素不該是台灣參加WHA的唯一條件!嚴正呼籲WHO正視國際社會支持台灣的強烈訊號,並邀請台灣參加今年的WHA,完整全球公衛拼圖,才是真正履行「人人享有健康#HealthForAll」的承諾。 游錫堃說,於此同時,在所有醫療人員及全體國人的努力下,台灣將持續在全球醫療體系貢獻己力,讓WHA認知到需要台灣參與大會的急迫性與重要性,讓世界看見我們的「堅韌」與「良善」。文末還標註「#StandWithTaiwan」。",https://www.chinatimes.com/realtimenews/20220522001673-260407,中時,政治,葉書宏
,鄭朝方出任綠營新竹縣黨部主委 不排除選新竹縣長或竹北市長,"民進黨新竹縣黨部22日舉辦第17屆主任委員、縣黨員代表暨第20屆全國黨員代表選舉,辭去總統府參議的鄭朝方,參選主委沒有競爭者順利當選,他從現任主委彭瑞德手中接下球棒,象徵延續推動黨務工作的重擔,對是否參選新竹縣長還是竹北市長?鄭朝方首度鬆口說「都不排除!」 鄭朝方指出,新竹縣長和鄉鎮市長的佈局是連動的,縣長部分他會建議中央評估徵召具有全國知名度的政務官,或是連任屆滿的縣市長參選新竹縣長,產生最強的母雞,才能讓新竹縣綠營基層士氣大振! 鄭朝方並說,鄉鎮市長部分會積極找在地優秀人才,也不排除跟黨中央借將,讓具有公職身分的從政人員參選,在人口有5萬人以上的鄉鎮市推出最優的鄉鎮市長候選人,使新竹縣基層民眾看到民進黨的誠意,進而支持民進黨。 鄭朝方不諱言,新竹縣是民進黨的艱困選區,自己深蹲5、6年,也時時反省發現,除需要時代去代謝老舊勢力,更需要接地氣,尤其地方聲音要常跟中央來傳達,很多政策需要配套措施去貼近民意。 鄭朝方指他擔任主委後會更加強這方面的工作,透過不一樣的新思維,跳脫政黨色彩的印象,讓不同族群和年齡層的民眾認同,號召更多各界菁英投入公眾事務的行列,也會將各面向意見納入各層級選舉的政見願景。 鄭朝方對選新竹縣長還是竹北市長的問題,首度鬆口說「都不排除!」並提出縣長徵召人選的條件,具全國知名度的政務官,或是連任屆滿的縣市長。 鄭朝方表示,會密集與中央找出最適合的新竹縣長徵召人選,更重要的是要在新竹縣結合多進步力量,一起來翻轉舊政治,這不僅是政黨之間,也是世代之間,難度非常高,至於他個人未來的戰門位置,會與進步力量的好夥伴一起討論,相信結合後會給國民黨很大壓力!",https://www.chinatimes.com/realtimenews/20220522001657-260407,中時,政治,羅浚濱
,半夜咳醒 高嘉瑜自曝快篩陽:一切都來得無聲無息,"民進黨立委高嘉瑜今(22日)在臉書秀出快篩兩條線,自爆快篩陽。 高嘉瑜指出,自己前天開始有點喉嚨癢癢不舒服,當下快篩陰,昨天開始咳嗽,半夜咳醒幾次,今天早上昏昏沈沈,有點喉嚨痛、頭痛、咳嗽,「然後就快篩陽了」。 本土疫情嚴峻,民進黨立委高嘉瑜今(22日)表示,從上周五開始就覺得喉嚨癢癢、痛痛的,當時快篩為陰性,但昨天狀況變嚴重,晚上多次因咳嗽咳醒,今早起床後昏昏沉沉、頭痛,自己也嚇了一跳,「一切都來得這麼突然、這麼無聲無息。」 高嘉瑜表示,剛剛快篩結果為陽性,喉嚨癢癢的,下午會去松山機場防疫門診篩檢站PCR篩檢,從上周五開始就覺得喉嚨癢癢、痛痛的,有一點想咳嗽,除此之外也沒有其他狀況,當時快篩陰性,至昨天狀況變得較嚴重,但快篩還是陰性。 高嘉瑜說,昨天晚上多次因咳嗽咳醒,外傳「咳嗽會咳出肺」、「吞口水跟吞刀一樣」,但自己沒有這麼嚴重,今早起床後昏昏沉沉、頭痛,快篩呈現陽性,自己也嚇了一跳,一切都來得這麼突然、這麼無聲無息,不知道何時何地就已經接觸到病毒染疫,稍晚會進一步PCR確認。 高嘉瑜說,相信只要打滿3劑疫苗,其實也不用太過擔心,大家平安度過最重要,會遵守中央流行疫情指揮中心的相關規定。",https://www.chinatimes.com/realtimenews/20220522001670-260407,中時,政治,焦捷
,柯文哲身體不適快篩陽!急赴醫院PCR採檢 擔心傳染給她,"本土疫情持續擴大,日前台北市副市長黃珊珊PCR陽性確診,於19日才剛出關,不料台北市長柯文哲今(22)早出現喉嚨不舒服的症狀!柯文哲快篩後呈現陽性反應,已前往聯醫進行PCR採檢,目前正等待結果中。 台北市長柯文哲在臉書發文指出,早上因為咳嗽,喉嚨有些不適,主動做了快篩結果是陽性。他表示,他上網掛號預約仁愛醫院防疫急門診,已採檢完畢,正在等待PCR結果。 他強調,狀況還好,市政工作不會受到影響,一切如常,只是要小心不能傳染給妻子陳佩琪,因為還有很多醫療與防疫工作需要陳佩琪,我們會萬事小心,也請大家不用擔心。",https://www.chinatimes.com/realtimenews/20220522001621-260407,中時,政治,黃朝郁
,綠委邱志偉喉嚨不適聲音沙啞 今快篩陽、等待PCR結果,"民進黨立委邱志偉今(22日)透過臉書表示,昨天早上起床喉嚨有點不舒服,快篩呈現陰性,今再度快篩結果出現2條線、呈陽性反應,將等待PCR篩檢結果。但他宣布從今天起開始進行7天居家隔離,立法院的會議及質詢會用視訊來進行。 邱志偉表示,昨天早上起床喉嚨有點不舒服,立刻就快篩,結果是陰性,中午不放心又再快篩一次,結果也是陰性,但由於喉嚨痛是明顯的徵兆,所以昨天即停止下午、晚上的行程,開始進行居家隔離。昨晚喉嚨依然卡卡,今天早上起床立即作快篩,結果就出現兩條線,意思就是快篩陽性。 邱志偉說,接下來就要等PCR的結果,確診的可能性相當大。從今天起開始進行7天居家隔離,未來7天的地方行程只能由祕書代替我參加,國會辦公室,岡山服務處會進行全面清消,並且照常上班,服務不中斷,工作不打折,立法院的會議及質詢會用視訊來進行。 邱志偉表示,現在身體沒有不舒服,精神還不錯,只是喉嚨卡卡聲音有點沙啞,這幾天有接觸的同仁或朋友,如果有造成大家的困擾或不便,還請多見諒包涵,利用7天隔離期,希望能好好看書,好好鍛鍊體能。",https://www.chinatimes.com/realtimenews/20220522001610-260407,中時,政治,葉書宏
,國民黨桃園市長風波 議員憂恐變成「討厭朱立倫不投張善政」,"國民黨確定提名前行政院長張善政參選桃園市長引發風波,甚至傳出議長邱奕勝可能參選桃園市長,市議員黃敬平說,最近朱立倫打給桃園每一位國民黨議員希望化解反彈做一些溝通,但這都於事無補,希望他趕快與傅崐萁等黨內大老帶著張善政向邱奕勝、呂玉玲夫妻及羅智強等人懇談好好善後,否則拖更久只會讓僵局更難看,地方上的心結更打不開。 黃敬平說,地方上對於朱立倫採取突襲性提名很有意見,認為是朱剛愎自用,所以就算他打給每一位議員希望化解反彈,想要做一些溝通,這也是於事無補,因為他聽到的都是議員們在電話中嗆朱,另外也有很多人認為為何國民黨不能辦初選?一盤好棋被下壞,現在地方支持者有很多反彈情緒,擔心之後的選舉將演變成討厭朱立倫的情緒蔓延而不願意投張善政。 而徵召張善政引發反彈,國民黨祕書長黃健庭、張善政本人也在臉書上致歉,國民黨台北市議員游淑慧說,希望國民黨對於黨內同志,除了政治與輸贏外,能多點溫暖與人情。黃敬平對此嗤之以鼻,認為如果黨中央有想到這一點的話,地方上就不會感到被背叛和被羞辱,而且黨中央沒有按照程序走,也讓人聯想到2016年的「換柱事件」,這場大火恐怕不容易撲滅,所以還是需要朱立倫主席放下身段,解鈴還須繫鈴人,建議他趕快到桃園來與相關人士好好說清楚。 對於邱奕勝是否參選桃園市長用來逼退張善政?黃敬平也說這傳聞不可能,根據他對邱奕勝及其家人給的訊息,如果邱要親自出馬,去年底今年初傳出要參選桃園市長時就會選到底了,也就不會發生這些風風雨雨,目前他不會出來參選桃市長,選議長才是他的布局考量,而目前呂玉玲揚言不排除參選到底,相信邱還是會站在支持的角色從旁協助,而黨中央若要解決這些問題,如果要避免邱退出國民黨,唯有朱立倫一定要放下主席身段,希望他在這兩天內一定要找到邱議長好好談一談。",https://www.chinatimes.com/realtimenews/20220522001599-260407,中時,政治,呂筱蟬
,快篩陽性確診標準放寬 侯家軍砲轟中央為反而反,"對於近期「快篩陽性視同確診」中央、地方不同調,新北市長侯友宜頻頻對指揮中心喊話要放寬標準,但一直未獲回應,但昨(21)日,指揮中心卻擴大到離島地區,甚至陳時中還鬆口說「未來很快會全面開放」,對此,侯家軍、國民黨新北市議員候選人戴湘儀今天也在臉書批評中央,她直指「早點做,人民會少走很多冤枉路。」並以自己從確診的經驗表示,親身經歷才知確診者的苦。 戴湘儀指出,「快篩陽性視同確診」,侯市長從五月初就提出,希望中央可以聽到地方的聲音,快篩陽取代PCR陽性,可以把醫療量能省下來,去保護中重症的確診患者,讓醫護人員回歸急診CPR的人力,更可以省掉民眾排隊等候的時間和精力,因為這根本是沒必要的麻煩事! 她說在大醫院外,看到大排長龍的景象,有老人家獨自穿著雨衣、帶著大包小包到醫院,不敢喝水,只怕沒有地方上廁所;還有媽媽帶著小孩,忍受烈日曝曬,幾個小時沒吃東西;更有許多快篩陽性患者,忍受病痛等待,不僅是體力考驗,也是精神折磨,這些都讓人感到難過。 戴湘儀更用親身經驗說明,她說去醫院那天只有18度,天空還飄著雨,她腳步蹣跚、頭暈目眩,全靠著意志力慢慢走,但到了醫院才發現假日沒開PCR門診,用手機搜尋還能去哪,太遠的又因為當時體力狀況走不到,沒有交通工具、又不能搭乘大眾交通,這樣的情況真的讓人很無力,只好慢慢走回家中休息。 戴湘儀批評中央慢半拍,根本是在折磨確診患者,既然能做,為何不早點做?為何麼要讓人民新苦排隊?指揮中心在13日還用所謂的偽陽性問題搪塞侯市長,不同意「快篩陽性視同確診」對象擴及所有人,但在昨天卻擴大到離島地區,甚至陳時中還鬆口說「未來很快會全面開放」。 最後她說,請指揮中心不要因為是侯友宜市長提出來的,就有藉口駁回,到頭來受苦的還不是人民?希望中央政府多替人民想一點,不要只為了反對而反對,到最後還不是得做!",https://www.chinatimes.com/realtimenews/20220522001593-260407,中時,政治,呂健豪
,桃園議長參選市長? 邱奕勝臉書發文有意澄清,"外傳桃園市議長邱奕勝將宣布參選桃園市長,眾藍營議員皆覺得不可能。桃園市議長邱奕勝臉書粉絲專頁稍早發出貼文,指22日起連3天將有中壢選區市議員民調,請大家支持,用意似乎是打破參選桃園市長傳聞。 國民黨主席朱立倫提名前行政院長張善政參選,事先未與地方溝通,外界認為不尊重積極在地方輔選邱奕勝。有傳言說,邱奕勝將參選桃園市長,多名藍營市議員皆表示不可能。1名市議員說,議長不是不可能退黨,只是參選市長這種說法太誇張。 記者無法取得邱奕勝回應,不過邱在臉書寫到,「22、23、24日」中壢選區的議員民調請大家支持晚輩「奕勝」拜託、謝謝,感恩大家。所附照片中,除邱本人照片,一旁也寫上「電話民調,懇請唯一支持桃園市議員參選人(中壢區)邱奕勝。」 對於指邱參選,藍營市議員舒翠玲表示,請有心人士不要故意見縫插針、製造動亂。「這樣汙蔑議長,這樣實在很不OK。」另名藍營黃敬平也直說,「沒聽說,沒消息,不可能」,認為不可能造成藍營分裂,讓綠營得利。",https://www.chinatimes.com/realtimenews/20220522001489-260407,中時,政治,賴佑維
,何博文反批侯市府 府發言人:中央地方互相協助、補位,"民進黨今(22)日舉行黨職人員改選,現任新北市黨部主委何博文追求連任,他受訪時對退選的余天表達感謝,並弭平外界的傳言,他認為選舉過程中難免有粉擾,但這些流言不是最重要的,隨後他話鋒一轉,反嗆新北市長侯友宜,批評他只會包裝,遇到事情就砲轟中央推卸責任,並替總統蔡英文緩頰,認為總統對疫情的關心是全面性、全國性的。 對於選前外界傳言,湧言會找正國會合作,甚至王定宇「細膩操盤創造戲劇性逆轉」一席話,一度引起蘇系、新系不滿,更有人揚言要投廢票或將票投給已退選但仍印在選票上的余天;對此,何博文表示,過程當中難免有些紛擾、留言,但這些都不是最重要的,民進黨當前要更加凝聚,強化監督力,讓年底議會席次過半,再現綠色榮光。 何博文表示,非常感謝余天退選提攜後進,他對民進黨的無私奉獻,相信大家都看得很清楚,何博文也說,在余天的指導下,過去2年自己有做出成績,若未來順利連任,會讓黨務更加精進。 不過對於新北市長侯友宜頻頻因法傳系統槓上中央,還央求蔡英文總統到新北看一看,何博文則是反嗆侯友宜,新北市在全台面臨疫情最嚴峻的時刻,卻華而不實只會包裝,遇到事情只會推卸責任、砲轟中央,他也替總統緩頰,認為總統對於疫情的關心是全國姓、全面性的,且台灣的防疫成就數一數二,全世界都給予肯定,在疫情逐漸要平息的最後關鍵期,希望大家都能心平氣和,全力支持指揮中心及第一線的醫護、防疫人員。 不過對於被批評「過疫情而不入」,蔡英文總統本人則是沒有回應,僅表示由總統府發言人張惇涵發言。張惇涵受訪時則是表示,總統非常關心全國的防疫工作,也親自的協助,中央地方互相協助、互相補位,做好防疫工作,這是總統的期待及努力的方向。 張惇涵舉例,總統上周四就已致電台大醫院院長吳明賢,希望就兒童醫療部分能夠擴大量能,同日也致電新北市醫師公會,除表達新北基層的醫療人員外,也希望新北市能夠再多協調一些基層醫師,投入居家照護、遠距問診及第一線篩檢站的工作,而且總統過去就曾致電侯市長,關心地方上的防疫工作,張惇涵強調,當前防疫工作的第一要務是增加民眾的便利性、減少大型醫療場所的負擔,把資源集中在中重症及高風險族群。",https://www.chinatimes.com/realtimenews/20220522001515-260407,中時,政治,呂健豪
,民進黨黨職選舉攸關總統提名 賴清德台南投票展現人氣,"民進黨黨職選舉22日投票,選出的全國黨代表可決定2024年總統黨內提名遊戲規則,攸關權力核心誰屬,黨內高層將這場選舉看得比年底的地方選舉還重要,各派系強力動員,副總統賴清德22日上午投票展現人氣,民進黨台南市黨部主委潘新傳5日確診新冠肺炎,剛解隔離就到各投開票所固票。 3年前人氣高的賴清德,因民進黨中執會屢次更改黨內總統民調時程與辦法,敗給追求連任的蔡英文,掌握中執委人數被視為關鍵。 民進黨22日選出的全國黨代表,7月可改選中執委,中執委可決定2024年的總統黨內初選規則。民進黨資深幹部皆知,22日的選舉結果,直接衝擊未來黨內權力核心。 賴清德22日上午在南區投票,維持在台南的一貫高人氣,基層黨員不斷高喊「賴醫師加油」,尋求簽名合照。他來者不拒,一一與黨員寒暄後離去。 潘新傳這次雖同額競選台南市黨部主委,卻緊盯全國黨代表的當選席次,他5日感染新冠肺炎,22日剛解隔離就現身投開票所,關心投票率。 儘管南部疫情正加溫,民進黨這次黨職投票並未規定要出示黃卡與證明施打幾劑疫苗,台南市南區南都里活中心22日一早湧現投票人潮,投票至下午4時結束。 民進黨黨職選舉賴清德總統蔡英文",https://www.chinatimes.com/realtimenews/20220522001438-260407,中時,政治,程炳璋
,身處空難指揮若定 劉孝堂接防砲暨飛彈指揮官,"據透露,空軍高層人事將有異動,空軍防空暨飛彈指揮部指揮官劉峯瑜內定升任空軍副司令,防空暨飛彈指揮部指揮官將由聯三作計室處長劉孝堂少將升任,並晉升中將。人事命令將於6月1日生效。 2020元月2日,空軍一架黑鷹直升機在北部山區失事墜毀,前總長沈一鳴等8人不幸罹難,劉孝堂當時也在機上,劉孝堂爬出機體外後,雖然腰椎二、三、四節骨折,右耳也有撕裂傷、身體多處挫傷,但仍相當鎮定,除用手機與辦公室聯絡外,同時也將失事現場拍照,一一傳回參謀本部。此外,劉孝堂是砲科出身,接掌空軍防空飛彈指揮部,也算回歸專業。 0102空難,大難不死的3位將領,在恢復健康後,都升任軍中要職。其中,曹進平任空軍作戰指揮部指揮官;黃佑民任海軍艦指部指揮官,劉孝堂則將接任空軍飛彈指揮部要職,並晉升中將。 前空軍司令熊厚基上將因建康因素,於5月調任總統府戰略顧問,劉任遠升任空軍司令,並晉任二級上將,而劉所遺副司令職缺,由劉峯瑜升任。劉峰瑜與現任空軍副司令孫連勝中將是同期同學。",https://www.chinatimes.com/realtimenews/20220522001456-260407,中時,政治,呂昭隆
,疫情衝擊血庫 蔡英文鼓勵捐血籲打滿三劑疫苗,"疫情期間影響國內血庫存量,蔡英文總統今天鼓勵捐血,並呼籲國人,一起幫忙提升疫苗覆蓋率。請大家互相提醒親朋好友,一定要打滿三劑疫苗。65歲以上民眾可接種第四劑,兒童疫苗陸續到貨也可選擇接種。她強調,疫情期間,最重要的就是團結互助,一起凝聚力量,共同來為台灣努力。 台北市小英之友會從2017年開始舉辦捐血活動,號召民眾捐血,為提高捐血量,這次與醫療財團法人台灣血液基金會台北捐血中心經過多次研議、歷時一年半籌備打造小英號捐血車及血液運送車。 小英之友會捐贈的環保無動力捐血車配備外接電源,大幅減少碳排放,車內空間也比傳統捐血車寬敞,總共可容納 6 座捐血床,既可以減少空汙,也能提升捐血效率,減少民眾排隊捐血的時間,車輛外觀則彩繪藝術家洪易的視覺藝術。 蔡英文總統今天由內政部長徐國勇、全國小英之友會總會長顏志發、台北市小英之友會總會長陳茂仁、血液基金會侯勝茂董事長陪同,出席小英之友會在大安森林公園舉辦的「小英號捐血車、血液運送車捐贈啟用典禮」記者會。 蔡英文致詞表示,這兩年多來,台灣社會受到疫情的影響,在生活上有許多的改變,但不變的是,所有小英之友會的好朋友,許許多多團體都持續在做公益,為民眾提供服務。 在疫情期間,台灣的血庫存量比較低,她說,大家的捐血行動更是特別重要,可以一起來支持醫療量能,做醫護團隊的後盾。尤其,這次大家集合眾人的力量,捐贈出的環保無動力捐血車,可以降低環境污染,讓捐血行動兼顧環保,「真的非常感謝大家的用心」。 此次捐贈的車輛,有很多人參與設計、討論,參與整個建造的過程,還有藝術家洪易畫的公共藝術,蔡英文表示,這是集眾人之力,所做出來今天呈現的捐血車、運送車,再一次感謝所有投入的團隊。 台灣正處在疫情的關鍵時刻,藉這個機會, 她拜託大家,一起來幫忙提升疫苗覆蓋率。請大家互相提醒親朋好友,一定要打滿三劑疫苗。現在,65歲以上的民眾,還有符合接種資格的朋友,也已經可以接種第四劑。 另外,12歲到17歲青少年的第三劑,最快周三、5月25日就要開打。她提醒,家裡如果有5到11歲的小朋友,最近兒童疫苗已經陸續到貨,爸爸媽媽也可以選擇讓孩子接種,提升保護力。 蔡英文強調,疫情期間,最重要的就是團結互助,我們互相提醒防疫資訊,互相關懷幫忙。今天看到這麼多朋友來到現場,這就是我們一起凝聚力量,共同來為台灣努力。她再次感謝所有防疫團隊、醫療團隊,「他們這段時間確實很辛苦,我們也要給他們多多關懷、支持」。 她也期待,「小英號」的啟用,能夠拋磚引玉,讓更多人一起加入捐血的行列。「再次感謝各位的付出,我們繼續一起打拚」。",https://www.chinatimes.com/realtimenews/20220522001427-260407,中時,政治,崔慈悌
,蔡英文執政6周年 4.7萬人網路民調出爐 網友:真是受夠了,"蔡英文總統執政今年滿6年,根據一項4.7萬人參與的網路投票顯示,87%不滿意蔡政府表現,另外還有47%的民眾認為衛福部做得最不好!網友評論「可以提早換人嗎?真的是受夠了!」 根據Yahoo新聞截至今(22)早8時,逾4.7萬名民眾參與的投票結果顯示,問道「對於蔡政府表現,你滿不滿意」?回答非常滿意6.7%與還算滿意4.7%,合計僅11.4%;不太滿意8.1%與非常不滿意79.2%,合計則高達87.3%;顯見絕大多數民眾並不滿意蔡政府表現! 續問及「你認為哪個部會做得最不好?」較多民眾認為做得最不好的前3名依序是:衛福部47%、不當黨產處理委員會25.3%與促轉會16.3%。 而網友也湧入該網站留言表示,「蔡EE還活在元宇宙」、「疫苗之亂、快篩試劑之亂、PCR之亂、藥物之亂,防疫走鐘什麼都慢半拍...單日確診數全球第一?死亡人數與日俱增視若無睹?」、「都想吐口水了,還民調」、「再不滿,年底還不是把票給民進黨,大家好自為之」、「全世界怎麼跟得上」、「可以提早換人嗎?真的是受夠了」、「兩個東廠,笑死」、「剛好87趴,不容易」!",https://www.chinatimes.com/realtimenews/20220522001402-260407,中時,政治,丁世傑
,Netflix粉專酸「買不到快篩試劑」 綠委:執政黨予以尊重,"影音串流平台Netflix台灣版臉書粉絲專頁21日晚間在臉書貼出取材韓劇《還有明天》片段,諷刺台灣「買不到快篩試劑」,標註「快篩試劑早上7點開始排隊的人」、「永遠買不到快篩的我」等情況。民進黨立委許智傑今(22)日表示,民間粉專發揮創意宣傳,或者給政府批評指教,執政黨都予以尊重。 影音串流平台Netflix台灣版臉書粉絲專頁以韓劇《還有明天》中的片段,諷刺台灣「買不到快篩試劑」,標註「快篩試劑早上7點開始排隊的人」、「永遠買不到快篩的我」等情況。文中還強調,「風吹日篩還是買不到(哭臉)#還有明天」。Netflix臉書昨晚間已刪除該篇貼文。 許智傑表示,民間粉專發揮創意宣傳,或者給政府批評指教,執政黨都予以尊重。然而希望他們必須查證和澄清,現在快篩劑已經沒有排隊潮了,避免宣傳梗圖誤導民眾,造成民眾恐慌。",https://www.chinatimes.com/realtimenews/20220522001340-260407,中時,政治,葉書宏
