timestamp,title,article,url,company,category,reporter
1653851880.0,傳愛二飛彈操演未射擊 空軍澄清,"國軍日前實施多型飛彈實彈射擊訓練,但媒體報導,愛國者二型飛彈因故一彈未發。空軍今天指出,當天因靶機及雷雨天候等影響未實施射擊,但之後在預備日27日完成射擊訓練,情況均正常。 國軍日前表示,為強化海空軍訓練,首次驗證海巡署平戰轉換納入國軍防衛作戰序列機制,國軍已於九鵬基地及東部海域,實施年度飛彈射擊訓練,驗證海、空軍及海巡艦艇實彈射擊與接戰能力,命中率近98%,成功驗證海、空軍及海巡艦艇聯合打擊能力。 國軍表示,射擊彈種包括雲母飛彈、標準一型飛彈、雄風二型飛彈、雄風三型飛彈、天弓一型飛彈、天弓三型飛彈、愛國者二型飛彈。 聯合報報導,天弓三型飛彈首日射擊並未命中目標,國防部特別「補鑑測」,讓弓三補打一枚,最後「感應命中」;空軍愛國者飛彈部隊因靶機系統與雷達效能問題,傳一彈未發。 空軍司令部上午回應指出,此次實彈射擊訓練,弓三已配合射擊時序在實彈射擊首日便完成射擊訓練,並命中目標;有關愛二射擊訓練,因靶機施放靶標時纜繩斷裂,以及受雷雨天候等因素影響,當日未實施射擊,但已在預備日27日完成射擊並命中目標,相關情況均正常。",https://www.cna.com.tw/news/aipl/202205300056.aspx,中央社,政治,游凱翔台北
1653848580.0,國務機要費除罪化 立院混亂中三讀,"立法院會今天處理攸關國務機要費除罪化的會計法第99條之1條文修正草案,在國民黨、民進黨立委爆發數波衝突下,表決通過民進黨立法院黨團修正動議,三讀修正通過,將國務機要費除罪化。 國務機要費案纏訟逾15年,前總統陳水扁日前曾召開記者會,公布國務機要費金流,並強調自己「因公支出大於因公收入,沒有不法所得」。對此,外界也掀起國務機要費是否除罪化的討論。 立法院財政委員會曾在去年排審攸關國務機要費除罪化的「會計法第99條之1條文修正草案」,但當時因國民黨立委質疑這是替陳水扁涉及貪污案脫罪,而杯葛議事,最後決定擇期再審。 現行會計法第99條之一條文規定,中華民國95年12月31日以前各機關支用的特別費,其報支、經辦、核銷、支用及其他相關人員的財務責任均視為解除,不追究其行政及民事責任;如涉刑事責任者,不罰。 民進黨立委蔡易餘等人所提修法版本,認為國務機要費的由來,可追溯至民國40、50年代,當時分為「機要費」與「特別費」2筆,60年代則合併稱為「機要費」,顯見「機要費」與「特別費」的性質相同。 立法院財政委員會4月21日續審攸關國務機要費除罪化的會計法第99條之1條文修正草案;國民黨團雖提案散會,但表決未過,朝野激烈拉扯下,最後表決通過民進黨立委郭國文等人提案,全案保留出委員會,交黨團協商。 朝野黨團協商後無法取得共識,全案今天在立法院會表決處理。今天上午7時30分左右,國民黨立委成功突襲占據主席台,過程中國民黨立委洪孟楷頭部撞到牆壁、民進黨立委洪申翰手部受傷。 上午8時46分左右,民進黨立委進場,排除原本占據在主席台的國民黨立委後,民進黨立委郭國文、賴瑞隆、王美惠等人成功奪回主席台。 國民黨立法院黨團總召曾銘宗在議場內發言指出,台灣疫情嚴峻,但民進黨居然要強行通過國務機要費除罪化,要將阿扁的貪污案除罪」。曾銘宗等人也拿著名單一一點名,指民進黨立委指挺貪污。 上午9時12分,國民黨立委賴士葆、萬美玲、鄭正鈐等人試圖要奪回主席台,與民進黨立委鄭運鵬、林俊憲等人爆發激烈拉扯,但未成功;國民黨立委約在9時29分,向主席台拋撒大量玩具假鈔,並說陳水扁貪污的是真鈔等語。 原本今天的議程表定是上午9時開始,但在國民黨、民進黨立委對峙下,會議直到上午10時都還沒開始;民進黨立委不甘示弱,拿出要審議國營事業預算、幼教處分狼師條款、微型電動車強制納保的手舉牌。 會議主席、立法院副院長蔡其昌直到上午10時4分進場,宣布開會,處理朝野黨團有簽署協商結論的國營事業預算案。 不過,曾銘宗說,國民黨團撤簽協商結論;蔡其昌說,沒有協商結論,那就無法處理,因此進入下一案,會計法第99條之1條文修正草案。 國民黨立委不滿,朝主席台丟杯水,但民進黨立委早有準備,拿出手版擋住,並高喊不要再丟了。 院會處理時,民進黨團提議停止廣泛討論,經表決後通過;再表決民進黨團所提修正動議,表決結果,出席89人,贊成57人、反對32人,通過民進黨立法院黨團修正動議。 三讀修正通過條文,是在會計法第99條之一條文中,增訂「國務機要計畫費用」的文字。",https://www.cna.com.tw/news/aipl/202205305004.aspx,中央社,政治,王揚宇台北
1653848580.0,楊基榮接任國防部總督察長 6/1生效,"軍方今天表示,國軍中將人事將有異動,由於國防部總督察長劉得金中將屆齡退伍,遺缺將由陸軍後勤指揮部指揮官楊基榮中將升任,人事命令將於6月1日生效。 楊基榮曾任陸軍第六軍團指揮部副指揮官與指揮官等要職,由於楊基榮是擔任六軍團副指揮官時升任中將,再直升指揮官,是陸軍體系中較少見的調動,顯見能力備受肯定;此外,國防部日前提到,楊基榮過去也曾擔任二一砲指部指揮官、蘭指部指揮官等重要主官,熟悉軍團各項戰演訓及災害防救任務。 劉得金曾任陸軍官校校長、國防部電展室主任、陸軍八軍團指揮官、陸軍副司令等職,他也在公務之餘以「金戈」為筆名撰寫小說與散文,更撰寫軍事戰略與評論等文章。",https://www.cna.com.tw/news/aipl/202205300036.aspx,中央社,政治,游凱翔台北
1653847860.0,柬埔寨台協張南蘋任會長 續強化與當地社團關係,"柬埔寨台商協會29日舉行第13、14屆會長交接典禮,新任會長張南蘋表示,盼上任後能繼續加強柬埔寨台協與柬國華人、社團之間的關係,並培育年輕一代台商,善盡經驗傳承和共創商機。 柬埔寨台商協會29日晚間在首都金邊市舉行第13、14屆會長交接典禮,並慶祝柬埔寨台協26週年。在駐胡志明市辦事處處長鍾文正、亞洲台灣商會聯合總會輔導總會長劉樹添見證下,張南蘋從第13屆會長王美蕙的手中接下印信。 張南蘋致詞時表示,COVID-19(2019冠狀病毒疾病)疫情肆虐全球,柬埔寨政府的疫苗政策對國內外人民一視同仁,讓柬國的生活恢復正常。她並期許自己上任後能繼續加強柬埔寨台協與柬國華人、社團之間的關係。 傳承也是張南蘋之後的工作重點之一,在柬埔寨經商21年的她觀察,柬埔寨有很多年輕優秀的台商,希望提供舞台讓他們表現與學習,一起找到台商在柬國發展的核心價值、共創商機。 鍾文正致詞時表示,柬埔寨台協是柬國台灣社群與辦事處之間的重要橋梁,過去兩年半疫情期間往來不便,常要麻煩柬埔寨台協幫助當地台灣人,包括處理台人染疫事宜等,柬埔寨台協也都使盡全力。 鍾文正指出,柬埔寨的經濟在去年下半年就恢復成長,今年預期會像其他東南亞國家協會(ASEAN)國家一樣強彈,張南蘋在此時接下重任,相信能幫助台商利用這一波經濟力道,在企業經營上再創高峰。 王美蕙回顧任內事項特別提到,柬埔寨台商協會2020年由原本的台灣商會更名成功,獲柬埔寨內政部核准立案。在公益方面,柬埔寨台協捐款給柬國環保部、勞工部,並為2020年的水災募款,把善款送到總理府辦公室供統籌分配使用。 她說,柬埔寨台協還探訪愛滋孤兒院、捐贈醫療與防疫用品、贊助偏鄉學童物資,探訪柬埔寨國家嬰兒及兒童中心等,提升台商在當地的正面形象,並積極參與主流華人社團活動,促進與柬國主流社會的關係。 根據王美蕙所述,柬埔寨共有1萬多名台灣人,柬埔寨台協目前共有400多名會員,台商在柬埔寨主要從事成衣、製鞋相關產業,工廠主要設立在距離金邊1、2小時車程的地點,也有部分設立在較遠的外省。",https://www.cna.com.tw/news/aipl/202205300030.aspx,中央社,政治,金邊
1653842040.0,立院擬處理國務機要費除罪 國民黨團突襲占主席台,"立法院會今天將處理攸關國務機要費除罪化的會計法第99條之一條文修正草案,國民黨立委一早7時30分進場占據主席台,衝突中民進黨立委洪申翰傳出手指流血掛彩。 民進黨立委8時46分左右進場,在人數優勢下,8時49分奪回主席台。藍綠立委在主席台上下持續對峙、叫罵。 國民黨立法院黨團總召曾銘宗告訴中央社記者,早上的確有推擠,但現場沒有看到流血,國民黨立委洪孟楷推擠中頭也撞到牆壁,目前正冰敷中。 曾銘宗說,現在疫情這麼嚴重,昨天死亡數創新高,確診數也都在高點,民進黨要趁疫情幫前總統陳水扁的國務機要費除罪化,這很可惡。 他說,國務機要費跟首長特支費性質完全不一樣,一年高達新台幣數千萬元,與首長特支費一年僅幾萬元差很多,於理、於情、於法現在都不應除罪化。 曾銘宗說,希望民進黨團抽掉攸關國務機要費除罪化的會計法修正草案,否則不排除占領主席台2天,直到這個會期(5月31日)結束。 對此,洪申翰接受中央社記者訪問指出,今天院會要處理國營事業預算和其他民生法案,他比較早到議場,看到國民黨立委突然要占主席台,自己不讓他們占,因此發生拉扯,被拉下主席台,過程中左手割傷,但無大礙。 民進黨立法院黨團幹事長鄭運鵬說,發生衝突的時間,大約是上午7時30分,當時民進黨只有洪申翰坐在主席台,就突然被國民黨立委拉下來,後續要怎麼處理,會再與民進黨團總召柯建銘討論。",https://www.cna.com.tw/news/aipl/202205305002.aspx,中央社,政治,王揚宇、蘇龍麒台北
