title,article,url,company,category,reporter,space_index,datetime,year,month,day,hour,minute
快訊/郭彥均稱「很多孩子都走了」 蘇貞昌:加以究責查辦,"藝人郭彥均25日在臉書分享和醫護朋友的對話,對方稱醫院情況很慘「看到這(麼)多孩子,就這樣走」,內容引發爭議,郭彥均在昨(27)日道歉並刪文。對此,行政院長蘇貞昌今受訪時也強調,「我們會加以究責查辦,同時希望國人同胞不要相信假訊息,也不要亂傳未經查證的訊息。」疫情升溫讓醫護人員都相當緊繃,郭彥均25日在臉書分享自己和醫護朋友的對話,其中一句「看到這(麼)多孩子就這樣走(了)」遭民進黨前議員王浩宇質疑表示要提報給衛服部查出是哪家醫院,27日深夜郭彥均發長文道歉,剛他也受訪透露跟老婆昨一整晚都沒睡好,現在只希望一切趕快落幕。但他的發文也引發網友攻擊。蘇貞昌表示,這種不實的謠言內容相近類似,都由相近的團體有很明顯的操作痕跡,非常不宜,同時對於辛苦的防疫工作非常的不尊重,並且引起社會的恐慌,大可不必,「我們會加以究責查辦,同時希望國人同胞不要相信假訊息,也不要亂傳未經查證的訊息。」",https://www.setn.com/News.aspx?NewsID=1122715&utm_source=setn.com&utm_medium=viewall&utm_campaign=viewallnews,三立,,黎冠志,"[130, 276]",2022-05-28 09:13,2022,5,28,9,13
他抓徐巧芯3句話施壓 焦糖:請柯文哲取消員警申誡,"國民黨台北市議員徐巧芯違停案風波持續延燒,昨(27)日晚間甚至公布2分鐘的密錄器內容,也引發兩方人士持續爭論是否有施壓行為。焦糖哥哥陳嘉行昨晚則在臉書發文表示,請台北市長柯文哲取消員警2支申誡。根據密錄器內容,外界認為有爭議的言論包括,「我是徐巧芯」、「我再回去講」、「沒關係你要開就開」、「我沒差900塊請你開單」等。律師黃帝穎就說,這一連串說明,從表明身分,到撂話,再嗆不怕罰款強化壓力等,態度尚可,但這種施壓當然有效。焦糖哥哥也說,「徐議座當然不會在乎900元罰單,而是我是徐巧芯,你怎麼有種開單!」焦糖哥哥甚至連發第二篇文,並以括弧的方式解釋徐巧芯說話的涵義,包括「拿下口罩:『我是徐巧芯』(e04徐巧芯了不起喔?);沒關係~我們回去再講(e04議員好大,小警員好怕!!);我沒差900塊(e04那妳幹嘛威脅警察回去再講!?)」最後,焦糖哥哥表示,是不是該請柯文哲取消員警的2次申誡?",https://www.setn.com/News.aspx?NewsID=1122711&utm_source=setn.com&utm_medium=viewall&utm_campaign=viewallnews,三立,,綜合,"[97, 160, 212, 253, 368]",2022-05-28 09:05,2022,5,28,9,5
粗暴推張善政選桃園?吳子嘉曝朱立倫算盤:為了超越蔡英文,"國民黨日前火速徵召前行政院長張善政參選桃園市長,黨主席朱立倫因為與地方妥善溝通,造成基層炸鍋,事後才道歉、開記者會說明。對此,美麗島電子報董事長吳子嘉認為,朱立倫現在敲定台北及桃園市長人選,就是因為6月初的訪美行程,必須給美國人交代,「他要超過蔡英文,他要去聽美國人的話,他要去抱美國人的大腿」。吳子嘉在《關鍵時刻》中表示,國民黨桃園市長人選絕對不可能改變提名,台北市議員羅智強現在只是「走快樂的」,這裡面有一個大背景大家都沒搞清楚,關鍵就是朱立倫6月初要到美國。吳子嘉提到,朱立倫到美國以後,遇到的政治人物都會詢問今年選情如何,朱立倫就會回答九合一會贏,所以已把兩個地方都布局好,其一為台北市先提名會贏的立委蔣萬安,桃園則是丟出沒得嫌的張善政,兩者贏面都很大。吳子嘉指出,朱立倫現在先把這2個縣市候選人敲定,是對老美交代,對老美交代完了以後,才進一步表明自己要選2024的心,前招後招套好了,目的就是討好美國人。吳子嘉認為,「他要超過蔡英文,他要去聽美國人的話,他要去抱美國人的大腿」。朱立倫要告訴美國人年底九合一國民黨會贏,所以美國人要挺自己選2024,「要是沒有美國和北京支持,他的民調要怎麼辦?」",https://www.setn.com/News.aspx?NewsID=1122709&utm_source=setn.com&utm_medium=viewall&utm_campaign=viewallnews,三立,,鄭佩玟,"[148, 232, 331]",2022-05-28 09:00,2022,5,28,9,0
違停密錄器曝!周玉蔻緊咬徐巧芯施壓 喊話柯文哲、黃珊珊,"國民黨台北市議員徐巧芯紅線違停風波持續延燒,27日晚間徐巧芯正式申請公布當天違規停車的密錄器影片,不久後台北警察局公開2分鐘密錄器畫面,揭露徐巧芯與徐姓員警的對話,立刻引發外界熱議,其中資深媒體人周玉蔻槓上徐巧芯,連續發出多篇文章,還喊話台北市市長柯文哲、副市長黃珊珊。周玉蔻最新一則貼文分析,徐巧芯與警員溝通的「話中話」,從「我是徐巧芯喔,這我的車」可以看出,「徐巧芯拉下口罩表明身分施壓」,後來的「沒關係,那我們再回去講啊」,代表「施壓不成威脅『再回去講』,揚言消單」,這時警員態度軟化,說出「不用回去講,就請離開就好,謝謝」,讓周玉蔻直呼「可憐的警員被徐巧芯公布個資、遭肉搜,還被長官懲處申誡、劣行」。周玉蔻喊話,「撤銷對員警的處罰!柯市長、黃副市長不要跟著市議員欺負基層警員、打擊基層員警士氣」,甚至用「徐巧芯滾出政壇」當作關鍵字,但徐巧芯也不甘示弱,回嗆「跟周玉蔻對賭」,表示「周玉蔻看完密錄器內容不服氣,說市警局跟我選擇性公布密錄器片段,要求公佈『全部內容』。在這裡直接跟你嗆賭,警察局與我所公布的密錄器如果有任何遺漏,我退出政壇;如果沒有,你退出媒體圈」。徐巧芯再次強調,「根據密錄器內容,我從未要求警員不開單,當下與事後也沒有透過任何管道威脅銷單,請修正你的內容,不然我會提吿」,嗆聲周玉蔻「醜人多作怪我以為你在罵自己」。警員與徐巧芯及助理完整對話徐助理:要開走了。警員:你是駕駛嗎?徐助理:要開走了。不好意思、不好意思。警員:證件有沒有帶?徐助理:有有。警員:我會開單喔,這邊紅線。徐助理:我要開走了耶。警員:這邊巷子很窄。徐助理:我現在開走了還要開嗎?警員:對。徐巧芯:我是徐巧芯喔,這我的車,你們這不是都是有人的話都用勸導嗎?之前我問過警察局,都是這樣跟我講的,啊什麼時候變成是直接開啊!你要開你就開啊!我意思是說,我之前問過很多次,都是說如果車上有人的話是直接勸導,然後你在開之前的話是...警員:但剛才車上沒有人。徐巧芯:不是,他有馬上下來了嘛,對不對?沒關係,那我們再回去講啊!警員:不用回去講啊,就請離開就好,謝謝!徐巧芯:我是不瞭解說...2分鐘密錄器對話曝!周玉蔻連發兩文怒嗆:全部內容呢,騙誰啊?徐助理:沒關係啦沒關係啦給他開給他開啦給他開給他開。警員:不用,車開走,謝謝。徐巧芯:我不缺900塊。徐助理:你可以開你可以開你可以開真的。警員:不要啦,請開車。徐助理:請你開啦!你開掉,這樣我們也不好做啦!警員:不用不用不用不用。徐助理:開掉啦!警員:不用不用,開了我更不好做。徐助理:我們看到就趕快出來開了啦!警員:好,掰掰。",https://www.setn.com/News.aspx?NewsID=1122704&utm_source=setn.com&utm_medium=viewall&utm_campaign=viewallnews,三立,,綜合,"[135, 304, 485, 569, 582]",2022-05-28 08:38,2022,5,28,8,38
密錄器之戰!周玉蔻嗆騙誰啊 徐巧芯反擊對賭「退政壇」,"國民黨台北市議員徐巧芯紅線違停風波延燒多日,27日晚間徐巧芯正式申請公布當天違規停車的密錄器影片,不久後台北警察局公開2分鐘密錄器畫面,揭露徐巧芯與徐姓員警的對話。對此,資深媒體人周玉蔻連續提出質疑,怒嗆「二分鐘?騙誰啊?二分鐘就已經那麼不堪了,全部內容呢?」徐巧芯也隨即反擊對賭,直言若公開的密錄器內容有任何遺漏「我退出政壇;如果沒有,你退出媒體圈。」資深媒體人周玉蔻在臉書發文,質疑密錄器內容僅2分鐘「騙誰啊?二分鐘就已經那麼不堪了,全部內容呢?」周玉蔻呼籲台北市警察局應該下令信義分局公布密錄器完整內容,並表示要求「撤銷對員警的懲處」,最後她還怒轟徐巧芯滾出政壇。該篇貼文發出沒多久,周玉蔻又再度發一則貼文痛批徐巧芯,「轉移焦點、選擇性公布密錄器二分鐘不到的片斷(段),解決不了妳施壓警員不要開單,又威脅事後再消單的醜陋事實!」對於周玉蔻連番指控,徐巧芯立即在臉書發文反擊「在這裡直接跟你嗆賭,警察局與我所公布的密錄器如果有任何遺漏,我退出政壇;如果沒有,你退出媒體圈」、「敢?請回應。」徐巧芯強調,根據秘錄器內容她從未要求警員不開單,當下與事後也沒有透過任何管道威脅銷單,要周玉蔻「修正你的內容,不然我會提吿」,文末更標註「醜人多作怪我以為你在罵自己」。",https://www.setn.com/News.aspx?NewsID=1122703&utm_source=setn.com&utm_medium=viewall&utm_campaign=viewallnews,三立,,林昀萱,"[177, 367]",2022-05-28 08:35,2022,5,28,8,35
"7成高階晶片來自台灣!美國高官:太可怕,這不安全","美國總統拜登本月展開亞洲行,日前也飛抵韓國,並且造訪三星電子的半導體工廠,美國商務部長雷蒙多(GinaRaimondo)等50多人也同行。不過在25日,雷蒙多呼籲美國國會儘快通過「CHIPSforAmerica」法案,更指出美國有將近70%的精密晶片都來自台灣,且這些晶片還運用在標槍系統,認為這並不安全。根據《CNBC》報導,所謂的「CHIPSforAmerica」就是要激勵美國半導體的製造、研發、投資,在2026年前有關晶片的投資、建設或製造都能抵免稅務。報導中提到,全球的晶片短缺已經對一系列的產業造成了損害,尤其是汽車產業。雷蒙多表示,晶片短缺已經是嚴重的國安危機,並強調「美國必須自主生產晶片,而非靠盟友支持」。雷蒙多並提到,若法案無法迅速通過,那麼美國在這一方面將迎來失敗,尤其在英特爾、美光、三星將建造未來的生產設施,若國會無法迅速採取行動,這些企業就不會在美國設廠,若是在歐洲或是亞洲的話,美國就可能因此失敗。雷蒙多說,美國有70%的高精密晶片都是跟台灣購買的,這些晶片用在軍事設施上,還有用在標槍飛彈系統中,「你想從台灣購買所有這些晶片嗎?這不安全」。考慮到潛在的兩岸衝突對全球半導體產業的影響,雷蒙多表示前景「並不漂亮」,且「非常可怕且站不住腳」。報導中指出,台灣的晶片製造商台積電佔蘋果、亞馬遜和谷歌等美國科技巨頭晶片產量的近90%。",https://www.setn.com/News.aspx?NewsID=1122657&utm_source=setn.com&utm_medium=viewall&utm_campaign=viewallnews,三立,,林奇樺,"[51, 95, 98, 106, 153, 173, 176, 231, 312, 414, 535]",2022-05-28 08:17,2022,5,28,8,17
徐巧芯與員警密錄器對話曝!周玉蔻連發兩文嗆:二分鐘騙誰,"國民黨台北市議員徐巧芯紅線違停風波延燒多日,27日晚間徐巧芯正式申請公布當天違規停車的密錄器影片,不久後台北警察局公開2分鐘密錄器畫面,揭露徐巧芯與徐姓員警的對話。對此,資深媒體人周玉蔻連續提出質疑,並呼籲把全部內容公布,今(28)日又再度發文反擊。資深媒體人周玉蔻在臉書發文,質疑徐巧芯公布的密錄器僅2分鐘,周玉蔻怒嗆「二分鐘?騙誰啊?二分鐘就已經那麼不堪了,全部內容呢?」此外,周玉蔻認為,台北市警察局應該下令信義分局公布密錄器完整內容,並表示要求「撤銷對員警的懲處」,最後她還怒轟徐巧芯滾出政壇。該篇貼文發出沒多久,周玉蔻又再度發一則貼文痛批徐巧芯,「轉移焦點、選擇性公布密錄器二分鐘不到的片斷(段),解決不了妳施壓警員不要開單,又威脅事後再消單的醜陋事實!」最後,周玉蔻表示,全台灣百分之一百的民意都支持公布密錄器全部內容,若是光明正大,心內無鬼,就請台北市警察局公布密錄器完整影像。【警員與徐巧芯及助理完整對話】徐助理:要開走了。警員:你是駕駛嗎?徐助理:要開走了。不好意思、不好意思。警員:證件有沒有帶?徐助理:有有。警員:我會開單喔,這邊紅線。徐助理:我要開走了耶。警員:這邊巷子很窄。徐助理:我現在開走了還要開嗎?警員:對。徐巧芯:我是徐巧芯喔,這我的車,你們這不是都是有人的話都用勸導嗎?之前我問過警察局,都是這樣跟我講的,啊什麼時候變成是直接開啊!你要開你就開啊!我意思是說,我之前問過很多次,都是說如果車上有人的話是直接勸導,然後你在開之前的話是...警員:但剛才車上沒有人。徐巧芯:不是,他有馬上下來了嘛,對不對?沒關係,那我們再回去講啊!警員:不用回去講啊,就請離開就好,謝謝!徐巧芯:我是不瞭解說...2分鐘密錄器對話曝!周玉蔻連發兩文怒嗆:全部內容呢,騙誰啊?徐助理:沒關係啦沒關係啦給他開給他開啦給他開給他開。警員:不用,車開走,謝謝。徐巧芯:我不缺900塊。徐助理:你可以開你可以開你可以開真的。警員:不要啦,請開車。徐助理:請你開啦!你開掉,這樣我們也不好做啦!警員:不用不用不用不用。徐助理:開掉啦!警員:不用不用,開了我更不好做。徐助理:我們看到就趕快出來開了啦!警員:好,掰掰。",https://www.setn.com/News.aspx?NewsID=1122698&utm_source=setn.com&utm_medium=viewall&utm_campaign=viewallnews,三立,,許元馨,"[125, 188, 251, 333, 396, 411]",2022-05-28 08:11,2022,5,28,8,11
"徐巧芯1句話警秒不開單!黃捷怒:這不是施壓,什麼是施壓","國民黨台北市議員徐巧芯違停案延燒,台北市信義分局遲遲未公布密錄器,27日晚間2分鐘密錄器畫面終於曝光,徐巧芯與員警的對話全揭露,可以看到徐巧芯說「我們再回去講」之後,員警就沒有開單讓她離開,高雄市議員黃捷就直言「這不是施壓,什麼才叫施壓?」從影片中可以看到,徐巧芯將愛車違停在信義區光復南路415巷紅線路段,徐姓警員見有汽車違規便上前查詢車牌,查出車主是徐巧芯,可以看到隨後走出餐廳的徐巧芯向員警表示「我是徐巧芯喔,這我的車,你們這不是都是有人的話都用勸導嗎?之前我問過警察局,都是這樣跟我講的,什麼時候變成是直接開啊。」見徐姓員警沒有回應,徐巧芯繼續說,「沒關係你要開就開,我意思是說,我之前問過很多次,都是說如果車上有人的話是直接勸導」,員警表示「但剛才車上沒有人」,接著徐巧芯表示「沒關係,那我們再回去講啊!」員警沉默一陣後表示,「不用回去講,請離開就好謝謝」、「請開走吧」,徐巧芯還向員警說「我不缺900塊」。黃捷直言「影片播的很清楚,徐巧芯違停還對員警講這種話,這不是施壓,什麼才叫施壓?員警依法執勤沒有錯,錯的是拿職權施壓的徐大議員」,黃捷怒批徐巧芯「佔用社會媒體資源、不斷說謊欺瞞,到今天密錄器影片公布,是非很清楚。不要再佯裝自己是進步青年,做第一屆議員就學會威脅關說,腐敗如此之快!不要再硬拗鬼扯,誠實面對很難嗎?」不過針對此事件,徐巧芯昨晚在臉書發文表示,她正式向警方申請公布5/19違規停車的密錄器影片,可以證明她全程語氣平和,並且要求警察開單是事實,並透露19日當天就詢問警察是否能夠公開密錄器「但警方回覆若公開此影片,將涉及到員警瀆職問題,那是重罪,公布以後恐怕該員警未來升遷無望,希望我給基層員警一個機會,我無意追殺員警,只求澄清事實,且這件事我也有責任,於是同意警局出面說明就好」。徐巧芯表示,連日以來的抹黑並未停歇「我不可能對這種惡質的媒體文化低頭,因此主動向警察局調閱我這個當事人相關影片,證明了5/19、5/20我接受媒體訪問時句句屬實,反而這幾天窮追猛打的各式言論,根本是腦補出來的一場鬧劇」。",https://www.setn.com/News.aspx?NewsID=1122692&utm_source=setn.com&utm_medium=viewall&utm_campaign=viewallnews,三立,,黃韻璇,"[120, 261, 409, 422, 566, 755]",2022-05-28 07:45,2022,5,28,7,45
柯文哲兒子染疫送急診挨批 王世堅激動嗆:你是父母生的嗎,"台北市長柯文哲22日確診後,兒子、女兒也快篩陽性,兒子還一度情況危急、失去意識無法正常行走,緊急撥打119送醫情況才趨於穩定,卻遭網友質疑「只是發燒,為何送急診?」對此,自稱「頭號柯黑」的台北市議員王世堅卻跳出來為柯文哲說話,激動表示「你是父母生的嗎?竟然講這麼沒有人性的話。」台北市議員王世堅,每每質詢台北市長柯文哲都相當有「笑果」,因用詞犀利、火爆,除了日前送出「我就爛」T-shirt,要柯文哲在任期內「不該爛、不能爛、不准爛」,還有先前把龍袍、龍帽、木馬搬入議場,讓人不注意都難。昨(27)日柯文哲兒子爆出染疫後一度失去意識向後倒,讓妻子陳佩琪打電話給柯文哲求助時,緊張到講話講不清楚,緊急將兒子送醫狀況才趨於穩定,卻遭網友質疑僅是發燒為何要送急診?王世堅在《庶民大頭家》節目中表示「政治不外乎人性」,他如此強力監督柯文哲,但當對方兒子染疫時,當然是要給予祝福。沒想到竟然有人在網路藉由此事質疑、修理柯文哲,懷疑市長小孩有特權等等,讓王世堅激動向發表上述言論的網軍嗆聲:「你相信你自己嗎?你是父母生的嗎?竟然會講這麼沒有人性的話。」王世堅強調,即使是政治敵對者也應該要互相尊重,建議「相信你自己的良知判斷」並說自己相信的話,「連自己都不相信的話不要說。」",https://www.setn.com/News.aspx?NewsID=1122695&utm_source=setn.com&utm_medium=viewall&utm_campaign=viewallnews,三立,,林昀萱,"[139, 329]",2022-05-28 07:38,2022,5,28,7,38
「很多孩子走了」有內幕?10秒內19粉專散布相同內容,"藝人郭彥均25日在臉書分享和醫護朋友的對話,對方稱醫院情況很慘「看到這(麼)多孩子,就這樣走」,內容引發爭議,郭彥均在昨(27)日道歉並刪文。但台灣資訊環境研究中心(IROG)昨日晚間指出,25日到26日至少有25個粉專發布以「很多孩子走了」為首的字句,其中有19個粉專貼文發布時間差竟在10秒內。疫情升溫讓醫護人員都相當緊繃,郭彥均25日在臉書分享自己和醫護朋友的對話,其中一句「看到這(麼)多孩子就這樣走(了)」遭民進黨前議員王浩宇質疑表示要提報給衛服部查出是哪家醫院,27日深夜郭彥均發長文道歉,剛他也受訪透露跟老婆昨一整晚都沒睡好,現在只希望一切趕快落幕。台灣資訊環境研究中心發現,包括「愛經驗」、「BuzzHand」、「人生向前走」、「人生按個讚」、「男人本色」、「就是愛正妹」等粉絲專頁都發布以「很多孩子走了」相同內容,且其中有19個發文時間都介於26日下午3時31分34秒到43秒之間,且內文都導向同一個農場網站。台灣資訊環境研究中心也說「群聚發布相同內容貼文,並分享內容農場連結的這些Facebook粉專,真的有人在看。」截至昨晚6時許至少獲得7363次互動、321次分享還有1235個留言。民進黨桃園市前議員王浩宇也轉發台灣資訊環境研究中心文章質疑「集體發文」不單純。",https://www.setn.com/News.aspx?NewsID=1122685&utm_source=setn.com&utm_medium=viewall&utm_campaign=viewallnews,三立,,林昀萱,"[149, 282, 414, 450, 458]",2022-05-28 06:21,2022,5,28,6,21
密錄器完整對話曝!徐巧芯說這句話後 警秒不開單讓她離開,"國民黨台北市議員徐巧芯19日爆出紅線違停爭議,27日她正式申請公布當天違規停車的密錄器影片,不久後台北警察局公開2分鐘密錄器畫面,完整對話曝光,清楚可見徐巧芯在說了「沒關係,那我們再回去講啊」,員警立刻說「不用回去講啊,就請離開就好,謝謝!」徐巧芯紅線違停風波延燒,北市信義分局遲遲未公布密錄器,遭到外界質疑受到施壓;徐巧芯27日晚間在臉書正面迎戰,向警方申請公布19日違規停車密錄影片,並透露不公開影片,是警方表示涉及到員警瀆職問題「希望我給基層員警一個機會」。完整對話紀錄曝光,可以見到原先表明要開單的員警,在徐巧芯講了「那我們再回去講啊」,隨即表示「不用回去講啊,就請離開就好,謝謝!」【警員與徐巧芯及助理完整對話】徐助理:要開走了。警員:你是駕駛嗎?徐助理:要開走了。不好意思、不好意思。警員:證件有沒有帶?徐助理:有有。警員:我會開單喔,這邊紅線。徐助理:我要開走了耶。警員:這邊巷子很窄。徐助理:我現在開走了還要開嗎?警員:對。徐巧芯:我是徐巧芯喔,這我的車,你們這不是都是有人的話都用勸導嗎?之前我問過警察局,都是這樣跟我講的,啊什麼時候變成是直接開啊!你要開你就開啊!我意思是說,我之前問過很多次,都是說如果車上有人的話是直接勸導,然後你在開之前的話是...警員:但剛才車上沒有人。徐巧芯:不是,他有馬上下來了嘛,對不對?沒關係,那我們再回去講啊!警員:不用回去講啊,就請離開就好,謝謝!徐巧芯:我是不瞭解說...徐助理:沒關係啦沒關係啦給他開給他開啦給他開給他開。警員:不用,車開走,謝謝。徐巧芯:我不缺900塊。徐助理:你可以開你可以開你可以開,真的。警員:不要啦,請開車。徐助理:請你開啦!你開掉,這樣我們也不好做啦!警員:不用不用不用不用。徐助理:開掉啦!警員:不用不用,開了我更不好做。徐助理:我們看到就趕快出來開了啦!警員:好,掰掰。民進黨桃園市前議員王浩宇挑出徐巧芯在影片中說的5句話,認為明顯就是向警員施壓,當時徐巧芯從餐廳步出,直接拉下口罩表明「我是徐巧芯喔」,更稱「紅線不是先勸導嗎?警察局是這樣跟我說的」、「沒關係你要開就開」、「我再回去講」、「沒差900塊請你開單」等語,男助理則在旁說「你開單吧,不然我們不好做人」。黃帝穎律師也說清楚可見議員施壓「三步曲」。影片中徐巧芯態度尚可,但勘驗後仍需實質認定,內容其實就是議員施壓警員。黃帝穎律師說,第一步表明身分;直接拉下口罩表明,徐:「我是徐巧芯喔」。第二步撂話再回去講;徐:「沒關係你要開就開,我再回去講」。第三步嗆不怕罰款強化壓力;徐:「我們不是缺900塊,你可以開」。黃帝穎律師分析,這種態度尚可的施壓有沒有效,當然有!因為警察最後無奈的說「開了我更不好做啦,車開走謝謝」。",https://www.setn.com/News.aspx?NewsID=1122681&utm_source=setn.com&utm_medium=viewall&utm_campaign=viewallnews,三立,,林昀萱,"[121, 296, 311, 329, 348, 365, 390, 400, 420, 537, 549, 582, 602, 615, 641, 654, 666, 686, 697, 720, 740, 756, 773, 781, 929]",2022-05-28 05:47,2022,5,28,5,47
蔡易餘看球賽被拍「女球迷車頭燈好亮」眾人喊:沒看到委員,"職籃T1季後賽開打中,民進黨立委蔡易餘昨晚進場觀賽,並在臉書發文表示「在角落默默替台灣啤酒英雄加油,沒想到還是被電視台錄到!」還附上轉播畫面截圖,然而畫面中的一位女球迷卻成為焦點,讓眾人狂喊「我只看到大燈,沒看到委員」。畫面中,蔡易餘和台北市議員吳沛憶一起看球賽,然而蔡易餘左前方的女球迷長髮及肩,穿著深V開到肚臍的超低胸上衣,雖然有罩一件外套,但藏不住胸器;據悉,整場轉播賽事,導播多次聚焦在這位女球迷,似乎不是在拍立委蔡易餘。吳沛憶在貼文底下留言「我可以做證委員很認真在看球,但是下半場他就說要坐到對面去看了」,同黨的議員候選人林依婷也懷疑蔡易餘是在開車、但沒證據。其他網友也笑回「攝影師很專業啊,重點都有捉到」、「好像看到什麼不得了的」、「真的不是在拍你」、「目標物太大惹」、「我看了1小時才發現蔡委員在哪」。",https://www.setn.com/News.aspx?NewsID=1122674&utm_source=setn.com&utm_medium=viewall&utm_campaign=viewallnews,三立,,賴俊佑,"[110, 215, 285]",2022-05-28 00:48,2022,5,28,0,48
