timestamp,title,article,url,company,category,reporter
,兒童接種站挨轟白痴命令 議員苗博雅反酸柯P,"中正紀念堂設兒童BNT疫苗大型接種站,遭台北市長柯文哲怒斥是白癡命令,不過今日施打狀況踴躍,接種人數遠超過系統預約的200人。市議員苗博雅指出,代表市民真的有需求,許多家長也紛紛心急陳情,直言北市疫苗時程落後他縣市,她揶揄柯可能一心想靠近總統大位,「所以和市民距離稍微遠了一點。」 苗博雅上午在北市議會受訪,對於柯文哲不滿中央設置兒童接種站,但今日上路後人潮卻踴躍一事,她表示,就預約名額來看,代表市民真的有這需求,有人需要服務才會去預約,證明這真的是市民現在需要的東西。 苗博雅說,她接到很多家長陳情,因為北市安排疫苗施打的時程較晚,眼看其他縣市孩子都陸續在學校接種疫苗,但台北卻要排到5月底6六月初,當然會很心急,議員們提出這問題,也是希望早日讓兒童接種疫苗,提升保護力。 話鋒一轉,苗博雅揶揄,「我想柯市長可能一心想要靠近總統大位,所以跟市民的距離稍微遠了一點」,而作為民意代表的職責,就是努力把市長跟市民的距離再拉近。",https://www.chinatimes.com/realtimenews/20220601002238-260407,中時,政治,黃婉婷
,國門解封有望 申辦護照流程優化更便利,"台灣有望在下半年國門逐步解封,不少國人也感受到氛圍,近兩個月來申辦護照人數略有提升。外交部今天啟動「申辦護照網路填表及照片上傳系統」,呼籲護照到期的國人可以及早申辦,本月15日前使用系統申辦者還可以獲得精美禮品。 外交部領事事務局局長葉菲比表示,自從新冠肺炎疫情爆發以來,國人申辦護照的量在過去兩年多來掉到平均一個月兩萬多份,不過自三月份起,單月申辦量已經提升到三萬多份,可見得國人也感受到國門即將解封的氣氛。 外交部領事事務局今天正式啟用「申辦護照網路填表及照片上傳系統」,提供「網路填表」、「照片上傳」及「線上預約」三合一的便民功能。 這項系統全面開辦後,未來國人申辦護照可採用網路填表的服務,填表系統另包括「上傳數位照片」及「預約申辦時段」的功能供民眾使用。民眾透過e化的網路填表系統事先填寫資料及預約申辦時段,將可大幅縮減現場填寫書表及臨櫃等待的時間。另外該系統「上傳數位照片」功能可協助初步預檢上傳的數位照片是否符合護照照片規格,降低臨櫃申辦時的照片不合格率,如果成功上傳合格的數位照片並列印含彩色照片的「簡式護照資料表」,便可免附2張實體照片,進而省去沖洗照片的成本。 此外,旅行社受委任代辦護照團件部分也有完整規畫,系統提供整併表件、打包整理等功能,使旅行社送件流程更為順暢。「團件系統」已自4月6日起先行試辦,運作良好,6月1日起將與「個人件系統」同步全面開辦。",https://www.chinatimes.com/realtimenews/20220601002200-260407,中時,政治,楊孟立
,國外都讓我們去了陳時中卻擋住 趙少康轟:怕什麼,"我國邊境解封自今(1日)起針對入境旅客全面實施「唾液採檢」,即可離開機場、不用再等PCR結果。資深媒體人趙少康今上午在臉書喊話應開放組團出國,「台灣連密切接觸者都改成0+7,有什麼道理還要阻止國人組團出國?一點都不合邏輯」。 趙少康指出,之前國外疫情遠高於台灣,怕國人參加旅行團把國外疫情帶回台灣有其道理,現在國外疫情大多已走下坡,台灣疫情遠比國外嚴重,「應該是人家怕我們,而不是我們怕人家」,只要外國願意讓我們去,我們有什麼好害怕的? 趙少康進一步說,台灣連密切接觸者都改成0+7,有什麼道理還要阻止國人組團出國?一點都不合邏輯。如果像陳時中所說,怕病毒在外國有新變異被帶回台灣,那台灣是不是要永久關閉國門? 因此趙少康認為,政府應該立即取消禁令,開放國人組團出國,只要登機回國前取得有效的PCR陰性證明,抵台時在入境機場港口確實做好篩檢工作,就可以大幅減少帶入病毒的風險。一味墨守成規不知與時俱進,除了扼殺旅遊業者,對防止國內疫情,不會有任何幫助。對此有網友留言表示,「旅行社快倒光了,等到天荒地老,再不開放邊境,飯店業也倒了」、「執政的邏輯很重要,否則就是無能」、「支持」、「什麼都不購,什麼都缺,遇到變種會再來一次自主應變」。",https://www.chinatimes.com/realtimenews/20220601001913-260407,中時,政治,莊雅婷
,張善政桃園市長穩了?傳藍營內部民調超驚人 發展跌破眼鏡,"國民黨「突襲」式徵召行政院前院長張善政參選桃園市長,引發藍營紛爭。港媒指出,近期傳出一份藍營內部最新民調,張在藍綠白「三腳督」狀況下,對上民進黨目前傳出的所有可能人選皆大獲全勝,勝幅更高達3%以上;這個數字最開心的莫過於國民黨黨主席朱立倫,因這場選舉的結局,已成朱的「黨主席生死關鍵」,非僅只張的政治前途與桃園由誰執政。 香港媒體《中評社》30日評論指出,根據一份藍營內部民調,張善政若對上陳時中,支持率26.9%勝過陳的24.5%;若是對上近期傳出可能選桃園的新竹市市長林智堅,張支持率27.4%贏過林24.2%;而與民進黨立委鄭運鵬對決,張27.2%同樣大勝鄭的20.0%。該民調為5月25日到5月27日進行的電話民調,共有1074個成功樣本, 針對這個民調結果,評論直言:「讓國民黨高層吃下定心丸。」可見國民黨中央正積極向桃園證明,張善政是「對的人選」,有了這個基礎,張的出征與接下來的選戰腳步也才顯得「師出有名」,畢竟在近期紛擾下,張的首份民調面對綠營對手都能獲得全勝,接下來要爭取支持度向上的空間可謂更大了。 評論直言,這份民調對朱立倫最為重要,因為桃園市長這局已直接關係他的黨主席去留問題,檯面上雖看似讓張獨自面對桃園地方的整合難題,但據了解,朱私下動用各種關係,正全力幫張牽線、張羅;桃園這一役已成朱的「黨主席生死關鍵」,而這份民調正為其拉開序幕。",https://www.chinatimes.com/realtimenews/20220601001877-260407,中時,政治,王子瑄
,政院證實 鄧振中今晚與美國副貿易代表視訊對話,"為強化台美雙邊貿易和經濟關係,傳出行政院政務委員鄧振中近期將與美國貿易代表代表戴琪會面。不過,行政院發言人羅秉成表示,鄧振中今天要跟美國USTR副貿易代表莎拉•比安奇(Sarah Bianchi)視訊,就台美貿易關係對話,有進展會對外說明。 鄧振中與戴琪(Katherine Tai)日前在「APEC貿易部長會議」舉行期間展開雙邊會談,討論台美經貿等議題,雙方並約定數周後再進行會談,形式不限實體或視訊,雙方會面預計會在6月下旬。 不過,有消息指出,鄧振中今晚將與美方貿易代表視訊會議,羅秉成今早證實,鄧振中今天會跟美國副貿易代表會面,不是戴琪女士,戴琪女士有其他的要務,雙方會就台美相關貿易關係有一些對話,有具體進展也會盡快說明。",https://www.chinatimes.com/realtimenews/20220601001905-260407,中時,政治,林縉明
,民調直落 陳時中上節目被問選不選北市長笑了:這題請問別人,"藍綠白備戰年底首都之戰,代表國民黨出征的人選是立委蔣萬安,民進黨先前 傳出以衛福部長陳時中呼聲最高,但此波疫情爆發以來民怨四起,讓陳時中相關民調直直落,是否還能參選北市長,已不無疑問。而在昨日播出的政論節目中,陳時中接受訪問,當被問及如果要選台北市長的話,大概什麼時候會下定決心?或者告訴大家?陳時中回答「不要啦,現在我都說問疫情讓你問到飽,問選情請你去問別人」。 陳時中昨在政論節目《新台灣加油》,被問到何時才要確定要不要參選時,表示民調高低都與防疫相關,所以成也防疫敗也防疫,所以現在唯一重要,「對我重要的一件事就是把防疫做好,畢竟這是關鍵的一役」。 主持人再追問,現在政策目標是與病毒共存,那長期來講,防疫記者會搞不好未來會收攤,那我們回歸到一般的運作,是不是部長比較有機會投入北市選戰?陳時中先大笑幾聲,接著說「我們還是來講那個大家講說與病毒共存,政策有他的條件方法時機...」。對於選不選,沒有鬆口。",https://www.chinatimes.com/realtimenews/20220601001438-260407,中時,政治,莊雅婷
,飛官徐大鈞殉職 侯友宜:給予最高慰問,"空軍少尉飛官徐大鈞殉職,他是新北市民,新北市長侯友宜表示,徐大鈞是最英勇的國軍戰士,他身為新北市長,感同哀痛,第一時間除請民政局到家關懷,也致電給在南部的大鈞媽媽,新北不管在行政上、殯葬會給予全力協助,並給予最高慰問金,感念他為國捐軀。 侯友宜說,徐大鈞最讓他敬佩,是他在最危險一刻,仍不忘保護人民,守著安全,造成自己不幸殉職,非常感念他。",https://www.chinatimes.com/realtimenews/20220601001698-260407,中時,政治,葉德正
,遭控是天虹副總法律顧問事務所創辦人 羅秉成最新回應了,"天虹科技羅姓副總不當違規左轉撞死機車騎士,曾擔任顏寬恒競選團隊發言人的張禹宣昨天在臉書貼文稱,原來天虹科技公司的法律顧問是「弘理法律事務所」,而「弘理法律事務所」的創辧人正是行政院發言人羅秉成。對此,羅秉成今天開記者會澄清,他早在六年前就裸退,事務所事務跟他無關,若有憑有據請提出,用這樣不當連結很不好。 羅秉成指出,這件事情從頭到尾都沒有打電話給警方跟相關人員,請不要做不當影射,更沒有必要政治操作,他做為行政院發言人,媒體若有相關質疑,隨時可以向他查證。 羅秉成說,很多事情被不當惡意連結,造成不必要的風波,這件事就事論事,一分證據說一分話,不要胡亂指控,這時代走過必留下痕跡, 對於是否提告捍衛清白,羅秉成說,他做為律師要告人不困難,但這不是解決問題好的方式,他選擇出面把事情講清楚,媒體沒有求證就報導感到遺憾。羅秉成強調,今天出面澄清後,希望大家適可而止,不要徒增困惱,如果往後再有惡意抹黑甚至影響名譽,就不排除提告。 羅秉成說,早在6年前他就從律師事務所裸退,而且他現在做為公務員,怎麼可能還有營業行為,這樣的連結實在太跳躍。 另外,傳出民進黨有意提名羅秉成參選新竹市長,羅秉成表示,沒有這件事,他已經多次說明無意參選,尊重民進黨相關安排,但他對選舉事務沒有介入也不瞭解,更沒有意願。",https://www.chinatimes.com/realtimenews/20220601001660-260407,中時,政治,林縉明
,避免三腳督傳「新竹換台北」蔣萬安說話了,"年底九合一大選,台北市選情「三腳督」態勢明朗,國民黨高層過去曾拋出「新竹換北市」的議題再度發酵,國民黨台北市長提名人蔣萬安1日表示,對他最重要的就是爭取多數市民支持與信任,讓大家成為他未來推動市政強而有力的後盾,才是他爭取的目標。 過去國民黨高層曾提出禮讓民眾黨參選新竹市,換民眾黨禮讓國民黨選北市,也就是立委高虹安換蔣萬安,避免北市、新竹市雙雙出三腳督,最後藍白兩敗俱傷。 蔣萬安今出席士林區仁勇里端午節活動,外界認為是積極搶攻士北選票,蔣萬表示,先前也常來士林、北投拜訪里長,在地也有非常多優秀藍營議員在地方服務,非常扎實,對他來說沒有所謂艱困、不艱困選區,每個選區都很重要,他也非常珍惜、把握每一個跟市民互動的機會。 面對「新竹換台北」,蔣萬安指出,對他最重要的就是爭取多數市民支持與信任,讓大家成為他未來推動市政強而有力的後盾,才是他爭取的目標。 外界好奇近來推出2支政績影片,盼選民關注這2年政績的意味濃厚,蔣萬安說,不只這2年,包括過去6年,這2屆在立法院持續問政、監督政府,幫民眾發聲得到大家的肯定,連續7個會期受到公督盟評鑑最優秀立委,在地方上也感受到民眾對他這麼多年下來,在地方協助民眾解決問題,大家給他很正面的反應,包括這幾年下來地方免費法律諮詢,和議員合作辦會勘解決地方問題,這次疫情也在萬華提出相關心理諮詢服務,就是希望能協助民眾、照顧弱勢,並發起愛心待用餐,還有今年開始這麼疫情,和議員到醫療院所提供醫護愛心餐、防疫物資,希望持續做讓民眾感受到服務熱誠。 此外,面對北市副市長黃珊珊可能不披民眾黨戰袍參選市長,蔣萬安回應,可能是黃珊珊或民眾黨自己要評估跟討論。",https://www.chinatimes.com/realtimenews/20220601001656-260407,中時,政治,張立勳
,批政府遭轟騙選票 蔣萬安:在現有基礎集思廣益加入更多元素,"促轉會提出改善中正紀念堂方案,國民黨台北市長提名人蔣萬安痛批政府吃飽太閒,228關懷紀念會批蔣騙選票、打臉自己是假掰的政治人物。蔣萬安1日表示,絕對不容許任何一個個人、政黨、少數官員就可以片面改變,主張在現有基礎上,大家集思廣益加入更多元素。 蔣萬安今早出席北市士林區仁勇里端午節活動,面對228關懷紀念會批評騙選票,蔣萬安表示,中正紀念堂是台北市民共同記憶,也是歷史的一部分,絕對不容許任何一個個人、政黨、少數官員就可以片面改變。 蔣萬安強調,他主張在現有基礎上,大家集思廣益加入更多元素,而既有基礎就是不容許有任何改變。 此外,中央在中正紀念堂設大型兒童疫苗施打站,遭台北市長柯文哲痛批白痴。蔣萬安則認為,防疫不分藍綠、中央地方,希望中央和地方能加強溝通,防疫就是希望讓民眾安全度過這波危機,相關疫苗施打站的設置、規畫,相信中央有相關整體考量,地方負責執行,只要動線安排好,不管是讓快篩陽民眾進來透過醫生評估給藥,或安排兒童疫苗施打,希望在這段期間大家彼此體諒,讓大家安全度過疫情。 外界好奇會否擔心未來當上市長後遭中央出招對付,蔣萬安說,中央、地方真的應該好好溝通,防疫不分中央或地方、藍綠,大家共同齊心努力,希望中央地方好好溝通,做整體規畫,否則相關防疫工作只會事倍功辦,非常可惜。",https://www.chinatimes.com/realtimenews/20220601001546-260407,中時,政治,張立勳
,天虹副總撞死人關說案 他爆與羅秉成關係匪淺,"天虹科技副總羅偉瑞駕車撞死機車騎士,卻爆出警界關說,警政署昨加重懲處涉案警官。國民黨文傳會副主委黃子哲卻發現,負責督導警政的行政院發言人羅秉成與羅偉瑞疑關係匪淺,且羅秉成是天虹的法律顧問,弘理法律事務所創辦人之一,羅秉成有無扮演任何角色,應說清楚講明白。 黃子哲說,天虹科技公司的法律顧問就是「弘理法律事務所」,而這間事務所的創辦人之一,正是羅秉成,羅秉成在此案是否有扮演任何角色?是否有提供諮詢指導?在背後操縱?利用職權施壓?外界不得而知。 黃子哲也查出,有位「羅偉瑞」與嘉義市湖內里有地緣關係,而羅秉成家鄉正是嘉義市湖子內,也就是現在的湖內里,這種巧合令人好奇,莫非羅偉瑞與羅秉成之間,是兄弟或親戚關係?還是同宗家族?抑或是同里鄰居? 黃子哲表示,當然也可能此羅偉瑞非肇事的羅偉瑞,但公開資料可構成合理懷疑,羅秉成有必要說清楚講明白,因爲羅秉成有督導警政業務,與警政署有上下的權力關係,本案多位高階警官離奇的「熱心」幫忙,有人陪羅偉瑞做筆錄、幫忙轉發聲明稿。 黃子哲質疑,刑事局副局長黃家琦澄清說,致電只是單純對「友人」表達關心,到底要有多深厚的交情,才能讓堂堂刑事局副局長親自致電關心,還是這個友人,其實只是長官「交辦的朋友」,如果黃家琦也是被施壓的對象,應該要勇敢當個吹哨者,把背後的「藏鏡人」或「影舞者」給揪出來,才能將功折罪。 黃子哲說,多位高階警官介入「關心」一件車禍事故案,甚至賠上了記過處分,實在太不尋常,恐有不少貓膩,絕對不能只有這樣懲處就想帶過,最重要的就是向上追查源頭,政風、廉政、檢調、監察院等單位,該認真辦件大案了,給被害家屬及社會大眾一個交代。",https://www.chinatimes.com/realtimenews/20220601001536-260407,中時,政治,周毓翔
,新黨質疑雙城論壇舉辦條件 蔣萬安:互信基礎上務實交流,"國民黨台北市長提名人蔣萬安提出3主張才辦雙城論壇,遭新黨質疑不太妥當,若不更改就不支持,甚至認為蔣是跟著綠營走。蔣萬安1日表示,民眾期待的是在互信基礎上,兩岸之間能夠和平相處、務實交流。 蔣萬安日前提出中共不再擾台、對台灣釋出善意、雙方地位對等,在這前提下才辦雙城論壇,不過,新黨質疑這樣的主張不太妥當,若不改就不支持參選市長。 蔣萬安今指出,無論是對岸或任何其他國家,對於台灣安全或區域和平造成武力威脅的舉動都應該停止,民眾期待的是在互信基礎上,兩岸之間能夠和平相處務實交流。 至於新黨認為蔣萬安的主張是跟著綠營走,蔣萬安強調,民眾期待的是兩岸之間在互信基礎上能和平相處、務實交流,但民眾也相信不管是對岸或任何其他國家,對台灣安全區域和平造成威脅的舉動都應該要阻止。",https://www.chinatimes.com/realtimenews/20220601001507-260407,中時,政治,張立勳
,陳時中最新民調出乎意料!網驚疑「小數點標錯」全暴動了,"本土疫情持續升溫,引發民眾擔憂。一份最新民調指出,針對中央流行疫情指揮中心指揮官陳時中在此波疫情中的防疫指揮表現,有56.6%民眾感到不滿意,41.3%民眾感到滿意。此結果引發熱議,不少網友對於陳的表現還有41.3%滿意度感到吃驚,更有人忍不住質疑:「小數點標錯?」 根據《東森新媒體ETtoday》昨日(5月31日)公布最新民調,有56.6%民眾對於陳時中,在此波疫情中的防疫指揮表現感到不滿意(非常不滿意34.7%、不太滿意21.9%),另有41.3%民眾感到滿意(非常滿意13.2%、還算滿意28.1%),另有2.0%民眾表示「不知道/沒意見」。 調查結果也顯示,69.9%的民眾認為目前政府的防疫政策混亂(非常混亂41.6%、有點混亂28.3%);28.5%的民眾認為政策明確(非常明確10.0%、還算明確18.5%);另有1.7%民眾表示「不知道/沒意見」。 此消息引發熱議,網友湧入《中時新聞網》與臉書相關連結留言:「怎麼還有41.3%滿意?」「這數字有錯嗎?還有近半民眾感到滿意?」「小數點標錯?」「應該是4.13%才對吧」、「超傻眼的結果,這就叫做『死忠的』」、「難怪民近黨有底氣,因為無論如何就是有這群」。",https://www.chinatimes.com/realtimenews/20220601001352-260407,中時,政治,王子瑄
,56.6%不滿陳時中防疫表現 這樣還能選?學者直接打槍,"根據最新一項民調結果顯示,對於指揮官陳時中在此波疫情中的防疫指揮表現,有56.6%民眾感到不滿意。依此,陳時中若仍真的想選市長,可能嗎?東海大學地方自治研究中心執行長潘兆民昨(5月31日)分析,依此種不滿意度,「他幾乎很難有機會再繼續選下去了」。 根據《東森新媒體ETtoday》民調中心昨公布,民眾對於陳時中在此波疫情中的防疫指揮表現,有56.6%感到不滿意,41.3%滿意。至於在防疫政策滾動式調整方面,民眾對於政府兒童疫苗、快篩試劑、確診者就醫安排與照護、抗病毒藥物此四項防疫政策與準備,不滿意程度均達六成以上。 潘兆民昨接受《中天新聞》訪問時談到,過去我們防疫表現過度自滿,外國媒體最近不論是彭博社也好,也批評台灣過去防疫表現過分自滿,在部署上面卻嚴重的不足,「想要解封但你的部署在哪裡」?民眾看不到。另外,兒童疫苗更是家長最揪心的一個議題,例如最近位藝人因提出許多孩子死亡的問題,結果主管單位不去處理如何解除家長憂心,反而要去罰誰在放假消息,都引發不滿。 潘兆民分析,如果陳時中在防疫表現上面沒有辦法控制,也沒有站在家長焦慮的心態,用苦民之苦的心態去解決問題,還是一天到晚雄辯的話,「我覺得他會變民進黨的累贅」。 至於被問及假設陳時中未來真的想選的話,有機會嗎?潘兆民認為,按照現階段這樣的不滿意度,不斷地在升高的話,我的看法是「他幾乎很難有機會再繼續選下去了」。",https://www.chinatimes.com/realtimenews/20220601001122-260407,中時,政治,莊雅婷
,鄭寶清回應張善政:選舉不應以私利出發,"候選人為了私利企圖影響別人投票,不會得到選民支持!只有提出具體政策,真心關心人民,才能獲得認同! 國民黨桃園市長候選人張善政昨天前往桃園市楊梅區請益之旅,張善政公開表示,「票別投民進黨,也別投民眾黨,團結把票數拉高」,對此,民進黨桃園市長參選人鄭寶清回應張善政,在疫情嚴峻期間,應該多關心民眾的健康問題,而不是只為私利,利用媒體來操弄選舉話題。 鄭寶清強調,服務選民並非一蹴可及,而是靠著每天一步一腳印腳踏實地了解桃園人的需求,進而提出有利人民的政見,而不是為了選票,口出驚人說出這些不恰當的言論。 鄭寶清發揮客家硬頸精神表示,即便民進黨近日眾多紛擾及國民黨令人詫異的言論,面對這些內憂外患,他仍秉持認真、負責的態度面對選民,不會受到外界影響繼續深耕地方。",https://www.chinatimes.com/realtimenews/20220601001397-260407,中時,政治,綜合報導
,麥寮鄉長選舉參選爆炸 縣議員林建鴻宣布投入,"現任雲林縣議會國民黨團總召、麥寮鄉籍雲林縣議員林建鴻今(1日)在臉書宣布參加年底麥寮鄉長選舉,迄今已有4人宣布參選,麥寮鄉將是雲林縣本屆鄉鎮市長選舉最激戰的地區。林建鴻表示,因本屆鄉長選舉而誕生的廢票聯盟使年輕人的思想覺醒,今年底中間選民有機會抉擇麥寮鄉的未來發展。 林建鴻今天早上在臉書宣布正式宣布投入年底鄉長的選舉,對他這不僅是責任的提升,也是對麥寮的承擔,請鄉親做他的後盾,為麥寮一起打拚。 他表示,議員任期內,除交通、水利諸多建設外,大家對他的交待時刻謹記在心,本屆議員任期結束,原可選擇相對容易的議員連任選舉,在多方考量及對麥寮責任及使命感催促下,他義無反顧勇敢投入。他知道這是場艱辛的挑戰,沒有樂觀的權利。 林建鴻受訪表示,本屆鄉長選舉出現廢票聯盟,讓很多年輕人思想覺醒,這對麥寮來講是一個很好的起點,如果有個人想要改變麥寮、讓麥寮做一個整體規畫,鄉親可以有不同的選擇。 林建鴻說,他覺得應該要讓中間選民特別是30歲到50歲的年輕人有機會抉擇麥寮未來的發展、下一代子孫怎麼走? 他表示,麥寮是全台前五大年輕鄉鎮,麥寮有環境與經費做全鄉雙語教育,這是鄉公所應該做的事;麥寮鄉預算相當多,他希望推動參與式預算,讓老百姓參與預算編列,使預算透明化;另外麥寮鄉近年發展速度快,需要做好整體城鄉規畫。 林建鴻曾任麥寮鄉新吉村長、3屆雲林縣議員,現任雲林縣議會國民黨團總召的他,因黨內提名登記已結束,將以無黨籍參選,也是第4位宣布參選麥寮鄉長的人選。 其餘4人包括民進黨籍縣議員許志豪、尋求連任的蔡長昆、前鄉長許忠富、無黨籍政治素人林宜豊,可謂參選爆炸。 其中有民進黨籍的3人,許志豪於今年初宣布放棄民進黨黨內初選,直接投入鄉長選舉;現任鄉長蔡長昆未參與黨內提名登記;許忠富則有參與黨內登記。",https://www.chinatimes.com/realtimenews/20220601001289-260407,中時,政治,周麗蘭
